race_id,Date,race_number,Racecourse,Placing,Horse No.,horse_name,horse_id,Jockey,Gear,Comment,source_url,scrape_ts
2026020110,2026-02-01,10,ST,8,7,TOURBILLON PRINCE,HK_2022_H122,R Kingscote,CP/TT,"Average to begin, raced in 2nd, 2 wide, there to turn, challenged the leader early in straight, peaked 200M, weakened final 100M.",https://racing.hkjc.com/en-us/local/information/corunning?date=20260201&raceno=10,2026-04-26T03:49:14Z
2026020110,2026-02-01,10,ST,1,8,LUCKY SAM GOR,HK_2024_K114,C L Chau,XB,"Taken back from gate 10, raced towards rear on the outside, 5 lengths or so back turning in, finished off very strongly to score.",https://racing.hkjc.com/en-us/local/information/corunning?date=20260201&raceno=10,2026-04-26T03:49:14Z
2026020110,2026-02-01,10,ST,6,9,THE RED HARE,HK_2024_K312,M Guyon,H/P/TT,"Taken back from gate 13, raced at tail, 6-1/2L back turning in, made good progress in straight without threatening. (See Racing Incidents.)",https://racing.hkjc.com/en-us/local/information/corunning?date=20260201&raceno=10,2026-04-26T03:49:14Z
2026020111,2026-02-01,11,ST,7,1,MID WINTER WIND,HK_2024_K208,H Bowman,--,"Dropped out from wide draw, still plenty to do top of home straight, ran on well final 200m.",https://racing.hkjc.com/en-us/local/information/corunning?date=20260201&raceno=11,2026-04-26T03:49:14Z
2026020111,2026-02-01,11,ST,8,10,THRIVING BROTHERS,HK_2023_J396,A Badel,TT,"Chased leader, challenged leader top of home straight, flattened out final 100m.",https://racing.hkjc.com/en-us/local/information/corunning?date=20260201&raceno=11,2026-04-26T03:49:14Z
2026020111,2026-02-01,11,ST,9,11,POWER OF VITAM,HK_2025_L171,A Atzeni,--,"Sluggish start, rail position in rear of mid-field, under pressure top of home straight, unable to quicken.",https://racing.hkjc.com/en-us/local/information/corunning?date=20260201&raceno=11,2026-04-26T03:49:14Z
2026020111,2026-02-01,11,ST,4,12,WITHOUT COMPARE,HK_2025_L151,H T Mo,TT,"Raced in touch with leaders, chased along on bend, stayed on for pressure.",https://racing.hkjc.com/en-us/local/information/corunning?date=20260201&raceno=11,2026-04-26T03:49:14Z
2026020111,2026-02-01,11,ST,11,13,FLUORESCENCE,HK_2025_L124,Y L Chung,TT1,"Settled in mid-field, some headway on bend, outpaced and left behind final 300m.",https://racing.hkjc.com/en-us/local/information/corunning?date=20260201&raceno=11,2026-04-26T03:49:14Z
2026020111,2026-02-01,11,ST,10,14,BUCEPHALAS,HK_2024_K096,M Chadwick,XB/TT,"Dropped out from widest draw, still in last place entering home straight, checked 300m out, some late gains.",https://racing.hkjc.com/en-us/local/information/corunning?date=20260201&raceno=11,2026-04-26T03:49:14Z
2026020111,2026-02-01,11,ST,2,2,SIX PACK,HK_2024_K061,L Ferraris,B,"Tracked leaders against rail, unable to secure clear run until final 100m, stayed on well but no threat to winner.",https://racing.hkjc.com/en-us/local/information/corunning?date=20260201&raceno=11,2026-04-26T03:49:14Z
2026020111,2026-02-01,11,ST,5,3,EVERYONE'S STAR,HK_2024_K172,C Y Ho,H,"In rear out wide, pushed along widest into home straight, ran on strongly.",https://racing.hkjc.com/en-us/local/information/corunning?date=20260201&raceno=11,2026-04-26T03:49:14Z
2026020111,2026-02-01,11,ST,12,4,DARYL FLASH,HK_2025_L168,M F Poon,--,"Raced wide towards rear of mid-field, pushed along wide into home straight, lacked pace to challenge.",https://racing.hkjc.com/en-us/local/information/corunning?date=20260201&raceno=11,2026-04-26T03:49:14Z
2026020111,2026-02-01,11,ST,6,5,RIDING TOGETHER,HK_2024_K081,L Hewitson,V2/TT,"Showed speed to get across, headed by winner 200m out, weakened final 100m, tight for room final 50m.",https://racing.hkjc.com/en-us/local/information/corunning?date=20260201&raceno=11,2026-04-26T03:49:14Z
2026020111,2026-02-01,11,ST,1,6,SUPER EXPRESS,HK_2024_K245,M Guyon,TT,"Tracked pace out wide without cover, quickened early in home straight to lead 200m out, on top from there, hung in final 200m.",https://racing.hkjc.com/en-us/local/information/corunning?date=20260201&raceno=11,2026-04-26T03:49:14Z
2026020111,2026-02-01,11,ST,14,7,SO YOU WILL,HK_2025_L172,D Probert,TT,"Three wide in mid-field, struggled to hold position on bend, left behind home straight.",https://racing.hkjc.com/en-us/local/information/corunning?date=20260201&raceno=11,2026-04-26T03:49:14Z
2026020111,2026-02-01,11,ST,3,8,SUNNY DA BEST,HK_2023_J118,H Bentley,TT,"In rear after awkward start, clear run 400m out, ran on well final 200m to close on leaders.",https://racing.hkjc.com/en-us/local/information/corunning?date=20260201&raceno=11,2026-04-26T03:49:14Z
2026020111,2026-02-01,11,ST,13,9,LEAPING STAR,HK_2025_L189,M L Yeung,--,"Rail position in mid-field, ridden top of home straight, no impression.",https://racing.hkjc.com/en-us/local/information/corunning?date=20260201&raceno=11,2026-04-26T03:49:14Z
2026020401,2026-02-04,1,HV,2,1,GOOD LUCK HAPPY,HK_2024_K301,Z Purton,TT,"Began only fairly, raced 2 wide behind midfield, 5 lengths back turning in, no daylight early in straight, made good progress final 200M to take 2nd, no threat to the winner. (See Racing Incidents.)",https://racing.hkjc.com/en-us/local/information/corunning?date=20260204&raceno=1,2026-04-26T03:49:14Z
2026020401,2026-02-04,1,HV,6,10,LEGENDARY IMPACT,HK_2024_K035,A Badel,B/TT,"Began well, raced prominently on the outside, a length back turning in, kept on well early in straight, peaked 100M, weakened gradually thereafter.",https://racing.hkjc.com/en-us/local/information/corunning?date=20260204&raceno=1,2026-04-26T03:49:14Z
2026020401,2026-02-04,1,HV,12,11,CALL TO COMMAND,HK_2023_J243,M Guyon,H-/CP/TT,"Away with them, trapped 4 wide in midfield, no cover throughout, weakened early in straight when hard run took toll. (Roarer.) (Mucus.)",https://racing.hkjc.com/en-us/local/information/corunning?date=20260204&raceno=1,2026-04-26T03:49:14Z
2026020401,2026-02-04,1,HV,7,12,COUNTRY DANCER,HK_2022_H436,M Chadwick,E,"Taken back from the widest draw, raced at rear on the inside, saved ground on turn, no clear run until final 100M, made no progress thereafter.",https://racing.hkjc.com/en-us/local/information/corunning?date=20260204&raceno=1,2026-04-26T03:49:14Z
2026020401,2026-02-04,1,HV,3,2,GREAT SPIRIT,HK_2023_J155,A Atzeni,CP,"Away well, raced in midfield on the inside, saved ground on turn, kept to inside after straightening and finished off evenly.",https://racing.hkjc.com/en-us/local/information/corunning?date=20260204&raceno=1,2026-04-26T03:49:14Z
2026020401,2026-02-04,1,HV,9,3,PACKING KING,HK_2024_K570,C L Chau,--,"Began well, raced 2 wide, a length or so back, there to turn, peaked early in straight, weakened inside final furlong.",https://racing.hkjc.com/en-us/local/information/corunning?date=20260204&raceno=1,2026-04-26T03:49:14Z
2026020401,2026-02-04,1,HV,4,4,REWARDING BUDDY,HK_2023_J373,K C Leung,--,"Commenced well, raced 3 wide with cover in midfield, 2 to 3 lengths back turning in, finished off evenly.",https://racing.hkjc.com/en-us/local/information/corunning?date=20260204&raceno=1,2026-04-26T03:49:14Z
2026020401,2026-02-04,1,HV,10,5,SMART FIGHTER,HK_2022_H278,K Teetan,TT,"Jumped awkwardly and lost ground, raced 2 wide in midfield, travelled keenly in the middle stages, 3 lengths or so back turning in, showed limited response early in straight, weakened final 100M.",https://racing.hkjc.com/en-us/local/information/corunning?date=20260204&raceno=1,2026-04-26T03:49:14Z
2026020401,2026-02-04,1,HV,8,6,ZEPHYR,HK_2024_K414,L Hewitson,TT,"Taken back from gate 9, raced 2 wide at rear, commenced move 400M, very wide turning in, made some headway in straight.",https://racing.hkjc.com/en-us/local/information/corunning?date=20260204&raceno=1,2026-04-26T03:49:14Z
2026020401,2026-02-04,1,HV,1,7,SOMELOVEFROMABOVE,HK_2023_J503,J Orman,PC,"Began well from gate 1, sent forward to take the lead, led by a length turning in, kept on very well in straight and scored.",https://racing.hkjc.com/en-us/local/information/corunning?date=20260204&raceno=1,2026-04-26T03:49:14Z
2026020401,2026-02-04,1,HV,11,8,RAINBOW SEVEN,HK_2024_K145,C Y Ho,B/TT1,"Jumped awkwardly and lost ground, raced behind midfield on the inside, saved ground on turn, unable to obtain clear run in straight.",https://racing.hkjc.com/en-us/local/information/corunning?date=20260204&raceno=1,2026-04-26T03:49:14Z
2026020401,2026-02-04,1,HV,5,9,GAMEPLAYER ELITE,HK_2022_H356,H Bentley,SR/TT,"Jumped with them, raced towards rear on the outside, slightly improved on turn, made some progress in straight.",https://racing.hkjc.com/en-us/local/information/corunning?date=20260204&raceno=1,2026-04-26T03:49:14Z
2026020402,2026-02-04,2,HV,6,1,FATAL BLOW,HK_2023_J484,H Bowman,B/TT,"Bumped leaving stalls, settled in mid-field, not best of runs in home straight when trying to improve, one paced under pressure.",https://racing.hkjc.com/en-us/local/information/corunning?date=20260204&raceno=2,2026-04-26T03:49:14Z
2026020402,2026-02-04,2,HV,11,10,GIMME FIVE,HK_2023_J099,D Probert,B,"Shifted out and heavily bumped out of stalls, disputed lead 700m out, ridden top of home straight, dropped away quickly final 200m.",https://racing.hkjc.com/en-us/local/information/corunning?date=20260204&raceno=2,2026-04-26T03:49:14Z
2026020402,2026-02-04,2,HV,12,11,NAMJONG KINGDOM,HK_2024_K015,L Hewitson,SR/TT,"Held up last, still in last place top of home straight, outpaced and left behind home straight.",https://racing.hkjc.com/en-us/local/information/corunning?date=20260204&raceno=2,2026-04-26T03:49:14Z
2026020402,2026-02-04,2,HV,4,12,POWER SUMMIT,HK_2024_K044,K Teetan,CP,"Raced in rear against rail, some headway final bend, closed on leaders late on but always held.",https://racing.hkjc.com/en-us/local/information/corunning?date=20260204&raceno=2,2026-04-26T03:49:14Z
2026020402,2026-02-04,2,HV,1,2,VICTOR THE RAPID,HK_2023_J393,C L Chau,B/TT,"Rail position in mid-field, good headway final bend, challenged up rail from 300m out, ran on strongly to lead final 100m.",https://racing.hkjc.com/en-us/local/information/corunning?date=20260204&raceno=2,2026-04-26T03:49:14Z
2026020402,2026-02-04,2,HV,5,3,FORTUNE SUPERNOVA,HK_2024_K287,K C Leung,B/TT,"Settled in rear of mid-field, pushed along wide into home straight, stayed on but unable to get on terms with leaders.",https://racing.hkjc.com/en-us/local/information/corunning?date=20260204&raceno=2,2026-04-26T03:49:14Z
2026020402,2026-02-04,2,HV,3,4,GIANT BALLON,HK_2024_K451,Z Purton,CP/TT,"Ridden along from stalls to track leaders, taken wider entering home straight, stayed on well but unable to match front two.",https://racing.hkjc.com/en-us/local/information/corunning?date=20260204&raceno=2,2026-04-26T03:49:14Z
2026020402,2026-02-04,2,HV,9,5,MAJESTIC LIFE,HK_2025_L085,Y L Chung,TT,"Dropped out from wide draw, still in rear top of home straight, no impression.",https://racing.hkjc.com/en-us/local/information/corunning?date=20260204&raceno=2,2026-04-26T03:49:14Z
2026020402,2026-02-04,2,HV,2,6,JOLLY COMPANION,HK_2022_H454,C Y Ho,B/TT,"Shifted out and heavily bumped out of stalls, raced in touch with leaders, smooth headway final bend against rail, ran on well to lead narrowly 200m out, headed by winner 100m out.",https://racing.hkjc.com/en-us/local/information/corunning?date=20260204&raceno=2,2026-04-26T03:49:14Z
2026020402,2026-02-04,2,HV,7,7,LOVING VIBES,HK_2023_J359,M Guyon,B,"Tracked leaders early stages, dropped to race in touch with leaders 700m out, checked 300m out, weakened final 100m.",https://racing.hkjc.com/en-us/local/information/corunning?date=20260204&raceno=2,2026-04-26T03:49:14Z
2026020402,2026-02-04,2,HV,8,8,PRIDE BELIEVER,HK_2024_K501,A Badel,--,"Raced in rear, switched wide when trying to improve 500m out, lacked pace to challenge.",https://racing.hkjc.com/en-us/local/information/corunning?date=20260204&raceno=2,2026-04-26T03:49:14Z
2026020402,2026-02-04,2,HV,10,9,FLASH STAR,HK_2024_K431,R Kingscote,H/TT,"Ridden along from widest draw to lead, joined 700m out, under pressure to hold position 400m out, gave ground quickly final 200m.",https://racing.hkjc.com/en-us/local/information/corunning?date=20260204&raceno=2,2026-04-26T03:49:14Z
2026020403,2026-02-04,3,HV,6,1,MOMENTS IN TIME,HK_2022_H474,Z Purton,TT,"Settled midfield, not much impression made.",https://racing.hkjc.com/en-us/local/information/corunning?date=20260204&raceno=3,2026-04-26T03:49:14Z
2026020403,2026-02-04,3,HV,5,2,HELENE FEELING,HK_2022_H215,H Bowman,B/TT,"Settled midfield, held up rounding the Turn, one pace to the finish.",https://racing.hkjc.com/en-us/local/information/corunning?date=20260204&raceno=3,2026-04-26T03:49:14Z
2026020403,2026-02-04,3,HV,3,3,HUGE WAVE,HK_2023_J197,A Badel,TT,"Sat towards rear, traveled smoothly, made steady progress when asked.",https://racing.hkjc.com/en-us/local/information/corunning?date=20260204&raceno=3,2026-04-26T03:49:14Z
2026020403,2026-02-04,3,HV,7,4,KAHOLO ANGEL,HK_2022_H216,E C W Wong,TT,"Settled towards rear, improved inside 800M, could not be ridden out when positioned close to heels (See Incident Report).",https://racing.hkjc.com/en-us/local/information/corunning?date=20260204&raceno=3,2026-04-26T03:49:14Z
2026020403,2026-02-04,3,HV,8,5,NEW FOREST,HK_2024_K094,L Hewitson,TT,"Ridden along to lead, gave ground quickly entering the Straight (See Incident Report).",https://racing.hkjc.com/en-us/local/information/corunning?date=20260204&raceno=3,2026-04-26T03:49:14Z
2026020403,2026-02-04,3,HV,2,6,SOLEIL FIGHTER,HK_2023_J127,M Guyon,XB-/TT1,"Sat handy, responded reasonably well under whip, had every chance.",https://racing.hkjc.com/en-us/local/information/corunning?date=20260204&raceno=3,2026-04-26T03:49:14Z
2026020403,2026-02-04,3,HV,1,7,AWESOME FLUKE,HK_2023_J050,A Atzeni,P/TT,"Chased the leader, traveled strongly, switched out rounding the Turn, closed off strongly.",https://racing.hkjc.com/en-us/local/information/corunning?date=20260204&raceno=3,2026-04-26T03:49:14Z
2026020403,2026-02-04,3,HV,4,8,SILVERY BREEZE,HK_2024_K057,K Teetan,CP/TT,"Sat rear, traveled fairly, ran on evenly.",https://racing.hkjc.com/en-us/local/information/corunning?date=20260204&raceno=3,2026-04-26T03:49:14Z
2026020404,2026-02-04,4,HV,5,1,YOUNG BRAVO,HK_2024_K178,J Orman,CP/XB,"Towards rear of mid-field, stayed on amongst horses final 150m.",https://racing.hkjc.com/en-us/local/information/corunning?date=20260204&raceno=4,2026-04-26T03:49:14Z
2026020404,2026-02-04,4,HV,7,10,KINGLY DEMEANOR,HK_2022_H486,M L Yeung,TT,"Made running, headed 200m out, no extra final 100m.",https://racing.hkjc.com/en-us/local/information/corunning?date=20260204&raceno=4,2026-04-26T03:49:14Z
2026020404,2026-02-04,4,HV,9,11,FLOOF,HK_2022_H432,K Teetan,--,"Waited with in rear, keen early, some headway 200m out, no extra final 100m.",https://racing.hkjc.com/en-us/local/information/corunning?date=20260204&raceno=4,2026-04-26T03:49:14Z
2026020404,2026-02-04,4,HV,1,12,STORM RUNNER,HK_2023_J452,A Atzeni,PC1/TT,"Wide early, taken forward and raced prominently, ridden to lead 200m out, stayed on well to hold on.",https://racing.hkjc.com/en-us/local/information/corunning?date=20260204&raceno=4,2026-04-26T03:49:14Z
2026020404,2026-02-04,4,HV,10,2,NEARLY FINE,HK_2020_E430,L Ferraris,CP-/B2/TT,"Mid-field, pushed along 400m out, wide into home straight, no extra final 100m.",https://racing.hkjc.com/en-us/local/information/corunning?date=20260204&raceno=4,2026-04-26T03:49:14Z
2026020404,2026-02-04,4,HV,8,3,AMAZING GAZE,HK_2024_K444,Z Purton,CP,"Tracked leaders, pushed along into home straight, switched inside over 200m out, tight for room final 100m, unable to be ridden out fully.",https://racing.hkjc.com/en-us/local/information/corunning?date=20260204&raceno=4,2026-04-26T03:49:14Z
2026020404,2026-02-04,4,HV,3,4,HAKKA RADIANCE,HK_2023_J105,H Bowman,TT,"Mid-field, quickened to challenge 150m out, no extra and lost second final 50m.",https://racing.hkjc.com/en-us/local/information/corunning?date=20260204&raceno=4,2026-04-26T03:49:14Z
2026020404,2026-02-04,4,HV,6,5,OCEAN IMPACT,HK_2023_J502,C L Chau,B,"Towards rear, widest final bend, stayed on, unable to reach leaders.",https://racing.hkjc.com/en-us/local/information/corunning?date=20260204&raceno=4,2026-04-26T03:49:14Z
2026020404,2026-02-04,4,HV,11,6,CAN'T GO WONG,HK_2022_H087,M Guyon,B/TT,"Tracked pace, three wide, weakened final 200m.",https://racing.hkjc.com/en-us/local/information/corunning?date=20260204&raceno=4,2026-04-26T03:49:14Z
2026020404,2026-02-04,4,HV,2,7,TAKE ACTION,HK_2023_J098,B Avdulla,B,"Dropped in from widest draw and raced in last place, headway amongst horses from 200m out, stayed on well, still gaining on winner at line.",https://racing.hkjc.com/en-us/local/information/corunning?date=20260204&raceno=4,2026-04-26T03:49:14Z
2026020404,2026-02-04,4,HV,12,8,GLORIOUS RYDER,HK_2024_K290,L Hewitson,B/TT,"Held up, struggling entering home straight, left behind.",https://racing.hkjc.com/en-us/local/information/corunning?date=20260204&raceno=4,2026-04-26T03:49:14Z
2026020404,2026-02-04,4,HV,3,9,SMART CITY,HK_2023_J213,M F Poon,CP/XB,"Tracked pace, angled off rail to challenge over 200m out, stuck to task under pressure.",https://racing.hkjc.com/en-us/local/information/corunning?date=20260204&raceno=4,2026-04-26T03:49:14Z
2026020405,2026-02-04,5,HV,9,1,AESTHETICISM,HK_2022_H289,Z Purton,--,"Taken back from gate 11, raced at rear on the outside, bumped near 700M, 7 lengths back turning in, showed limited response in straight, kept on same pace to the line.",https://racing.hkjc.com/en-us/local/information/corunning?date=20260204&raceno=5,2026-04-26T03:49:14Z
2026020405,2026-02-04,5,HV,10,10,INCANTO STAR,HK_2024_K343,J Orman,B1,"Bumped on jumping, positioned 2 wide behind midfield, angled out after passing 500M, very wide turning in, peaked early in straight, weakened thereafter. (See Racing Incidents.)",https://racing.hkjc.com/en-us/local/information/corunning?date=20260204&raceno=5,2026-04-26T03:49:14Z
2026020405,2026-02-04,5,HV,11,11,ICONICAL,HK_2023_J504,L Hewitson,TT-,"Jumped well from the widest draw, sent forward to race in 2nd, 2 wide, there to turn, peaked on run 350M, weakened early in straight, eased inside final furlong.",https://racing.hkjc.com/en-us/local/information/corunning?date=20260204&raceno=5,2026-04-26T03:49:14Z
2026020405,2026-02-04,5,HV,2,12,VIVACIOUS WIN,HK_2024_K223,K Teetan,CP/TT,"Jumped awkwardly, raced in midfield on the inside, saved ground on turn, kept to inside after straightening and finished off well to take 2nd, always held.",https://racing.hkjc.com/en-us/local/information/corunning?date=20260204&raceno=5,2026-04-26T03:49:14Z
2026020405,2026-02-04,5,HV,5,2,WIN EASE,HK_2024_K384,M L Yeung,TT,"Bumped start, positioned 7 lengths behind the leader on the inside, moved a bit closer along the rail on turn, made minor progress in straight.",https://racing.hkjc.com/en-us/local/information/corunning?date=20260204&raceno=5,2026-04-26T03:49:14Z
2026020405,2026-02-04,5,HV,7,3,CALIFORNIA MOXIE,HK_2023_J131,H Bowman,B/TT,"Shifted out at start and made contact, raced at rear on the inside, bumped near 700M, saved ground on turn, made good progress early in straight, peaked 100M, weakened gradually close home.",https://racing.hkjc.com/en-us/local/information/corunning?date=20260204&raceno=5,2026-04-26T03:49:14Z
2026020405,2026-02-04,5,HV,3,4,FORZA TORO,HK_2024_K355,E C W Wong,TT,"Began only fairly from gate 1, positioned 1-1/2L behind the leader on the inside, made contact near 600M, same position on turn, kept on well early in straight, peaked 100M, ran on evenly to the line.",https://racing.hkjc.com/en-us/local/information/corunning?date=20260204&raceno=5,2026-04-26T03:49:14Z
2026020405,2026-02-04,5,HV,4,5,GLORIOUS JOURNEY,HK_2023_J137,C Y Ho,TT,"Taken back from gate 10, raced 2 wide towards rear, 5 to 6 lengths back turning in, finished off well to make frame without threatening the first few.",https://racing.hkjc.com/en-us/local/information/corunning?date=20260204&raceno=5,2026-04-26T03:49:14Z
2026020405,2026-02-04,5,HV,8,6,SURE JOYFUL,HK_2021_G125,M Guyon,TT,"Began well, raced 2 wide better than midfield, bumped near 600M, angled out 400M, showed limited response early in straight, peaked 150M, weakened gradually thereafter.",https://racing.hkjc.com/en-us/local/information/corunning?date=20260204&raceno=5,2026-04-26T03:49:14Z
2026020405,2026-02-04,5,HV,6,7,TURIN WARRIOR,HK_2021_G150,M F Poon,XB,"Made contact at start, raced behind midfield on the inside, angled out approaching 400M, finished off evenly.",https://racing.hkjc.com/en-us/local/information/corunning?date=20260204&raceno=5,2026-04-26T03:49:14Z
2026020405,2026-02-04,5,HV,1,8,STORMI,HK_2024_K084,C L Chau,CP/TT,"Clean jump, sent forward to take the lead, led by 3/4L, travelled well to turn, kept on strongly to the line and scored.",https://racing.hkjc.com/en-us/local/information/corunning?date=20260204&raceno=5,2026-04-26T03:49:14Z
2026020405,2026-02-04,5,HV,12,9,RAINBOW WARRIOR,HK_2024_K348,K C Leung,CP/TT,"Began awkwardly, raced 2 wide in midfield, 4 lengths back, peaked on run 400M, weakened thereafter. (Lame right front leg next day morning.)",https://racing.hkjc.com/en-us/local/information/corunning?date=20260204&raceno=5,2026-04-26T03:49:14Z
2026020406,2026-02-04,6,HV,8,1,RED ELEGANCE,HK_2022_H241,L Ferraris,B,"Taken back to last from gate 10, ridden quietly, made up some ground over the final stages.",https://racing.hkjc.com/en-us/local/information/corunning?date=20260204&raceno=6,2026-04-26T03:49:15Z
2026020406,2026-02-04,6,HV,7,10,PARENTS' LOVE,HK_2022_H405,Y L Chung,H/TT,"Quickest away from the stalls and straight to the lead, setting fast sectionals, stuck to the task until the last 75m, passed by some strong-finishing rivals thereafter.",https://racing.hkjc.com/en-us/local/information/corunning?date=20260204&raceno=6,2026-04-26T03:49:15Z
2026020406,2026-02-04,6,HV,4,11,PI LEGEND,HK_2025_L117,Z Purton,TT,"Sat midfield the rail with a charmed run, held position but no pace to challenge the top three.",https://racing.hkjc.com/en-us/local/information/corunning?date=20260204&raceno=6,2026-04-26T03:49:15Z
2026020406,2026-02-04,6,HV,11,2,WHIZZ KID,HK_2020_E392,H Bowman,V/TT,"Away well from the widest draw, covered ground throughout, swung widest for home, unable to sustain run final stages.",https://racing.hkjc.com/en-us/local/information/corunning?date=20260204&raceno=6,2026-04-26T03:49:15Z
2026020406,2026-02-04,6,HV,3,3,LOVE TOGETHER,HK_2025_L052,C Y Ho,TT,"Average to begin, urged along early stages to stay in touch with the field 4 back the fence, dashed home when winner was off and gone.",https://racing.hkjc.com/en-us/local/information/corunning?date=20260204&raceno=6,2026-04-26T03:49:15Z
2026020406,2026-02-04,6,HV,2,4,ETERNAL FORTUNE,HK_2024_K010,E C W Wong,B/TT,"Began awkwardly, momentarily racing wide without cover before ridden along to be outside the leader, battled on well but just couldn't hold off the winner over final 50m (See Incident Report).",https://racing.hkjc.com/en-us/local/information/corunning?date=20260204&raceno=6,2026-04-26T03:49:15Z
2026020406,2026-02-04,6,HV,1,5,CANDLELIGHT DINNER,HK_2023_J468,M Guyon,H,"Away swiftly, tracked speed one off the rail, loomed up 150m out and quickened nicely to score, despite laying in over the final stages.",https://racing.hkjc.com/en-us/local/information/corunning?date=20260204&raceno=6,2026-04-26T03:49:15Z
2026020406,2026-02-04,6,HV,10,6,METRO POWER,HK_2024_K408,L Hewitson,B,"Bounced away nicely, 2 lengths or so on the leader's back, checked 350m out, struggled to pick up momentum and soon after dropped away (See Incident Report).",https://racing.hkjc.com/en-us/local/information/corunning?date=20260204&raceno=6,2026-04-26T03:49:15Z
2026020406,2026-02-04,6,HV,5,7,HEY BROS,HK_2025_L150,K Teetan,TT-,"Settled towards the rear, slightly drifted back rounding the home turn, made good late progress final stages.",https://racing.hkjc.com/en-us/local/information/corunning?date=20260204&raceno=6,2026-04-26T03:49:15Z
2026020406,2026-02-04,6,HV,9,8,IRON SECURITY,HK_2025_L174,K C Leung,B-/TT-,"Jumped ok and sat midfield one off, failed to find extra gear to close off his first race in Hong Kong.",https://racing.hkjc.com/en-us/local/information/corunning?date=20260204&raceno=6,2026-04-26T03:49:15Z
2026020406,2026-02-04,6,HV,6,9,ACE CHAMPION,HK_2024_K379,R Kingscote,P-/TT,"Broke awkwardly and settled 2nd last after crowded at the start, accelerated only until the last 50m, beaten less than 3L.",https://racing.hkjc.com/en-us/local/information/corunning?date=20260204&raceno=6,2026-04-26T03:49:15Z
2026020407,2026-02-04,7,HV,1,1,ROMANTIC SON,HK_2023_J537,H Bentley,CP,"Pressed forward after moderate start from the widest draw, settled in 9th 3-wide with cover, became 10th past 700M, obtained clear passage down the centre of track over 200M out, finished off strongly to snatch victory final strides.",https://racing.hkjc.com/en-us/local/information/corunning?date=20260204&raceno=7,2026-04-26T03:49:15Z
2026020407,2026-02-04,7,HV,6,10,IGOR STRAVINSKY,HK_2024_K086,Y L Chung,B/TT,"Pressed forward from a poor draw reaching within 1L of pace 3-wide in 4th briefly early in back straight, drifted 2L back to joint 4th in middle stages, fought on steadily without threatening in straight.",https://racing.hkjc.com/en-us/local/information/corunning?date=20260204&raceno=7,2026-04-26T03:49:15Z
2026020407,2026-02-04,7,HV,11,11,CAPTAIN LINK,HK_2024_K515,A Badel,TT,Never a factor though producing some late impression in home straight.,https://racing.hkjc.com/en-us/local/information/corunning?date=20260204&raceno=7,2026-04-26T03:49:15Z
2026020407,2026-02-04,7,HV,7,12,ENDEARED,HK_2022_H161,A Atzeni,XB,"Settled towards rear, saved ground on the inside turning in for home, ran on in straight, never nearer.",https://racing.hkjc.com/en-us/local/information/corunning?date=20260204&raceno=7,2026-04-26T03:49:15Z
