race_id,Date,race_number,Racecourse,Placing,Horse No.,horse_name,horse_id,Jockey,Gear,Comment,source_url,scrape_ts
2026011803,2026-01-18,3,ST,10,5,CASA OF HONOR,HK_2024_K310,M F Poon,--,"Prominent early, unable to sustain and dropped away swiftly in the final stages.",https://racing.hkjc.com/en-us/local/information/corunning?date=20260118&raceno=3,2026-04-26T03:49:09Z
2026011803,2026-01-18,3,ST,3,6,BUNDLE OF CHARM,HK_2021_G213,A Badel,--,"Began well, let the speed go towards centre of course, responded well when asked.",https://racing.hkjc.com/en-us/local/information/corunning?date=20260118&raceno=3,2026-04-26T03:49:09Z
2026011803,2026-01-18,3,ST,11,7,TACTICAL VICTORY,HK_2024_K521,M L Yeung,B2,"Away awkwardly and always at rear, detached in the last 300M, never involved.",https://racing.hkjc.com/en-us/local/information/corunning?date=20260118&raceno=3,2026-04-26T03:49:09Z
2026011803,2026-01-18,3,ST,1,8,CITY GOLD BANNER,HK_2025_L155,Z Purton,TT1,"Broke ok from gate 5, settled towards the rear with cover, switched course 250M out, swept past them and never looked back from there.",https://racing.hkjc.com/en-us/local/information/corunning?date=20260118&raceno=3,2026-04-26T03:49:09Z
2026011803,2026-01-18,3,ST,6,9,E HO HO,HK_2025_L119,C Y Ho,TT,"In rear after sluggish start, raced keenly 700M out, held when checked near 250M, recovered well and made up steady ground (See Incident Report).",https://racing.hkjc.com/en-us/local/information/corunning?date=20260118&raceno=3,2026-04-26T03:49:09Z
2026011804,2026-01-18,4,ST,10,1,TAOGETHER,HK_2024_K520,M Guyon,--,"Wide in mid-field, pushed along and lost position over 400m out, no impression.",https://racing.hkjc.com/en-us/local/information/corunning?date=20260118&raceno=4,2026-04-26T03:49:09Z
2026011804,2026-01-18,4,ST,7,10,FLYING AMANI,HK_2024_K152,Z Purton,XB,"Waited with in rear after crowded leaving stalls, headway 300m out, hung right, one paced final 150m.",https://racing.hkjc.com/en-us/local/information/corunning?date=20260118&raceno=4,2026-04-26T03:49:09Z
2026011804,2026-01-18,4,ST,13,11,NAMJONG KINGDOM,HK_2024_K015,A Badel,SR/TT,"Mid-division, pushed along 400m out, no headway, weakened final 200m.",https://racing.hkjc.com/en-us/local/information/corunning?date=20260118&raceno=4,2026-04-26T03:49:09Z
2026011804,2026-01-18,4,ST,2,12,ABSOLUTE HONOUR,HK_2024_K260,A Atzeni,B/TT,"Tracked leader, driven 350m out and slightly outpaced, stayed on well and improved to hold every chance final 100m.",https://racing.hkjc.com/en-us/local/information/corunning?date=20260118&raceno=4,2026-04-26T03:49:09Z
2026011804,2026-01-18,4,ST,8,13,WINNING DIAMOND,HK_2024_K216,M L Yeung,--,"Dropped in from wide draw after sluggish start, raced in last pair, stayed on into mid-division, never dangerous.",https://racing.hkjc.com/en-us/local/information/corunning?date=20260118&raceno=4,2026-04-26T03:49:09Z
2026011804,2026-01-18,4,ST,3,14,WIN SPEED,HK_2023_J205,K Teetan,V,"Chased leader, pushed to front 200m out, no extra and headed final 50m.",https://racing.hkjc.com/en-us/local/information/corunning?date=20260118&raceno=4,2026-04-26T03:49:09Z
2026011804,2026-01-18,4,ST,6,2,DEVAS TWELVE,HK_2022_H435,M Chadwick,TT,"Crossed from wide draw to make running, headed over 200m out, no extra and lost ground final 100m.",https://racing.hkjc.com/en-us/local/information/corunning?date=20260118&raceno=4,2026-04-26T03:49:09Z
2026011804,2026-01-18,4,ST,5,3,EMBRACE ABERDEEN,HK_2025_L020,M F Poon,--,"Raced in touch with leaders, unable to quicken over 300m out, stuck to task, lacked speed to challenge.",https://racing.hkjc.com/en-us/local/information/corunning?date=20260118&raceno=4,2026-04-26T03:49:09Z
2026011804,2026-01-18,4,ST,1,4,LUCKY TWIN STARS,HK_2024_K126,C L Chau,CP,"Pushed along early, settled in rear, picked up strongly 300m out and good headway, sustained run to lead final 50m.",https://racing.hkjc.com/en-us/local/information/corunning?date=20260118&raceno=4,2026-04-26T03:49:09Z
2026011804,2026-01-18,4,ST,4,5,RAGING RAPIDS,HK_2023_J228,B Avdulla,TT,"Dropped in from wide draw and raced in last pair, commenced run behind winner 400m out, unable to match that rival but stayed on.",https://racing.hkjc.com/en-us/local/information/corunning?date=20260118&raceno=4,2026-04-26T03:49:09Z
2026011804,2026-01-18,4,ST,14,6,POWER PATCH,HK_2025_L100,K C Leung,--,"Tracked pace three wide, keen early, quickly lost place turning into home straight, soon well held.",https://racing.hkjc.com/en-us/local/information/corunning?date=20260118&raceno=4,2026-04-26T03:49:09Z
2026011804,2026-01-18,4,ST,9,7,LEADING AGILITY,HK_2024_K553,D B McMonagle,H/TT,"Mid-field, brief effort 400m out, soon flattened out, no threat to leaders.",https://racing.hkjc.com/en-us/local/information/corunning?date=20260118&raceno=4,2026-04-26T03:49:09Z
2026011804,2026-01-18,4,ST,11,8,ONE LOVE,HK_2024_K584,H Bentley,E,"Towards rear of mid-field, short of room and unable to obtain clear run 400m out to 200m out, no threat after.",https://racing.hkjc.com/en-us/local/information/corunning?date=20260118&raceno=4,2026-04-26T03:49:09Z
2026011804,2026-01-18,4,ST,12,9,CIRCUIT CENTURY,HK_2024_K308,R Kingscote,B/XB,"Mid-field, ridden along into home straight and unable to hold position, weakened.",https://racing.hkjc.com/en-us/local/information/corunning?date=20260118&raceno=4,2026-04-26T03:49:09Z
2026011805,2026-01-18,5,ST,13,1,DAILY TROPHY,HK_2022_H283,E C W Wong,TT,"Began well, raced towards rear on outer, hampered near 850M, still well back on turn, made no progress in the run home.",https://racing.hkjc.com/en-us/local/information/corunning?date=20260118&raceno=5,2026-04-26T03:49:09Z
2026011805,2026-01-18,5,ST,10,10,LEAN MASTER,HK_2022_H134,H Bentley,B/TT,"Began smartly from a wide draw, sent forward to take the lead, led by 3/4L turning in, peaked and headed 300M, weakened inside final furlong.",https://racing.hkjc.com/en-us/local/information/corunning?date=20260118&raceno=5,2026-04-26T03:49:09Z
2026011805,2026-01-18,5,ST,9,11,VICTORY CHAMPION,HK_2024_K240,K C Leung,CP,"Jumped with them, raced at rear on the outside, 8 lengths or so back, same margin back turning in, passed some tired runners in straight. (See Racing Incidents.) (Blood in trachea.)",https://racing.hkjc.com/en-us/local/information/corunning?date=20260118&raceno=5,2026-04-26T03:49:09Z
2026011805,2026-01-18,5,ST,6,12,VIVA FIRECRACKER,HK_2025_L065,M Chadwick,TT,"Jumped with them, raced 2 wide in midfield, steadied near 850M, 4 lengths back turning in, showed limited response early in straight, ran on evenly to the line.",https://racing.hkjc.com/en-us/local/information/corunning?date=20260118&raceno=5,2026-04-26T03:49:09Z
2026011805,2026-01-18,5,ST,11,13,MASTER OF HUMOR,HK_2024_K281,M L Yeung,CP1/TT-,"Bumped start and unbalanced, raced in midfield on the inside, saved ground on turn, peaked early in straight, weakened final 250M. (See Racing Incidents.)",https://racing.hkjc.com/en-us/local/information/corunning?date=20260118&raceno=5,2026-04-26T03:49:09Z
2026011805,2026-01-18,5,ST,5,14,RIDING HIGH,HK_2023_J403,L Hewitson,CP,"Began well from a wide draw, raced prominently on the outside, 3/4L back turning in, took the lead 300M, peaked and headed 200M, weakened final 150M.",https://racing.hkjc.com/en-us/local/information/corunning?date=20260118&raceno=5,2026-04-26T03:49:09Z
2026011805,2026-01-18,5,ST,3,2,SOLID CAR,HK_2024_K058,K Teetan,B1,"Out with rest, raced 2 wide behind midfield, steadied near 850M, wider turning in, finished off well to take a place without threatening the first two.",https://racing.hkjc.com/en-us/local/information/corunning?date=20260118&raceno=5,2026-04-26T03:49:09Z
2026011805,2026-01-18,5,ST,7,3,CLOUD NINE,HK_2025_L050,L Ferraris,XB,"Shifted in at start and bumped, raced better than midfield on the inside, saved ground on turn, no clear run after turning in, bumped 300M and 200M, found daylight approaching 100M, made no progress thereafter.",https://racing.hkjc.com/en-us/local/information/corunning?date=20260118&raceno=5,2026-04-26T03:49:09Z
2026011805,2026-01-18,5,ST,2,4,CONRAD PATCH,HK_2025_L106,C L Chau,TT1,"Average to begin, raced 2 wide better than midfield, there to turn, bumped near 300M, kept on well in straight to take 2nd, no threat to the winner.",https://racing.hkjc.com/en-us/local/information/corunning?date=20260118&raceno=5,2026-04-26T03:49:09Z
2026011805,2026-01-18,5,ST,14,5,EXTRAORDINARY GALL,HK_2024_K561,M F Poon,--,"Began only fairly, raced at rear on the inside, angled out after passing 500M, 9 lengths back turning in, failed to make any progress in straight. (Lame left front leg next day morning.)",https://racing.hkjc.com/en-us/local/information/corunning?date=20260118&raceno=5,2026-04-26T03:49:09Z
2026011805,2026-01-18,5,ST,1,6,HOT DELIGHT,HK_2024_K583,C Y Ho,TT1,"Jumped awkwardly, taken back to race behind midfield on the outside, moved a bit closer on turn, 3-1/2L back turning in, showed very good response in straight, hit the front 200M, kept on strongly to the line.",https://racing.hkjc.com/en-us/local/information/corunning?date=20260118&raceno=5,2026-04-26T03:49:09Z
2026011805,2026-01-18,5,ST,4,7,MALPENSA,HK_2024_K545,J Orman,TT,"Made contact with the right side of its starting gate on jumping, raced at rear, 9 lengths or so back, still 7 lengths or so back turning in, made good progress in straight without threatening.",https://racing.hkjc.com/en-us/local/information/corunning?date=20260118&raceno=5,2026-04-26T03:49:09Z
2026011805,2026-01-18,5,ST,8,8,MEGA MASTERMIND,HK_2025_L044,B Avdulla,B/TT,"Away with them, raced 2 wide towards rear, 7 lengths back turning in, kept on same pace in straight.",https://racing.hkjc.com/en-us/local/information/corunning?date=20260118&raceno=5,2026-04-26T03:49:09Z
2026011805,2026-01-18,5,ST,12,9,FLYING CHRISTIE,HK_2024_K483,A Atzeni,H-/B/TT,"Moderately away from a wide draw, raced in midfield on outer, 3 lengths back turning in, peaked early in straight, weakened thereafter.",https://racing.hkjc.com/en-us/local/information/corunning?date=20260118&raceno=5,2026-04-26T03:49:09Z
2026011806,2026-01-18,6,ST,6,1,TOP TIME,HK_2024_K006,Z Purton,--,"Settled near midfield 2 wide, no luck in the Straight, ran on fairly.",https://racing.hkjc.com/en-us/local/information/corunning?date=20260118&raceno=6,2026-04-26T03:49:09Z
2026011806,2026-01-18,6,ST,13,10,SUPER MASTERMIND,HK_2024_K541,K Teetan,CP1/TT,"Sat off pace 3 wide, never a threat.",https://racing.hkjc.com/en-us/local/information/corunning?date=20260118&raceno=6,2026-04-26T03:49:09Z
2026011806,2026-01-18,6,ST,7,11,KINGLY DEMEANOR,HK_2022_H486,M Chadwick,TT,"Sat behind the leaders, just one pace when asked.",https://racing.hkjc.com/en-us/local/information/corunning?date=20260118&raceno=6,2026-04-26T03:49:09Z
2026011806,2026-01-18,6,ST,2,12,AMAZING FUN,HK_2022_H442,H Bentley,TT,"Sat towards the rear 2 wide, stayed on late, just missed.",https://racing.hkjc.com/en-us/local/information/corunning?date=20260118&raceno=6,2026-04-26T03:49:09Z
2026011806,2026-01-18,6,ST,9,13,DASHING MAURISON,HK_2024_K374,R Kingscote,CP,"Caught 4 wide no cover midfield, limited response in the Straight.",https://racing.hkjc.com/en-us/local/information/corunning?date=20260118&raceno=6,2026-04-26T03:49:09Z
2026011806,2026-01-18,6,ST,11,14,DR GOLDEN GENERAL,HK_2024_K412,M L Yeung,P/TT,"Sat last, switched out in the Straight, made little impression.",https://racing.hkjc.com/en-us/local/information/corunning?date=20260118&raceno=6,2026-04-26T03:49:09Z
2026011806,2026-01-18,6,ST,5,2,NYX GLUCK,HK_2024_K438,C L Chau,--,"Settled in front of midfield 2 wide, no clear run early part of the Straight, kept on.",https://racing.hkjc.com/en-us/local/information/corunning?date=20260118&raceno=6,2026-04-26T03:49:09Z
2026011806,2026-01-18,6,ST,3,3,THOUSAND SPIRIT,HK_2024_K365,L Hewitson,--,"Not the quickest out, settled behind midfield 3 wide, stayed on without threatening top 2. (See Incident Report)",https://racing.hkjc.com/en-us/local/information/corunning?date=20260118&raceno=6,2026-04-26T03:49:09Z
2026011806,2026-01-18,6,ST,12,4,ALABAMA SONG,HK_2024_K480,A Atzeni,H,"Sat on pace 2 wide, weakened in the Straight. (See Incident Report)",https://racing.hkjc.com/en-us/local/information/corunning?date=20260118&raceno=6,2026-04-26T03:49:09Z
2026011806,2026-01-18,6,ST,1,5,AMAZING PARTNERS,HK_2024_K554,C Y Ho,TT,"Settled midfield 3 wide, angled out in the Straight, closed off strongly, held off a late challenger.",https://racing.hkjc.com/en-us/local/information/corunning?date=20260118&raceno=6,2026-04-26T03:49:09Z
2026011806,2026-01-18,6,ST,8,6,VICTOR SUPREME,HK_2024_K547,D B McMonagle,V1,"Sat near the rear on the rail, never seriously tested when held up early, made decent ground late.",https://racing.hkjc.com/en-us/local/information/corunning?date=20260118&raceno=6,2026-04-26T03:49:09Z
2026011806,2026-01-18,6,ST,4,7,CIRCUIT GOGO,HK_2025_L002,M F Poon,--,"Sat midfield on the rail, held up top of the Straight, closed off okay late.",https://racing.hkjc.com/en-us/local/information/corunning?date=20260118&raceno=6,2026-04-26T03:49:09Z
2026011806,2026-01-18,6,ST,10,8,GIMME FIVE,HK_2023_J099,D Probert,B,"Sent forward to lead, weakened final furlong.",https://racing.hkjc.com/en-us/local/information/corunning?date=20260118&raceno=6,2026-04-26T03:49:09Z
2026011806,2026-01-18,6,ST,14,9,GOLDEN FORTUNE,HK_2024_K500,K C Leung,CP1,"Sat on pace 3 wide, weakened and faded in the Straight. (See Incident Report)",https://racing.hkjc.com/en-us/local/information/corunning?date=20260118&raceno=6,2026-04-26T03:49:09Z
2026011807,2026-01-18,7,ST,8,1,AEROVOLANIC,HK_2024_K400,M Guyon,CP,"Travelled keenly one-back on rail in 4th, became 3rd in similar position rounding home bend, kept on until weakened out of contention 100M out.",https://racing.hkjc.com/en-us/local/information/corunning?date=20260118&raceno=7,2026-04-26T03:49:09Z
2026011807,2026-01-18,7,ST,14,10,STAR ELEGANCE,HK_2024_K536,K C Leung,XB/CP1,"Improved steadily to one back 4-wide with cover early stages, 3-wide without cover onto home bend, soon weakened after straightening.",https://racing.hkjc.com/en-us/local/information/corunning?date=20260118&raceno=7,2026-04-26T03:49:09Z
2026011807,2026-01-18,7,ST,10,11,ACE,HK_2024_K307,K Teetan,CP/TT,"Close up early, drifted back to 6th about 1100M out, further back in 8th rounding home bend, did not find much room 200M out, made no further impression in closing stages.",https://racing.hkjc.com/en-us/local/information/corunning?date=20260118&raceno=7,2026-04-26T03:49:09Z
2026011807,2026-01-18,7,ST,6,12,AMAZING DUCK,HK_2022_H392,R Kingscote,TT,"Began well from the one draw and soon took up running, held narrow advantage most of the way until weakened out of contention over 100M out.",https://racing.hkjc.com/en-us/local/information/corunning?date=20260118&raceno=7,2026-04-26T03:49:09Z
2026011807,2026-01-18,7,ST,7,13,MAZING GRACE,HK_2024_K166,M L Yeung,H/TT1,"Travelled keenly just over 2L back in 6th, drifted slightly further off the pace around home bend, shied away from horse 250M out, kept on steadily without quickening.",https://racing.hkjc.com/en-us/local/information/corunning?date=20260118&raceno=7,2026-04-26T03:49:09Z
2026011807,2026-01-18,7,ST,11,14,NINJA DERBY,HK_2022_H339,L Hewitson,--,"Broke well to share early lead, taken one-out-one-back to 5th onto home bend, came under pressure upon straightening but steadily faded.",https://racing.hkjc.com/en-us/local/information/corunning?date=20260118&raceno=7,2026-04-26T03:49:09Z
2026011807,2026-01-18,7,ST,1,2,FLOW WATER FLOW,HK_2024_K562,D B McMonagle,B,"Settled 3-wide in rear of midfield from a poor draw, inconvenienced 350M out, ran on dourly under pressure to gain upper hand close to home.",https://racing.hkjc.com/en-us/local/information/corunning?date=20260118&raceno=7,2026-04-26T03:49:09Z
2026011807,2026-01-18,7,ST,9,3,BEAUTY VIVA,HK_2024_K155,H Bentley,TT,"Soon dropped to last few 3-wide despite ridden early, came under pressure rounding home bend, produced modest late impression past well-beaten horses closing stages.",https://racing.hkjc.com/en-us/local/information/corunning?date=20260118&raceno=7,2026-04-26T03:49:09Z
2026011807,2026-01-18,7,ST,3,4,AMAZING GAZE,HK_2024_K444,Z Purton,CP,"Began well from the widest draw and amongst leaders 3-wide, gained 2-wide position alongside leader over 900M out, held every chance and hit the front momentarily over 100M out, soon found no extra.",https://racing.hkjc.com/en-us/local/information/corunning?date=20260118&raceno=7,2026-04-26T03:49:09Z
2026011807,2026-01-18,7,ST,2,5,THE GOLDEN KNIGHT,HK_2024_K341,J Orman,XB,"Soon recovered to midfield from moderate start, slightly further back home bend, not much room early in straight, obtained a run between runners 200M out and responded well to hit the front 50M out, caught close home.",https://racing.hkjc.com/en-us/local/information/corunning?date=20260118&raceno=7,2026-04-26T03:49:09Z
2026011807,2026-01-18,7,ST,13,6,BLOSSOMY,HK_2025_L037,M F Poon,--,"Settled in midfield on rail, saved ground turning in for home, faded steadily inside final 150M.",https://racing.hkjc.com/en-us/local/information/corunning?date=20260118&raceno=7,2026-04-26T03:49:09Z
2026011807,2026-01-18,7,ST,4,7,RELIABLE DAD,HK_2025_L006,A Badel,XB1,"Settled well behind and waited with, commenced move on rail rounding home bend reaching 9th entering straight, sustained progress between runners down the inside to be nearest at finish.",https://racing.hkjc.com/en-us/local/information/corunning?date=20260118&raceno=7,2026-04-26T03:49:09Z
2026011807,2026-01-18,7,ST,5,8,SMART FAT CAT,HK_2024_K280,C Y Ho,CP/H/TT,"Settled in last few one off the rail, drifted backward rounding home bend, shifted wide for a run into straight, finished off the race well inside final 200M.",https://racing.hkjc.com/en-us/local/information/corunning?date=20260118&raceno=7,2026-04-26T03:49:09Z
2026011807,2026-01-18,7,ST,12,9,KYRUS TREASURE,HK_2024_K300,C L Chau,CP/TT,"Settled in last few from a poor draw, never seen with a chance.",https://racing.hkjc.com/en-us/local/information/corunning?date=20260118&raceno=7,2026-04-26T03:49:09Z
2026011808,2026-01-18,8,ST,12,1,JUMBO TREASURE,HK_2024_K249,K C Leung,CP/TT,"From draw 13 showed customary pace to cross to the lead , became immediately under pressure when challenged by rival nearing 300M before giving ground.",https://racing.hkjc.com/en-us/local/information/corunning?date=20260118&raceno=8,2026-04-26T03:49:10Z
2026011808,2026-01-18,8,ST,14,10,AUTOMATED,HK_2024_K177,R Kingscote,TT,"Jumped on terms, dropped back to race at the rear 8-9Ls back, couldn't go on in the straight. Soundly beaten.",https://racing.hkjc.com/en-us/local/information/corunning?date=20260118&raceno=8,2026-04-26T03:49:10Z
2026011808,2026-01-18,8,ST,4,11,GOLDENTRONICMIGHTY,HK_2024_K002,M L Yeung,B/TT,"Shifted in at the start and was bumped, recovered to race in midfield, kept on evenly passing 400M for a respectable 4th.",https://racing.hkjc.com/en-us/local/information/corunning?date=20260118&raceno=8,2026-04-26T03:49:10Z
2026011808,2026-01-18,8,ST,11,12,LET'S HAVE FUN,HK_2025_L118,E C W Wong,CP/TT1,"Jumped only fairly, dropped back and raced greenly in the rear, brought wide into straight, failed to run on final 400M.",https://racing.hkjc.com/en-us/local/information/corunning?date=20260118&raceno=8,2026-04-26T03:49:10Z
2026011808,2026-01-18,8,ST,6,13,QUARTZ LEGEND,HK_2024_K548,C Y Ho,TT,"Dropped back to near last 7Ls off the pace, ran on mildly final 400M but was never a serious threat to leaders.",https://racing.hkjc.com/en-us/local/information/corunning?date=20260118&raceno=8,2026-04-26T03:49:10Z
2026011808,2026-01-18,8,ST,7,14,GIANT LEAP,HK_2023_J143,M F Poon,B,"Jumped well, caught wide no cover chasing leaders, battled on one-paced under pressure in the straight. No threat to leaders final 150M.",https://racing.hkjc.com/en-us/local/information/corunning?date=20260118&raceno=8,2026-04-26T03:49:10Z
2026011808,2026-01-18,8,ST,3,2,LIFELINE EXPRESS,HK_2022_H439,D B McMonagle,E,"Settled down behind midfield 4-5Ls back, ran on well in the straight for 3rd but not able to challenge first two late stages.",https://racing.hkjc.com/en-us/local/information/corunning?date=20260118&raceno=8,2026-04-26T03:49:10Z
2026011808,2026-01-18,8,ST,5,3,HAROLD WIN,HK_2023_J280,C L Chau,V/XB,"Away well from draw 1, shared lead early stages before drifting back to sit ahead of midfield, held up 400M-300M before closing off the race steadily .",https://racing.hkjc.com/en-us/local/information/corunning?date=20260118&raceno=8,2026-04-26T03:49:10Z
2026011808,2026-01-18,8,ST,2,4,AURIO,HK_2024_K056,J Orman,SR/TT,"From wide draw taken back towards the rear, unable to slot in raced wide without cover, 6Ls to make up 400M, ran on powerfully final 250M to claim 2nd, nearest finish.",https://racing.hkjc.com/en-us/local/information/corunning?date=20260118&raceno=8,2026-04-26T03:49:10Z
2026011808,2026-01-18,8,ST,10,5,IGOR STRAVINSKY,HK_2024_K086,M Chadwick,B/TT,"Jumped only fairly, positioned ahead of midfield on settling, couldn't accelerate enough in the straight, well held by leaders final 200M.",https://racing.hkjc.com/en-us/local/information/corunning?date=20260118&raceno=8,2026-04-26T03:49:10Z
2026011808,2026-01-18,8,ST,9,6,DANICA'S CHOICE,HK_2025_L096,K Teetan,CP-,"Jumped only fairly, reserved towards the rear on inside, 7Ls to make up 400M, made limited progress towards the line.",https://racing.hkjc.com/en-us/local/information/corunning?date=20260118&raceno=8,2026-04-26T03:49:10Z
2026011808,2026-01-18,8,ST,1,7,PEGAS,HK_2025_L075,M Guyon,TT,"Jumped well to be sharing the lead early stages, sat in 3rd from 900M, quickened up well on straightening, led mid-straight then kept on determinedly to score.",https://racing.hkjc.com/en-us/local/information/corunning?date=20260118&raceno=8,2026-04-26T03:49:10Z
2026011808,2026-01-18,8,ST,8,8,PI LEGEND,HK_2025_L117,Z Purton,B-/TT2,"Pressed forward from draw 14 and obtained a position outside the lead, placed under pressure 250M, lost 2nd near 100M before weakening rapidly late stages.",https://racing.hkjc.com/en-us/local/information/corunning?date=20260118&raceno=8,2026-04-26T03:49:10Z
2026011808,2026-01-18,8,ST,13,9,LUCKY TOGETHER,HK_2025_L079,A Badel,TT,"Settled down behind midfield 5-6Ls back, little change in position to the straight, didn't respond to riding from 400M.",https://racing.hkjc.com/en-us/local/information/corunning?date=20260118&raceno=8,2026-04-26T03:49:10Z
2026011809,2026-01-18,9,ST,3,1,JUNEAU PRIDE,HK_2023_J443,B Avdulla,H,"Bumped out of stalls, three wide in mid-field, some headway out wide on bend, sustained headway to challenge 200m out, beaten narrowly.",https://racing.hkjc.com/en-us/local/information/corunning?date=20260118&raceno=9,2026-04-26T03:49:10Z
2026011809,2026-01-18,9,ST,2,10,FLASH CURRENT,HK_2023_J500,M L Yeung,TT,"Waited with towards rear, switched inside for clear run top of home straight, ran on strongly final 300m, just failed.",https://racing.hkjc.com/en-us/local/information/corunning?date=20260118&raceno=9,2026-04-26T03:49:10Z
2026011809,2026-01-18,9,ST,4,11,OUTGATE,HK_2022_H113,M Guyon,TT,"Across to track leader, travelled smoothly to 400m out and challenged leader, stayed on well but crossed by front three 100m out.",https://racing.hkjc.com/en-us/local/information/corunning?date=20260118&raceno=9,2026-04-26T03:49:10Z
2026011809,2026-01-18,9,ST,13,12,REAL GENTLEMAN,HK_2024_K534,M Chadwick,H/CP2/TT,"Tracked leader, chased along bend to hold position, dropped away quickly 400m out, eased once well held.",https://racing.hkjc.com/en-us/local/information/corunning?date=20260118&raceno=9,2026-04-26T03:49:10Z
2026011809,2026-01-18,9,ST,11,13,FORZA TORO,HK_2024_K355,A Badel,TT,"Dropped out from wide draw without cover, taken widest into home straight, short-lived effort 300m out, no extra final 100m.",https://racing.hkjc.com/en-us/local/information/corunning?date=20260118&raceno=9,2026-04-26T03:49:10Z
2026011809,2026-01-18,9,ST,12,14,STELLAR SWIFT,HK_2023_J139,H Bentley,TT,"Three wide in rear of mid-field, ridden along out wide to hold position on bend, lacked pace to challenge.",https://racing.hkjc.com/en-us/local/information/corunning?date=20260118&raceno=9,2026-04-26T03:49:10Z
2026011809,2026-01-18,9,ST,10,2,GLITTERING LEGEND,HK_2025_L109,Z Purton,XB,"Rail position in mid-field, travelled smoothly into home straight, unable to pick up for pressure from 400m out, never dangerous.",https://racing.hkjc.com/en-us/local/information/corunning?date=20260118&raceno=9,2026-04-26T03:49:10Z
2026011809,2026-01-18,9,ST,14,3,FLAMING RABBIT,HK_2022_H257,J Orman,SR/XB,"Raced in touch with leaders, ridden top of home straight, soon well held and eased when detached 200m out.",https://racing.hkjc.com/en-us/local/information/corunning?date=20260118&raceno=9,2026-04-26T03:49:10Z
2026011809,2026-01-18,9,ST,7,4,TOURBILLON PRINCE,HK_2022_H122,R Kingscote,CP1/TT,"Bumped out of stalls, ridden along from stalls to track pace, chased along bend, flattened out final 100m.",https://racing.hkjc.com/en-us/local/information/corunning?date=20260118&raceno=9,2026-04-26T03:49:10Z
2026011809,2026-01-18,9,ST,6,5,MIGHTY MASTS,HK_2025_L153,A Atzeni,TT,"Dropped out from widest draw, forced to steady on heels 800m out, bumped 350m out, followed winner through 200m out, stayed on well.",https://racing.hkjc.com/en-us/local/information/corunning?date=20260118&raceno=9,2026-04-26T03:49:10Z
2026011809,2026-01-18,9,ST,8,6,CHILL EASY,HK_2025_L148,M F Poon,--,"Settled in mid-field, keen throughout, had to wait for run into home straight, bumped 350m out, stayed on well.",https://racing.hkjc.com/en-us/local/information/corunning?date=20260118&raceno=9,2026-04-26T03:49:10Z
