race_id,Date,race_number,Racecourse,Placing,Horse No.,horse_name,horse_id,Jockey,Gear,Comment,source_url,scrape_ts
2026022208,2026-02-22,8,ST,7,6,SUNLIGHT POWER,HK_2022_H244,C Y Ho,--,"From wide draw taken back to the rear, brought wide for his challenge turning home, lay in under pressure and couldn't quicken enough to challenge.",https://racing.hkjc.com/en-us/local/information/corunning?date=20260222&raceno=8,2026-04-26T03:49:19Z
2026022208,2026-02-22,8,ST,6,7,COPARTNER PRANCE,HK_2022_H408,J Orman,XB,"Quickly into stride, led and set fast pace to the straight, headed passing 400M, held 2nd to about 150M, no extra close home.",https://racing.hkjc.com/en-us/local/information/corunning?date=20260222&raceno=8,2026-04-26T03:49:19Z
2026022208,2026-02-22,8,ST,8,8,PATCH OF THETA,HK_2022_H485,M Guyon,XB,"In midfield early before moving closer to leaders from 1000M, caught racing wide no cover to the straight, run ended 300M and dropped out from contention.",https://racing.hkjc.com/en-us/local/information/corunning?date=20260222&raceno=8,2026-04-26T03:49:19Z
2026022208,2026-02-22,8,ST,5,9,RAGING BLIZZARD,HK_2022_H368,B Avdulla,P,"Jumped on terms, given a waiting ride towards the rear, ran on mildly from 400M and wasn't beaten far by the placegetters.",https://racing.hkjc.com/en-us/local/information/corunning?date=20260222&raceno=8,2026-04-26T03:49:19Z
2026022209,2026-02-22,9,ST,4,1,YOUNG EMPEROR,HK_2024_K011,L Ferraris,TT,"Waited with towards rear, unable to secure clear run until 200m out, ran on strongly final 200m.",https://racing.hkjc.com/en-us/local/information/corunning?date=20260222&raceno=9,2026-04-26T03:49:19Z
2026022209,2026-02-22,9,ST,7,10,EVER LUCK,HK_2024_K235,A Badel,CP,"Tracked pace out wide without cover, chased leaders into home straight, no extra final 200m.",https://racing.hkjc.com/en-us/local/information/corunning?date=20260222&raceno=9,2026-04-26T03:49:19Z
2026022209,2026-02-22,9,ST,9,2,ETERNAL FORTUNE,HK_2024_K010,E C W Wong,B/TT,"Shifted out and bumped exiting stalls, tracked leaders against rail, challenged up rail from 300m out, unable to quicken.",https://racing.hkjc.com/en-us/local/information/corunning?date=20260222&raceno=9,2026-04-26T03:49:19Z
2026022209,2026-02-22,9,ST,2,3,LIFELINE EXPRESS,HK_2022_H439,D B McMonagle,E,"Held up last, switched and followed winner through 300m out, ran on well to close on winner but always held.",https://racing.hkjc.com/en-us/local/information/corunning?date=20260222&raceno=9,2026-04-26T03:49:19Z
2026022209,2026-02-22,9,ST,1,4,COOL BOY,HK_2025_L014,Z Purton,CP/TT,"Settled in mid-field, smooth headway on bend, strong run to lead 200m out, on top from there.",https://racing.hkjc.com/en-us/local/information/corunning?date=20260222&raceno=9,2026-04-26T03:49:19Z
2026022209,2026-02-22,9,ST,5,5,LADY'S LOVE,HK_2025_L220,K Teetan,--,"Waited with in rear, pushed along 500m out, ran green, passed a few tiring rivals.",https://racing.hkjc.com/en-us/local/information/corunning?date=20260222&raceno=9,2026-04-26T03:49:19Z
2026022209,2026-02-22,9,ST,10,6,PRESTIGE WIN,HK_2025_L248,L Hewitson,B-/XB-,"Crowded at start, raced in touch with leaders, driven 400m out, short of room final 150m, unable to be ridden out to finish.",https://racing.hkjc.com/en-us/local/information/corunning?date=20260222&raceno=9,2026-04-26T03:49:19Z
2026022209,2026-02-22,9,ST,3,7,PACKING GLORY,HK_2025_L013,M Chadwick,CP,"Shifted in and bumped out of stalls, pressed leader, challenged leader top of home straight, stayed on but no further impression on front two late on.",https://racing.hkjc.com/en-us/local/information/corunning?date=20260222&raceno=9,2026-04-26T03:49:19Z
2026022209,2026-02-22,9,ST,8,8,COPARTNER FLEET,HK_2024_K342,A Atzeni,XB,"Rail position in mid-field, had to wait for room turning into home straight, lacked pace to challenge.",https://racing.hkjc.com/en-us/local/information/corunning?date=20260222&raceno=9,2026-04-26T03:49:19Z
2026022209,2026-02-22,9,ST,6,9,FUN N FUN TOGETHER,HK_2023_J232,M F Poon,B,"Jumped well, showed speed to get across, challenged by rivals early in home straight, weakened final 100m.",https://racing.hkjc.com/en-us/local/information/corunning?date=20260222&raceno=9,2026-04-26T03:49:19Z
2026022210,2026-02-22,10,ST,7,1,BEAUTY ALLIANCE,HK_2023_J260,Z Purton,--,"Away well, raced in 2nd, 2 wide, there to turn, showed limited response early in straight, weakened gradually final 150M.",https://racing.hkjc.com/en-us/local/information/corunning?date=20260222&raceno=10,2026-04-26T03:49:19Z
2026022210,2026-02-22,10,ST,9,10,SHAMZ,HK_2025_L097,Y L Chung,TT,"Taken back from the widest draw, raced 2 wide at rear, angled out 500M, made some progress in straight. (See Racing Incidents.)",https://racing.hkjc.com/en-us/local/information/corunning?date=20260222&raceno=10,2026-04-26T03:49:19Z
2026022210,2026-02-22,10,ST,8,11,LUCKY TWIN STARS,HK_2024_K126,A Badel,CP,"Average to begin, raced better than midfield on the inside, saved ground on turn, kept on well early in straight, weakened gradually inside final furlong.",https://racing.hkjc.com/en-us/local/information/corunning?date=20260222&raceno=10,2026-04-26T03:49:19Z
2026022210,2026-02-22,10,ST,10,12,ARMOR GOLDEN EAGLE,HK_2024_K566,A Atzeni,B,"Shifted in at start and bumped, raced 3 wide at rear, angled out after passing 500M, made contact near 450M, made no impression in straight.",https://racing.hkjc.com/en-us/local/information/corunning?date=20260222&raceno=10,2026-04-26T03:49:19Z
2026022210,2026-02-22,10,ST,6,13,SHAMUS STORM,HK_2024_K031,K C Leung,CP1,"Taken back from a wide draw, raced towards rear on the inside, moved a bit closer along the rail on turn, angled out early in straight, made some progress thereafter.",https://racing.hkjc.com/en-us/local/information/corunning?date=20260222&raceno=10,2026-04-26T03:49:19Z
2026022210,2026-02-22,10,ST,11,14,CHARITY GAIN,HK_2022_H431,R Kingscote,B2/TT,"Jumped only fairly, raced 2 wide towards rear, 4 to 5 lengths back turning in, made no progress in straight.",https://racing.hkjc.com/en-us/local/information/corunning?date=20260222&raceno=10,2026-04-26T03:49:19Z
2026022210,2026-02-22,10,ST,13,2,FLYING LUCK,HK_2023_J339,E C W Wong,V/TT,"Taken back from a wide draw, raced at rear on the outside, 6 lengths or so back, made no progress in straight.",https://racing.hkjc.com/en-us/local/information/corunning?date=20260222&raceno=10,2026-04-26T03:49:19Z
2026022210,2026-02-22,10,ST,3,3,LOVERO,HK_2022_H451,H Bentley,--,"Clean jump, raced 3 wide slightly better than midfield, no cover for the majority of the race, slightly improved on turn, showed good response in straight, took the lead 150M, peaked and headed 50M, weakened gradually thereafter.",https://racing.hkjc.com/en-us/local/information/corunning?date=20260222&raceno=10,2026-04-26T03:49:19Z
2026022210,2026-02-22,10,ST,12,4,BLAZING WUKONG,HK_2024_K335,D B McMonagle,--,"Began only fairly, raced slightly behind midfield on the outside, 3 lengths back turning in, peaked early in straight, weakened gradually inside final furlong. (See Racing Incidents.)",https://racing.hkjc.com/en-us/local/information/corunning?date=20260222&raceno=10,2026-04-26T03:49:19Z
2026022210,2026-02-22,10,ST,2,5,THE RED HARE,HK_2024_K312,M Guyon,H/P/TT,"Away with them, raced 2 wide better than midfield, there to turn, no clear run early in straight, cleared 200M, finished off well to take 2nd. (See Racing Incidents.)",https://racing.hkjc.com/en-us/local/information/corunning?date=20260222&raceno=10,2026-04-26T03:49:19Z
2026022210,2026-02-22,10,ST,14,6,WINNING GOLD,HK_2022_H461,J Orman,TT,"Blundered start and bumped, raced 3 wide with cover behind midfield, 5 lengths back, same margin back on turn, failed to close off in straight.",https://racing.hkjc.com/en-us/local/information/corunning?date=20260222&raceno=10,2026-04-26T03:49:19Z
2026022210,2026-02-22,10,ST,5,7,SUPERB KID,HK_2022_H298,H Bowman,B-,"Slightly slow out from gate 1, raced behind midfield on the inside, a bit closer in the middle stages, made some progress in straight.",https://racing.hkjc.com/en-us/local/information/corunning?date=20260222&raceno=10,2026-04-26T03:49:19Z
2026022210,2026-02-22,10,ST,4,8,WITHOUT COMPARE,HK_2025_L151,L Hewitson,TT,"Bumped on jumping, took the lead, led by 1/2L turning in, kept on well early in straight, peaked and headed 150M, weakened final 50M.",https://racing.hkjc.com/en-us/local/information/corunning?date=20260222&raceno=10,2026-04-26T03:49:19Z
2026022210,2026-02-22,10,ST,1,9,POWER OF VITAM,HK_2025_L171,M F Poon,--,"Slightly slow out and made contact, raced 2 wide in midfield, angled out 550M, finished off very strongly to score.",https://racing.hkjc.com/en-us/local/information/corunning?date=20260222&raceno=10,2026-04-26T03:49:19Z
2026022211,2026-02-22,11,ST,4,1,SIX PACK,HK_2024_K061,L Ferraris,B,"Shifted in and heavily bumped out of stalls, mid division, under pressure on bend to chase leaders, stayed on steadily.",https://racing.hkjc.com/en-us/local/information/corunning?date=20260222&raceno=11,2026-04-26T03:49:19Z
2026022211,2026-02-22,11,ST,13,10,MIGHTY STRENGTH,HK_2022_H450,H T Mo,B,"Waited with in rear, pushed along widest into home straight, no impression.",https://racing.hkjc.com/en-us/local/information/corunning?date=20260222&raceno=11,2026-04-26T03:49:19Z
2026022211,2026-02-22,11,ST,3,11,HAROLD WIN,HK_2023_J280,A Atzeni,V/XB,"Tracked pace, moved smoothly into contention top of home straight, sticking to task, lost second on line.",https://racing.hkjc.com/en-us/local/information/corunning?date=20260222&raceno=11,2026-04-26T03:49:19Z
2026022211,2026-02-22,11,ST,2,12,GHORGAN,HK_2024_K199,A Badel,H/TT,"Raced in touch with leaders, short of room early in home straight, switched for clear run 200m out, ran on well but no threat to winner.",https://racing.hkjc.com/en-us/local/information/corunning?date=20260222&raceno=11,2026-04-26T03:49:19Z
2026022211,2026-02-22,11,ST,12,13,LEAPING STAR,HK_2025_L189,M L Yeung,--,"Rail position in mid-field, effort 500m out, left behind home straight.",https://racing.hkjc.com/en-us/local/information/corunning?date=20260222&raceno=11,2026-04-26T03:49:19Z
2026022211,2026-02-22,11,ST,9,14,GREY CHARGER,HK_2024_K425,M Chadwick,XB,"Raced in rear of mid-field, ridden top of home straight, unable to improve position.",https://racing.hkjc.com/en-us/local/information/corunning?date=20260222&raceno=11,2026-04-26T03:49:19Z
2026022211,2026-02-22,11,ST,6,2,SKY HEART,HK_2023_J092,E C W Wong,TT,"Ridden along from stalls to race prominently, challenged leader top of home straight, flattened out final 200m.",https://racing.hkjc.com/en-us/local/information/corunning?date=20260222&raceno=11,2026-04-26T03:49:19Z
2026022211,2026-02-22,11,ST,8,3,THE BOOM BOX,HK_2024_K076,C Y Ho,CP1,"Driven along and outpaced early stages, pushed along wide into home straight, lacked pace to challenge.",https://racing.hkjc.com/en-us/local/information/corunning?date=20260222&raceno=11,2026-04-26T03:49:19Z
2026022211,2026-02-22,11,ST,14,4,BEAUTY CRESCENT,HK_2022_H334,Y L Chung,B/TT,"Three wide in rear of mid-field without cover, struggled to hold position on bend, eased when detached 200m out.",https://racing.hkjc.com/en-us/local/information/corunning?date=20260222&raceno=11,2026-04-26T03:49:19Z
2026022211,2026-02-22,11,ST,7,5,BRILLIANT EXPRESS,HK_2023_J321,D B McMonagle,B-,"Heavily bumped and checked leaving stalls, in rear, under pressure 600m out, made up some late ground but never dangerous.",https://racing.hkjc.com/en-us/local/information/corunning?date=20260222&raceno=11,2026-04-26T03:49:19Z
2026022211,2026-02-22,11,ST,5,6,KA YING ATTACK,HK_2023_J391,Z Purton,V,"Tracked leaders against rail, challenged and every chance from 400m out, stayed on for pressure, weakened close home.",https://racing.hkjc.com/en-us/local/information/corunning?date=20260222&raceno=11,2026-04-26T03:49:19Z
2026022211,2026-02-22,11,ST,10,7,HEAVING,HK_2024_K576,C L Chau,B/TT,"Shifted out and heavily bumped exiting stalls, settled in mid-field, unable to pick up for pressure from 300m out.",https://racing.hkjc.com/en-us/local/information/corunning?date=20260222&raceno=11,2026-04-26T03:49:19Z
2026022211,2026-02-22,11,ST,11,8,PERFECT TEAM,HK_2022_H120,R Kingscote,B-/TT,"Held up last, still in last pair turning into home straight, no impression.",https://racing.hkjc.com/en-us/local/information/corunning?date=20260222&raceno=11,2026-04-26T03:49:19Z
2026022211,2026-02-22,11,ST,1,9,SALON S,HK_2024_K585,M F Poon,--,"Showed good speed to lead, keen early stages, three lengths clear 800m out, margin reduced turning into home straight, quickened early in home straight and soon in command.",https://racing.hkjc.com/en-us/local/information/corunning?date=20260222&raceno=11,2026-04-26T03:49:19Z
2026022501,2026-02-25,1,HV,10,1,COUNTRY DANCER,HK_2022_H436,D B McMonagle,E,"Bumped shortly after start, taken back to race at tail, 7 lengths or so back, very wide turning in, stumbled near 350M, made no impression in straight. (See Racing Incidents.)",https://racing.hkjc.com/en-us/local/information/corunning?date=20260225&raceno=1,2026-04-26T03:49:19Z
2026022501,2026-02-25,1,HV,11,10,TAIHANG SCENERY,HK_2023_J314,L Hewitson,TT,"Bumped start, raced better than midfield on the inside, 2 wide on turn, peaked early in straight, weakened thereafter. (Blood in trachea.) (See Racing Incidents.)",https://racing.hkjc.com/en-us/local/information/corunning?date=20260225&raceno=1,2026-04-26T03:49:19Z
2026022501,2026-02-25,1,HV,2,11,ORIENTAL SURPRISE,HK_2024_K028,Z Purton,B/TT,"Began well from gate 10, raced in 2nd early, sat right behind the leader after passing 650M, saved ground on turn, showed very good response in straight, took the lead 50M, headed close home. (See Racing Incidents.)",https://racing.hkjc.com/en-us/local/information/corunning?date=20260225&raceno=1,2026-04-26T03:49:19Z
2026022501,2026-02-25,1,HV,7,12,SONIC BOOM,HK_2022_H144,H Bentley,V/TT,"Moderately away, raced 2 wide better than midfield, 3 wide on turn, kept on same pace in straight.",https://racing.hkjc.com/en-us/local/information/corunning?date=20260225&raceno=1,2026-04-26T03:49:19Z
2026022501,2026-02-25,1,HV,8,2,TOP TO SKY,HK_2024_K339,K C Leung,CP-/XB1/TT1,"Out in line, raced 2 wide in midfield, 4 lengths or so back turning in, one-paced in straight.",https://racing.hkjc.com/en-us/local/information/corunning?date=20260225&raceno=1,2026-04-26T03:49:19Z
2026022501,2026-02-25,1,HV,3,3,KING ALLOY,HK_2024_K099,R Kingscote,B,"Jumped well from a wide draw, sent forward to take the lead, led by 1-1/4L turning in, kept on well in straight but unable to hold off the first two final 50M.",https://racing.hkjc.com/en-us/local/information/corunning?date=20260225&raceno=1,2026-04-26T03:49:19Z
2026022501,2026-02-25,1,HV,5,4,TRIUMPHANT WARRIOR,HK_2022_H430,M Guyon,B1/TT,"Began well from the widest draw, raced prominently but trapped 3 wide, 2 wide from 700M, 1-1/4L back turning in, kept on evenly in straight.",https://racing.hkjc.com/en-us/local/information/corunning?date=20260225&raceno=1,2026-04-26T03:49:19Z
2026022501,2026-02-25,1,HV,4,5,CHILL MASTER,HK_2023_J319,C L Chau,B/TT,"Bumped shortly after start, taken back to race towards rear on the outside, very wide into straight, finished off very strongly to be nearest on line.",https://racing.hkjc.com/en-us/local/information/corunning?date=20260225&raceno=1,2026-04-26T03:49:19Z
2026022501,2026-02-25,1,HV,6,6,MY FLYING ANGEL,HK_2023_J174,A Badel,B,"Taken back to race 2 wide behind midfield, angled out 350M, made good progress in straight to be nearest on line.",https://racing.hkjc.com/en-us/local/information/corunning?date=20260225&raceno=1,2026-04-26T03:49:19Z
2026022501,2026-02-25,1,HV,12,7,RICH HORSE,HK_2023_J191,M F Poon,XB,"Slightly slow out and bumped, raced behind midfield on the outside early, moved a bit closer after entering the back straight, peaked near 400M, weakened early in straight.",https://racing.hkjc.com/en-us/local/information/corunning?date=20260225&raceno=1,2026-04-26T03:49:19Z
2026022501,2026-02-25,1,HV,9,8,YOU'REMYEVERYTHING,HK_2020_E413,K Teetan,CP/TT-,"Average to begin, raced towards rear on the inside, saved ground on turn, one-paced in the run home.",https://racing.hkjc.com/en-us/local/information/corunning?date=20260225&raceno=1,2026-04-26T03:49:19Z
2026022501,2026-02-25,1,HV,1,9,LUCKY GENERATIONS,HK_2023_J338,E C W Wong,--,"Bumped start and unbalanced, raced in midfield on the inside, saved ground on turn, angled out early in straight, finished off very strongly to score by a narrow margin.",https://racing.hkjc.com/en-us/local/information/corunning?date=20260225&raceno=1,2026-04-26T03:49:19Z
2026022502,2026-02-25,2,HV,3,1,VICTOR THE RAPID,HK_2023_J393,C L Chau,B/TT,"Settled in rear of mid-field, ridden 300m out, ran on well to close on leaders late but always held.",https://racing.hkjc.com/en-us/local/information/corunning?date=20260225&raceno=2,2026-04-26T03:49:19Z
2026022502,2026-02-25,2,HV,9,10,ZEPHYR,HK_2024_K414,L Hewitson,TT,"Waited with towards rear, switched for clear run 300m out, tight for room final 50m, unable to be ridden out to finish.",https://racing.hkjc.com/en-us/local/information/corunning?date=20260225&raceno=2,2026-04-26T03:49:19Z
2026022502,2026-02-25,2,HV,5,11,WINNING CIGAR,HK_2024_K422,H Bentley,CP-/B1,"Rail position in rear of mid-field, had to wait for run turning into home straight, stayed on for pressure.",https://racing.hkjc.com/en-us/local/information/corunning?date=20260225&raceno=2,2026-04-26T03:49:19Z
2026022502,2026-02-25,2,HV,6,12,HAPPY BUDDIES,HK_2024_K344,K Teetan,CP/TT,"Dropped out from widest draw, three wide without cover, hung in final 200m, stayed on but lacked pace to reach leaders.",https://racing.hkjc.com/en-us/local/information/corunning?date=20260225&raceno=2,2026-04-26T03:49:19Z
2026022502,2026-02-25,2,HV,7,2,AUTOMATED,HK_2024_K177,M L Yeung,TT,"Bumped out of stalls, raced in rear, ridden top of home straight, made up some late ground but never dangerous.",https://racing.hkjc.com/en-us/local/information/corunning?date=20260225&raceno=2,2026-04-26T03:49:19Z
2026022502,2026-02-25,2,HV,10,3,SIR CHARGE,HK_2024_K361,D B McMonagle,H1/TT,"Bumped leaving stalls, prominent, driven to chase leader 400m out, gave ground final 200m.",https://racing.hkjc.com/en-us/local/information/corunning?date=20260225&raceno=2,2026-04-26T03:49:19Z
2026022502,2026-02-25,2,HV,12,4,IMPRESSIVE CHAMP,HK_2024_K522,B Avdulla,TT,"Settled in mid-field, chased along final bend, weakened quickly home straight.",https://racing.hkjc.com/en-us/local/information/corunning?date=20260225&raceno=2,2026-04-26T03:49:19Z
2026022502,2026-02-25,2,HV,1,5,NORTHERN FIRE BALL,HK_2023_J488,K C Leung,TT,"Made all, showed good speed to get across, kicked 300m out, in control final 100m, won readily.",https://racing.hkjc.com/en-us/local/information/corunning?date=20260225&raceno=2,2026-04-26T03:49:19Z
2026022502,2026-02-25,2,HV,11,6,TOPSPIN KING,HK_2025_L141,C Y Ho,XB1,"In rear after sluggish start, pushed along widest into home straight, unable to improve position.",https://racing.hkjc.com/en-us/local/information/corunning?date=20260225&raceno=2,2026-04-26T03:49:19Z
2026022502,2026-02-25,2,HV,4,7,AWESOME TREASURE,HK_2020_E435,E C W Wong,TT-,"Fast break, tracked leaders against rail, chased along final bend, one paced under pressure.",https://racing.hkjc.com/en-us/local/information/corunning?date=20260225&raceno=2,2026-04-26T03:49:19Z
2026022502,2026-02-25,2,HV,2,8,BITS SUPERSTAR,HK_2023_J362,Z Purton,--,"Tracked leaders, good headway final bend to chase leaders, sustained headway to challenge 300m out, stayed on but no threat to winner.",https://racing.hkjc.com/en-us/local/information/corunning?date=20260225&raceno=2,2026-04-26T03:49:19Z
2026022502,2026-02-25,2,HV,8,9,FULL OF LAUGHTER,HK_2025_L017,R Kingscote,SR/TT,"Rail position in mid-field, keen middle stages, ran green, never going pace to get competitive.",https://racing.hkjc.com/en-us/local/information/corunning?date=20260225&raceno=2,2026-04-26T03:49:19Z
2026022503,2026-02-25,3,HV,5,1,CALIFORNIATOTALITY,HK_2022_H418,B Avdulla,B/TT,"Jumped only fairly, sat rear, one pace to the finish (See Incident Report).",https://racing.hkjc.com/en-us/local/information/corunning?date=20260225&raceno=3,2026-04-26T03:49:20Z
2026022503,2026-02-25,3,HV,2,2,HUGE WAVE,HK_2023_J197,A Badel,TT,"Sat on pace, traveled nicely, had every chance.",https://racing.hkjc.com/en-us/local/information/corunning?date=20260225&raceno=3,2026-04-26T03:49:20Z
2026022503,2026-02-25,3,HV,7,3,SWORD POINT,HK_2021_G448,K C Leung,CP,"Settled midfield, traveled fairly, finished last, not much impression.",https://racing.hkjc.com/en-us/local/information/corunning?date=20260225&raceno=3,2026-04-26T03:49:20Z
2026022503,2026-02-25,3,HV,6,4,AWESOME FLUKE,HK_2023_J050,A Atzeni,P/TT,"Sat midfield early, raced wide in the early stages and went forward to chase the leader, weakened from 200M.",https://racing.hkjc.com/en-us/local/information/corunning?date=20260225&raceno=3,2026-04-26T03:49:20Z
2026022503,2026-02-25,3,HV,1,5,SOLEIL FIGHTER,HK_2023_J127,H Bowman,TT,"Ridden along to lead, traveled comfortably, closed off strongly (See Incident Report).",https://racing.hkjc.com/en-us/local/information/corunning?date=20260225&raceno=3,2026-04-26T03:49:20Z
2026022503,2026-02-25,3,HV,3,6,SKY HEART,HK_2023_J092,E C W Wong,TT,"Sat towards rear, pressed on near the 700M, responded reasonably well when asked (See Incident Report).",https://racing.hkjc.com/en-us/local/information/corunning?date=20260225&raceno=3,2026-04-26T03:49:20Z
2026022503,2026-02-25,3,HV,4,7,JUMBO LEGEND,HK_2021_G266,K Teetan,B/TT,"Jumped awkwardly, settled midfield, improved into a tight run over the concluding stages, could not be fully tested.",https://racing.hkjc.com/en-us/local/information/corunning?date=20260225&raceno=3,2026-04-26T03:49:20Z
2026022504,2026-02-25,4,HV,4,1,VERY GRATEFUL,HK_2024_K396,C L Chau,B-/TT,"Outpaced early, in rear, pushed along halfway, in last pair entering home straight, stayed on well final 150m.",https://racing.hkjc.com/en-us/local/information/corunning?date=20260225&raceno=4,2026-04-26T03:49:19Z
2026022504,2026-02-25,4,HV,12,10,GIMME FIVE,HK_2023_J099,K Teetan,B,"Prominent early, tracking leaders halfway, struggling to hold position final bend, soon weakened.",https://racing.hkjc.com/en-us/local/information/corunning?date=20260225&raceno=4,2026-04-26T03:49:19Z
2026022504,2026-02-25,4,HV,3,11,ICONICAL,HK_2023_J504,M Chadwick,B1,"Tracked pace, raced wide to final bend, improved to hold every chance 150m out, no extra final 50m.",https://racing.hkjc.com/en-us/local/information/corunning?date=20260225&raceno=4,2026-04-26T03:49:19Z
2026022504,2026-02-25,4,HV,1,12,LEGEND STAR,HK_2024_K271,Y L Chung,B/TT,"Rear of mid-field, taken wide and forward move turning into home straight, sustained run to lead 150m out, ran on well.",https://racing.hkjc.com/en-us/local/information/corunning?date=20260225&raceno=4,2026-04-26T03:49:19Z
2026022504,2026-02-25,4,HV,2,2,TACTICAL COMMAND,HK_2022_H197,A Badel,B,"Mid-field, rail position, forced to angle wide in home straight to challenge, stayed on, got up for second close home.",https://racing.hkjc.com/en-us/local/information/corunning?date=20260225&raceno=4,2026-04-26T03:49:19Z
2026022504,2026-02-25,4,HV,6,3,CHEERFUL WONGCHOY,HK_2025_L045,Z Purton,CP1,"Won early battle for lead and set good pace, headed 150m out, no extra.",https://racing.hkjc.com/en-us/local/information/corunning?date=20260225&raceno=4,2026-04-26T03:49:19Z
2026022504,2026-02-25,4,HV,9,4,JOLLY COMPANION,HK_2022_H454,C Y Ho,B/TT,"Wide early from high draw, taken forward to press leader by halfway, weakened 200m out.",https://racing.hkjc.com/en-us/local/information/corunning?date=20260225&raceno=4,2026-04-26T03:49:19Z
2026022504,2026-02-25,4,HV,8,5,KWAI CHUNG TALENTS,HK_2025_L144,M L Yeung,--,"Tracked pace, no extra and lost ground final 150m.",https://racing.hkjc.com/en-us/local/information/corunning?date=20260225&raceno=4,2026-04-26T03:49:19Z
2026022504,2026-02-25,4,HV,10,6,CELESTIAL STRIDER,HK_2025_L009,J Orman,TT,"Slowly away, recovered but towards rear. Pushed along 300m out, no real impression, ran out of room final 50m.",https://racing.hkjc.com/en-us/local/information/corunning?date=20260225&raceno=4,2026-04-26T03:49:19Z
2026022504,2026-02-25,4,HV,5,7,DAN ATTACK,HK_2022_H317,H Bentley,XB,"Keen early, settled in mid-field, forward move wide final bend, challenged 150m out, unable to sustain effort.",https://racing.hkjc.com/en-us/local/information/corunning?date=20260225&raceno=4,2026-04-26T03:49:19Z
2026022504,2026-02-25,4,HV,11,8,FORTUNE SUPERNOVA,HK_2024_K287,K C Leung,B/TT,"Prominent early, caught behind weakening runner from halfway and shuffled back to rear by top of home straight, no impression under pressure.",https://racing.hkjc.com/en-us/local/information/corunning?date=20260225&raceno=4,2026-04-26T03:49:19Z
2026022504,2026-02-25,4,HV,7,9,SUPREME FEELING,HK_2025_L130,L Ferraris,B1,"Dropped in from high draw, raced in last place, headway final 150m, never going pace to get competitive.",https://racing.hkjc.com/en-us/local/information/corunning?date=20260225&raceno=4,2026-04-26T03:49:19Z
2026022505,2026-02-25,5,HV,4,1,BUNDLE OF CHARM,HK_2021_G213,D B McMonagle,--,"Bumped shortly after start, raced 2 wide behind midfield, made some progress early in straight, peaked approaching 100M, ran on evenly to the line.",https://racing.hkjc.com/en-us/local/information/corunning?date=20260225&raceno=5,2026-04-26T03:49:19Z
2026022505,2026-02-25,5,HV,3,10,AUTUMN VIBES,HK_2024_K150,M Chadwick,H/TT-,"Taken back from a wide draw, raced 2 wide towards rear, 6 lengths back turning in, made good progress in straight to take a place without threatening.",https://racing.hkjc.com/en-us/local/information/corunning?date=20260225&raceno=5,2026-04-26T03:49:19Z
