race_id,Date,trial_number,horse_number,Horse,Jockey,Trainer,Draw,Gear,LBW,Running Position,Time,Result,Comment,Track,Dist.,horse_id
2018100211,2018-10-02,11,9,SAVANNAH WIND (A307),H T Mo,C S Shum,11,B,10-1/4L,12 12 9,1.13.26,,Niggled along early; made minor progress late.,ST_AWT,1200,HK_2016_A307
2018100211,2018-10-02,11,10,ROCK THE TREE (P272),U Rispoli,D E Ferraris,1,,12-1/4L,9 9 10,1.13.60,,Not much progress when asked at turn.,ST_AWT,1200,HK_2012_P272
2018100211,2018-10-02,11,11,DAZZLE WINNER (V363),G van Niekerk,Y S Tsui,4,B,13L,11 11 11,1.13.72,,Raced at rear; ran on ordinary.,ST_AWT,1200,HK_2015_V363
2018100211,2018-10-02,11,12,HIDDEN SPIRIT (B130),S Clipperton,P O'Sullivan,7,B,15-1/2L,8 8 12,1.14.09,,Weakened and gave ground when under whip at 200m.,ST_AWT,1200,HK_2017_B130
2018100212,2018-10-02,12,1,FORTUNE BOOTH (A418),Z Purton,M J Freedman,12,B,,9 8 1,1.01.18,Passed,Made progress steadily; came from behind to score.,ST_AWT,1050,HK_2016_A418
2018100212,2018-10-02,12,2,PERPETUAL TREASURE (S191),M L Yeung,T P Yung,9,B,Head,4 2 2,1.01.21,,Hit the front at one stage; just caught.,ST_AWT,1050,HK_2013_S191
2018100212,2018-10-02,12,3,GO PUBLIC (B170),C Y Ho,Y S Tsui,11,P,1/2L,12 11 3,1.01.25,,Taken back early; ran on strongly when shifted out in the Straight.,ST_AWT,1050,HK_2017_B170
2018100212,2018-10-02,12,4,BALTIC WHISPER (B216),K C Leung,C S Shum,7,H,1L,2 1 4,1.01.33,,Led middle gate; kept on late.,ST_AWT,1050,HK_2017_B216
2018100212,2018-10-02,12,5,MONEY BOY (A008),K Teetan,J Size,10,,2-1/2L,11 10 5,1.01.57,,Dashed on well when let go late.,ST_AWT,1050,HK_2016_A008
2018100212,2018-10-02,12,6,GUNNISON (A377),S Clipperton,J Size,8,,3-1/2L,8 6 6,1.01.75,,Caught in traffic in the Straight; not tested.,ST_AWT,1050,HK_2016_A377
2018100212,2018-10-02,12,7,KEEP MOVING (A124),C Wong,P F Yiu,5,B,4-1/4L,1 3 7,1.01.87,,Showed good early pace; weakened late; ran on ordinary.,ST_AWT,1050,HK_2016_A124
2018100212,2018-10-02,12,8,VIVA COUNCIL (A190),T H So,L Ho,2,H,5-3/4L,6 7 8,1.02.12,,Settled midfield; caught in traffic late.,ST_AWT,1050,HK_2016_A190
2018100212,2018-10-02,12,9,DR PROACTIVE (A345),M F Poon,D J Hall,4,,6-1/4L,3 4 9,1.02.18,,Up with the pace; limited response in the Straight.,ST_AWT,1050,HK_2016_A345
2018100212,2018-10-02,12,10,HOT HOT PEPPER (V026),N Callan,P O'Sullivan,1,B/XB,6-1/2L,5 5 10,1.02.23,,Weakened and gave ground in the Straight.,ST_AWT,1050,HK_2015_V026
2018100212,2018-10-02,12,11,KEEP GOING (B231),H T Mo,Y S Tsui,3,B,10-1/2L,10 12 11,1.02.84,,Saved ground throughout; ran on ordinary.,ST_AWT,1050,HK_2017_B231
2018100212,2018-10-02,12,12,FIVE FORTUNE (B392),G van Niekerk,A T Millard,6,,12-1/2L,7 9 12,1.03.18,Failed,Gave ground when asked and under whip.,ST_AWT,1050,HK_2017_B392
2018100501,2018-10-05,1,1,SUPER WISE (A100),U Rispoli,C H Yip,7,H/P,,1 1 1,1.10.61,,Led all the way from wide gate; kept on to score under a hold.,ST_AWT,1200,HK_2016_A100
2018100501,2018-10-05,1,2,IRON BOY (V071),D Whyte,K W Lui,6,B,3-1/4L,4 3 2,1.11.13,,Came from behind for 2nd when hard ridden in the Straight.,ST_AWT,1200,HK_2015_V071
2018100501,2018-10-05,1,3,ENFOLDING (B353),C Murray,C W Chang,4,B,3-1/4L,2 2 3,1.11.13,,On pace for 3rd; but limited response late.,ST_AWT,1200,HK_2017_B353
2018100501,2018-10-05,1,4,GO GO WIN (S073),M F Poon,P F Yiu,1,,4-3/4L,3 4 4,1.11.39,,Raced along the rail; not fully tested.,ST_AWT,1200,HK_2013_S073
2018100501,2018-10-05,1,5,NEW ELEGANCE (A416),Z Purton,F C Lor,2,XB,5-1/2L,5 5 5,1.11.48,,Held ground; not fully tested in the Straight.,ST_AWT,1200,HK_2016_A416
2018100501,2018-10-05,1,6,CHEERFUL BOY (V019),C Wong,K H Ting,3,,5-3/4L,6 6 6,1.11.54,,Fractious in loading; got its head down on jumping; limited response when asked in the Straight.,ST_AWT,1200,HK_2015_V019
2018100501,2018-10-05,1,7,WILLIE WAY (T281),K C Leung,P O'Sullivan,5,B,6-1/4L,7 7 7,1.11.62,,Outpaced early; made minor inroads in the Straight.,ST_AWT,1200,HK_2014_T281
2018100502,2018-10-05,2,1,SUNNY POWER (A371),Z Purton,K W Lui,8,B,,7 5 1,1.11.48,,Hit the line strongly to score when shifted out at 300m.,ST_AWT,1200,HK_2016_A371
2018100502,2018-10-05,2,2,THE SHOW (T256),W M Lai,C H Yip,2,B,Neck,4 3 2,1.11.52,,Under restraint early; ridden along to the line from 200m.,ST_AWT,1200,HK_2014_T256
2018100502,2018-10-05,2,3,M REBORN (A046),U Rispoli,C H Yip,4,CP,1-3/4L,3 2 3,1.11.75,,On pace but three wide; ran on fairly well.,ST_AWT,1200,HK_2016_A046
2018100502,2018-10-05,2,4,GLITTERING ARMOUR (B016),C Y Ho,K W Lui,3,XB,4-1/4L,5 6 4,1.12.16,,Slightly slow to begin; ran on when asked in the Straight.,ST_AWT,1200,HK_2017_B016
2018100502,2018-10-05,2,5,JUST NOT LISTENING (B192),D Whyte,J Moore,10,H,4-1/4L,1 1 5,1.12.17,,Niggled along early to cut across; limited response late.,ST_AWT,1200,HK_2017_B192
2018100502,2018-10-05,2,6,FORTUNE PATROL (A245),K C Leung,P O'Sullivan,7,B,5-3/4L,10 8 6,1.12.42,,Wide throughout; ran on ordinary.,ST_AWT,1200,HK_2016_A245
2018100502,2018-10-05,2,7,HOLY UNICORN (V179),M Chadwick,K H Ting,1,,6L,6 7 7,1.12.44,,Saved ground throughout; caught in traffic in the Straight.,ST_AWT,1200,HK_2015_V179
2018100502,2018-10-05,2,8,LEVANTE (B177),N Callan,L Ho,5,,6-1/4L,2 4 8,1.12.48,,On pace early; failed to respond when hard ridden.,ST_AWT,1200,HK_2017_B177
2018100502,2018-10-05,2,9,HEROIC GURU (S260),M F Poon,D J Hall,6,,9-1/4L,8 9 9,1.12.94,,Shifted out at 300m; raced under his own steam.,ST_AWT,1200,HK_2013_S260
2018100502,2018-10-05,2,10,FRIENDO (A264),C Murray,C W Chang,9,B,18L,9 10 10,1.14.38,,Five wide at turn; laying in at 300m; weakened and gave ground.,ST_AWT,1200,HK_2016_A264
2018100503,2018-10-05,3,1,STRIKING MR C (B141),U Rispoli,T P Yung,2,B,,1 1 1,1.02.25,,Shared lead early; hit the front in the Straight to score.,ST_AWT,1050,HK_2017_B141
2018100503,2018-10-05,3,2,MR GENUINE (S253),M F Poon,D J Hall,5,,Neck,5 4 2,1.02.29,,Three wide throughout; made progress under a hold.,ST_AWT,1050,HK_2013_S253
2018100503,2018-10-05,3,3,HAPPY WINNER (B450),T H So,L Ho,4,,3L,4 3 3,1.02.73,Passed,Began moderately; ran on fairly well.,ST_AWT,1050,HK_2017_B450
2018100503,2018-10-05,3,4,BACK IN BLACK (T358),C Y Ho,D J Hall,3,,3-3/4L,3 5 4,1.02.84,,Ran on fairly well when persuaded at 300m.,ST_AWT,1050,HK_2014_T358
2018100503,2018-10-05,3,5,GALLANT RETURN (A308),Z Purton,D J Hall,1,,4-1/4L,2 2 5,1.02.91,,Urged to lead along the rail; under a hold in the Straight.,ST_AWT,1050,HK_2016_A308
2018100901,2018-10-09,1,1,ACCLAIMED LIGHT (T369),M Chadwick,P O'Sullivan,5,B,,4 3 1,1.11.73,,Made progress steadily; won comfortably.,ST_AWT,1200,HK_2014_T369
2018100901,2018-10-09,1,2,DESTIN (V417),K C Leung,P O'Sullivan,8,B,3/4L,7 6 2,1.11.85,,Quickened for 2nd when persuaded at 300m.,ST_AWT,1200,HK_2015_V417
2018100901,2018-10-09,1,3,JOYFUL CONTENDER (B364),M L Yeung,R Gibson,12,H,2L,2 2 3,1.12.07,Passed,Shared lead early; kept on for 3rd.,ST_AWT,1200,HK_2017_B364
2018100901,2018-10-09,1,4,PEACE ON EARTH (S254),U Rispoli,K L Man,6,B,2-3/4L,1 1 4,1.12.18,,Led along the rail; kept on one-paced.,ST_AWT,1200,HK_2013_S254
2018100901,2018-10-09,1,5,WHAT ELSE BUT YOU (A136),K Teetan,J Size,3,PC,3-3/4L,6 7 5,1.12.33,,Ran on well inside; impressive.,ST_AWT,1200,HK_2016_A136
2018100901,2018-10-09,1,6,FAST MOST FURIOUS (A165),G van Niekerk,D J Hall,11,,5L,11 11 6,1.12.51,,Ran on well when clear in the Straight.,ST_AWT,1200,HK_2016_A165
2018100901,2018-10-09,1,7,MARZOUQ (B094),Z Purton,J Size,9,,5-1/4L,9 8 7,1.12.58,,Under a hold in the Straight; ran on fairly well.,ST_AWT,1200,HK_2017_B094
2018100901,2018-10-09,1,8,GENERAL SHERMAN (V125),C Y Ho,A S Cruz,10,,5-1/2L,12 12 8,1.12.60,,Shifted out at 200m; ran on when asked.,ST_AWT,1200,HK_2015_V125
2018100901,2018-10-09,1,9,FOREVER KINDNESS (B062),C Schofield,Y S Tsui,2,,6L,5 4 9,1.12.70,,Up with the pace; limited response when asked.,ST_AWT,1200,HK_2017_B062
2018100901,2018-10-09,1,10,LE PANACHE (V369),D Whyte,T P Yung,4,B,6L,8 10 10,1.12.71,,Raced behind runners in the Straight; not tested.,ST_AWT,1200,HK_2015_V369
2018100901,2018-10-09,1,11,REMARKABLE (A222),S Clipperton,J Size,7,P,6-3/4L,10 9 11,1.12.83,,Raced under his own steam when caught in traffic in the Straight.,ST_AWT,1200,HK_2016_A222
2018100901,2018-10-09,1,12,CHACHAUP (B037),A Sanna,P O'Sullivan,1,B,8-3/4L,3 5 12,1.13.12,,Raced awkwardly at turn and gave ground.,ST_AWT,1200,HK_2017_B037
2018100902,2018-10-09,2,1,MR STUNNING (V153),K Teetan,F C Lor,2,,,1 1 1,1.03.05,,Led all the way; won comfortably.,ST_AWT,1050,HK_2015_V153
2018100902,2018-10-09,2,2,CONTE (A429),S Clipperton,J Size,6,,1-1/4L,3 2 2,1.03.27,,Wide throughout; ran on strongly.,ST_AWT,1050,HK_2016_A429
2018100902,2018-10-09,2,3,GRACIOUS RYDER (A179),D Whyte,D J Hall,1,B,2L,4 4 3,1.03.35,,Saved ground and made progress; impressive.,ST_AWT,1050,HK_2016_A179
2018100902,2018-10-09,2,4,SONIC FIGHTER (A187),K C Leung,P O'Sullivan,5,,3-1/4L,6 5 4,1.03.57,,Severely over-racing early; hit the line strongly when clear in the Straight.,ST_AWT,1050,HK_2016_A187
2018100902,2018-10-09,2,5,NICCONI EXPRESS (C024),G van Niekerk,J Size,4,,3-1/4L,5 6 5,1.03.57,Passed,Jumped awkwardly; over-racing turning in; ran on when asked late.,ST_AWT,1050,HK_2018_C024
2018100902,2018-10-09,2,6,BIG BULLY (B028),Z Purton,D J Hall,3,B/H,3-1/4L,2 3 6,1.03.58,,On pace early; limited response when asked in the Straight.,ST_AWT,1050,HK_2017_B028
2018101201,2018-10-12,1,1,REGENCY BO BO (A050),H T Mo,C S Shum,2,B,,2 2 1,1.09.15,,Shared lead early; hit the front at 200m to score.,ST_AWT,1200,HK_2016_A050
2018101201,2018-10-12,1,2,TIME WARP (A066),Z Purton,A S Cruz,1,,1/2L,1 1 2,1.09.22,,Led along the rail; not fully tested.,ST_AWT,1200,HK_2016_A066
2018101201,2018-10-12,1,3,PINGWU SPARK (A262),K C Leung,T P Yung,3,,1/2L,3 3 3,1.09.26,,Up with the pace; ran on for 3rd when asked late.,ST_AWT,1200,HK_2016_A262
2018101201,2018-10-12,1,4,PAKISTAN STAR (V325),K Teetan,A S Cruz,7,H/PC,1-3/4L,5 5 4,1.09.41,,Slightly slow to begin; ran on comfortably when shifted out at 300m.,ST_AWT,1200,HK_2015_V325
2018101201,2018-10-12,1,5,THEWIZARDOFOZ (T251),A Sanna,J Size,4,B,2-1/4L,4 4 5,1.09.49,,Ran on only fairly when hard ridden.,ST_AWT,1200,HK_2014_T251
2018101201,2018-10-12,1,6,EXULTANT (B101),C Y Ho,A S Cruz,5,XB,8-1/4L,9 7 6,1.10.47,,Asked at turn; ridden along to the line.,ST_AWT,1200,HK_2017_B101
2018101201,2018-10-12,1,7,DINOZZO (V246),H N Wong,J Size,8,B,9-1/4L,8 6 7,1.10.62,,Not quickened when hard ridden in the Straight.,ST_AWT,1200,HK_2015_V246
2018101201,2018-10-12,1,8,NOTHINGILIKEMORE (V388),G van Niekerk,J Size,6,B,9-1/2L,6 8 8,1.10.68,,Niggled along throughout; not racing back to form.,ST_AWT,1200,HK_2015_V388
2018101201,2018-10-12,1,9,WERTHER (V083),C Murray,J Moore,9,CP,12-3/4L,7 9 9,1.11.18,,Wide throughout; just to stretch out.,ST_AWT,1200,HK_2015_V083
2018101202,2018-10-12,2,1,SIMPLY BRILLIANT (B090),Z Purton,F C Lor,5,H/XB,,5 5 1,1.10.24,,Dashed on centre track to score; plenty in hand.,ST_AWT,1200,HK_2017_B090
2018101202,2018-10-12,2,2,RUTHVEN (B160),K C Leung,F C Lor,9,B,Neck,7 4 2,1.10.29,,Slightly slow to begin; over-racing at 700m; made progress steadily.,ST_AWT,1200,HK_2017_B160
2018101202,2018-10-12,2,3,GO BEAUTY GO (V316),M F Poon,J Moore,1,,1L,1 1 3,1.10.42,,Led early; kept on OK for 3rd.,ST_AWT,1200,HK_2015_V316
2018101202,2018-10-12,2,4,HELLO BEAUTY (B410),D Whyte,J Moore,4,B,2-1/4L,2 3 4,1.10.59,,Raced awkwardly at turn; ran on when recovered.,ST_AWT,1200,HK_2017_B410
2018101202,2018-10-12,2,5,FLYING QUEST (A071),C Schofield,D J Hall,7,B,2-3/4L,8 7 5,1.10.68,Passed,Ran on comfortably when shifted out in the Straight.,ST_AWT,1200,HK_2016_A071
2018101202,2018-10-12,2,6,UNICRON JEWELLERY (V333),K Teetan,J Size,8,B,5L,4 2 6,1.11.06,,Dashed on momentarily at turn; under a hold in the Straight.,ST_AWT,1200,HK_2015_V333
2018101202,2018-10-12,2,7,ASSOCIATION FANS (V207),M Chadwick,L Ho,3,H/SR,5-1/4L,3 6 7,1.11.10,,Up with the pace; limited response when asked in the Straight.,ST_AWT,1200,HK_2015_V207
2018101202,2018-10-12,2,8,RED WARRIOR (B355),A Sanna,J Size,2,,5-3/4L,6 8 8,1.11.16,,Settled behind midfield; not tested.,ST_AWT,1200,HK_2017_B355
2018101202,2018-10-12,2,9,GRAN MASTER (V336),T H So,L Ho,6,B/H,6-3/4L,9 9 9,1.11.32,Passed,Lost its rhythm at 700m; raced awkwardly.,ST_AWT,1200,HK_2015_V336
2018101202,2018-10-12,2,10,RICKFIELD (V046),G van Niekerk,A T Millard,10,XB,11-1/2L,10 10 10,1.12.09,,Wide throughout; raced behind runners under a hold.,ST_AWT,1200,HK_2015_V046
2018101203,2018-10-12,3,1,ROMANTIC CHEF (B368),Z Purton,C S Shum,7,B,,2 2 1,1.10.41,Passed,Always in touch; hit the front late to score.,ST_AWT,1200,HK_2017_B368
2018101203,2018-10-12,3,2,EVER STRONG (A275),M F Poon,K L Man,1,P/XB,1-1/4L,1 1 2,1.10.63,,Led along the rail; under a hold late.,ST_AWT,1200,HK_2016_A275
2018101203,2018-10-12,3,3,EMERALD SPUR (B258),K C Leung,P F Yiu,6,CP,1-3/4L,6 6 3,1.10.70,,Ran on well when asked at turn.,ST_AWT,1200,HK_2017_B258
2018101203,2018-10-12,3,4,CLOUD NINE (T416),K Teetan,A T Millard,3,V/XB,3-1/2L,8 7 4,1.10.98,,Asked at turn; made progress steadily.,ST_AWT,1200,HK_2014_T416
2018101203,2018-10-12,3,5,GENTLEMEN (V060),C L Chau,P F Yiu,2,B,4-1/4L,5 4 5,1.11.08,,Saved ground throughout; ran on ordinary when asked.,ST_AWT,1200,HK_2015_V060
2018101203,2018-10-12,3,6,GLORY STAR (T336),G van Niekerk,K H Ting,4,B,4-1/4L,4 5 6,1.11.09,,Not quickened when asked in the Straight.,ST_AWT,1200,HK_2014_T336
2018101203,2018-10-12,3,7,CASHIN MINISTER (B158),S Clipperton,J Size,9,V,5-1/4L,3 3 7,1.11.26,,Up with the pace; failed to respond when asked.,ST_AWT,1200,HK_2017_B158
2018101203,2018-10-12,3,8,BONITO (V319),H T Mo,L Ho,11,H,6-1/4L,9 10 8,1.11.39,,Ran on fairly well when clear in the Straight.,ST_AWT,1200,HK_2015_V319
2018101203,2018-10-12,3,9,COOL ARMY (B042),D Whyte,C Fownes,12,XB,6-1/2L,11 12 9,1.11.46,,Taken back early; made minor inroads when persuaded at 300m.,ST_AWT,1200,HK_2017_B042
2018101203,2018-10-12,3,10,MI BLANCO (A186),C Schofield,P O'Sullivan,10,CP,7-1/2L,10 9 10,1.11.62,,Settled at rear; not tested.,ST_AWT,1200,HK_2016_A186
2018101203,2018-10-12,3,11,JOLLY GAINS (A276),T H So,L Ho,5,H,9L,12 11 11,1.11.84,,Began moderately; unimpressive.,ST_AWT,1200,HK_2016_A276
2018101203,2018-10-12,3,12,REAL GIANT (B382),M L Yeung,D J Hall,8,,11L,7 8 12,1.12.15,,Weakened halfway; finished last.,ST_AWT,1200,HK_2017_B382
2018101204,2018-10-12,4,1,IVICTORY (A257),Z Purton,J Size,3,,,1 1 1,1.00.97,,Led all the way to score; something in hand.,ST_AWT,1050,HK_2016_A257
2018101204,2018-10-12,4,2,HOT KING PRAWN (A299),S Clipperton,J Size,1,,1/2L,3 3 2,1.01.05,,Under a hold for 2nd; plenty in hand.,ST_AWT,1050,HK_2016_A299
2018101204,2018-10-12,4,3,BREEDERS' STAR (V197),K Teetan,D E Ferraris,8,H,1L,4 4 3,1.01.13,Passed,Three wide at turn; dashed on impressively.,ST_AWT,1050,HK_2015_V197
2018101204,2018-10-12,4,4,COUNTRY STAR (B396),C Y Ho,J Size,6,,1-3/4L,2 2 4,1.01.23,,Up with the pace; raced under his own steam in the Straight.,ST_AWT,1050,HK_2017_B396
2018101204,2018-10-12,4,5,NASSA (A119),G van Niekerk,A T Millard,2,,4L,10 8 5,1.01.60,,Began moderately; ran on well when shifted out at 200m.,ST_AWT,1050,HK_2016_A119
2018101204,2018-10-12,4,6,PRESIDENTPARAMOUNT (S420),M Chadwick,C W Chang,10,H,4-1/4L,6 6 6,1.01.67,Passed,Racing along the rail turning in; ran on OK.,ST_AWT,1050,HK_2013_S420
2018101204,2018-10-12,4,7,HK TOURBILLON (B140),A Sanna,P F Yiu,4,B,4-1/2L,5 5 7,1.01.71,Passed,Not striding out properly when being hard ridden.,ST_AWT,1050,HK_2017_B140
2018101204,2018-10-12,4,8,FUN TIMES (B079),C Schofield,A T Millard,5,,5-3/4L,7 7 8,1.01.90,,Under a hold in the Straight; ran on fairly well.,ST_AWT,1050,HK_2017_B079
2018101204,2018-10-12,4,9,C P POWER (V037),C Wong,A T Millard,9,V,8-1/2L,9 10 9,1.02.34,,Made minor progress when asked late.,ST_AWT,1050,HK_2015_V037
2018101204,2018-10-12,4,10,HELENE PARAGON (V167),D Whyte,J Moore,7,CP,9-3/4L,8 9 10,1.02.54,Failed,Ran on ordinary; not racing back to form.,ST_AWT,1050,HK_2015_V167
2018101601,2018-10-16,1,1,MUSIC ADDITION (B308),H N Wong,Y S Tsui,9,,,2 1 1,0.58.58,,Always in touch; ran on to score when asked.,ST,1000,HK_2017_B308
2018101601,2018-10-16,1,2,FORZA ANGEL (B333),M L Yeung,Y S Tsui,7,,2L,1 2 2,0.58.92,,Always in touch; ran on comfortably.,ST,1000,HK_2017_B333
2018101601,2018-10-16,1,3,KINGS SHIELD (C071),S Clipperton,F C Lor,3,,2-1/2L,5 4 3,0.58.96,Passed,Ran on for 3rd when asked late.,ST,1000,HK_2018_C071
2018101601,2018-10-16,1,4,GLORIOUS SPECTRUM (C054),Z Purton,F C Lor,5,,3-1/4L,10 9 4,0.59.09,Passed,Slightly slow to begin; dashed on centre track.,ST,1000,HK_2018_C054
2018101601,2018-10-16,1,5,SUN SUN FA FA (B467),K Teetan,A S Cruz,10,,4-1/2L,4 3 5,0.59.30,,Not quickened when asked late.,ST,1000,HK_2017_B467
2018101601,2018-10-16,1,6,CLASSIC BEAUTY (C049),D Whyte,J Moore,6,,6L,8 8 6,0.59.53,Passed,Niggled along early but limited response.,ST,1000,HK_2018_C049
2018101601,2018-10-16,1,7,LONE EAGLE (B309),C Schofield,A T Millard,4,,7-1/2L,9 10 7,0.59.76,Passed,Slightly slow to begin; under a hold behind runners.,ST,1000,HK_2017_B309
2018101601,2018-10-16,1,8,GO GO FIRST (B205),A Sanna,P F Yiu,8,H,9-3/4L,3 5 8,1.00.13,,Failed to respond when under whip at 400m.,ST,1000,HK_2017_B205
2018101601,2018-10-16,1,9,NORTHERN SUPERSTAR (C073),G van Niekerk,A T Millard,1,,12L,7 6 9,1.00.51,Failed,Found nothing when under whip late.,ST,1000,HK_2018_C073
2018101601,2018-10-16,1,10,PRECIOUSSHIP (C050),U Rispoli,P F Yiu,2,,14L,6 7 10,1.00.80,Failed,Weakened halfway; gave ground and dropped back.,ST,1000,HK_2018_C050
2018101602,2018-10-16,2,1,FLYING MURTY (C002),C Schofield,P F Yiu,2,,,9 2 1,0.59.28,Passed,Made progress steadily; ran on nicely to score.,ST,1000,HK_2018_C002
2018101602,2018-10-16,2,2,WAH MAY PRINCESS (B423),K Teetan,A S Cruz,8,B,3/4L,6 1 2,0.59.42,Passed,Struggled for 2nd when ridden along at 300m.,ST,1000,HK_2017_B423
2018101602,2018-10-16,2,3,WAYFOONG CHARMER (B437),K C Leung,P O'Sullivan,7,,1-1/4L,4 4 3,0.59.47,Passed,Up with the pace; ran on for 3rd comfortably.,ST,1000,HK_2017_B437
2018101602,2018-10-16,2,4,SPECIAL STARS (C010),M Chadwick,J Size,6,,1-1/2L,1 6 4,0.59.52,Passed,Not quickened when asked late.,ST,1000,HK_2018_C010
2018101602,2018-10-16,2,5,INCREDIBLE (B477),G van Niekerk,K L Man,5,,1-1/2L,13 10 5,0.59.52,,Began moderately; made progress when hard ridden late.,ST,1000,HK_2017_B477
2018101602,2018-10-16,2,6,HANDSOME REBEL (B469),D Whyte,Y S Tsui,3,,2L,8 7 6,0.59.60,Passed,Made minor progress when persuaded late.,ST,1000,HK_2017_B469
2018101602,2018-10-16,2,7,CAMERA FACE (B476),U Rispoli,Y S Tsui,1,H,2-1/2L,10 8 7,0.59.68,Passed,Hard ridden throughout; unimpressive.,ST,1000,HK_2017_B476
2018101602,2018-10-16,2,8,CHAMPION SUPREME (B435),C Y Ho,C Fownes,13,B,3-1/4L,2 3 8,0.59.82,,On pace early; limited response late.,ST,1000,HK_2017_B435
2018101602,2018-10-16,2,9,SUREWIN (B157),W M Lai,C W Chang,9,B,7L,5 5 9,1.00.38,Required to pass stall test,Difficult to load; weakened halfway.,ST,1000,HK_2017_B157
2018101602,2018-10-16,2,10,UNIVERSAL STARS (B429),K C Ng,A S Cruz,14,H,9-1/2L,3 9 10,1.00.79,,Kept on laying-in when being niggled along throughout.,ST,1000,HK_2017_B429
2018101602,2018-10-16,2,11,SUPER KIN (C011),Z Purton,C Fownes,11,,10L,7 11 11,1.00.87,,Under a hold late; never in contention.,ST,1000,HK_2018_C011
2018101602,2018-10-16,2,12,NORTHERN EXPRESS (B481),S Clipperton,J Size,12,B,12-1/2L,12 13 12,1.01.28,Passed,Not willing to stride out when being hard ridden.,ST,1000,HK_2017_B481
2018101602,2018-10-16,2,13,MY DEAR (B445),A Sanna,A S Cruz,10,,13L,11 12 13,1.01.36,,Raced greenly; finished last.,ST,1000,HK_2017_B445
2018101602,2018-10-16,2,14,PERFECT BUDDY (B408),M L Yeung,K W Lui,4,H,,UR,,Failed,,ST,1000,HK_2017_B408
2018101603,2018-10-16,3,1,YICHUN BLITZ (C026),M Chadwick,R Gibson,11,,,5 2 1,0.58.97,Passed,Made progress steadily; ran on nicely to score.,ST,1000,HK_2018_C026
2018101603,2018-10-16,3,2,AURORA STEED (C023),S Clipperton,J Size,8,B,1/2L,1 1 2,0.59.05,Passed,Led along the outside rail; laying-in late and difficult to be ridden out.,ST,1000,HK_2018_C023
2018101603,2018-10-16,3,3,BESTA LUCK (B462),C Schofield,R Gibson,6,,1/2L,2 4 3,0.59.07,Passed,On pace for 3rd; laying-in slightly late.,ST,1000,HK_2017_B462
2018101603,2018-10-16,3,4,MISCHIEVOUS SUNDAE (C016),K Teetan,J Size,10,,1-3/4L,6 5 4,0.59.25,Passed,Ran on fairly well when asked at 400m.,ST,1000,HK_2018_C016
2018101603,2018-10-16,3,5,BRAVE BABY (C066),C Y Ho,A S Cruz,13,,2L,3 6 5,0.59.30,,Responded OK when being hard ridden.,ST,1000,HK_2018_C066
2018101603,2018-10-16,3,6,HIGH REV (C007),Z Purton,D J Hall,14,,3L,7 13 6,0.59.43,,Ran on fairly well when persuaded at 300m.,ST,1000,HK_2018_C007
2018101603,2018-10-16,3,7,TORNADO TWIST (C028),A Sanna,J Size,12,,3L,4 3 7,0.59.43,Passed,Up with the pace; limited response late.,ST,1000,HK_2018_C028
2018101603,2018-10-16,3,8,WINNING ENDEAVOUR (C048),U Rispoli,K L Man,1,,3-1/4L,8 7 8,0.59.49,,Limited response when asked; unimpressive.,ST,1000,HK_2018_C048
2018101603,2018-10-16,3,9,MAHLER MOJO (B301),G van Niekerk,A T Millard,5,B,4-3/4L,13 12 9,0.59.72,Passed,Shifted out after start; under whip and hard ridden at 400m.,ST,1000,HK_2017_B301
2018101603,2018-10-16,3,10,YEE CHEONG LUCKY (B357),T H So,D J Hall,7,H/XB,4-3/4L,10 9 10,0.59.74,,Not much progress when under whip at 300m.,ST,1000,HK_2017_B357
2018101603,2018-10-16,3,11,PEGASUS ELITE (B324),D Whyte,K W Lui,3,H,8L,14 14 11,1.00.25,,Brushed on jumping; raced awkwardly throughout.,ST,1000,HK_2017_B324
2018101603,2018-10-16,3,12,REAL GIANT (B382),M L Yeung,D J Hall,2,,8-1/4L,12 10 12,1.00.28,,Bumped at 400m; failed to respond.,ST,1000,HK_2017_B382
2018101603,2018-10-16,3,13,DRAGON REGIMENT (B439),K C Leung,T P Yung,9,H/B,8-1/4L,9 8 13,1.00.28,,Weakened halfway; gave ground and dropped back.,ST,1000,HK_2017_B439
2018101603,2018-10-16,3,14,SIMPLY FABULOUS (B369),M F Poon,D J Hall,4,,11L,11 11 14,1.00.74,Failed,Bumped on jumping; hanging in at 400m; found nothing when asked.,ST,1000,HK_2017_B369
2018101604,2018-10-16,4,1,GUERDON HELMET (B007),N Callan,D E Ferraris,1,B,,1 1 1,0.46.70,,Led with good pace; ran on nicely to score.,ST,800,HK_2017_B007
2018101604,2018-10-16,4,2,MURRAY'S PARTNERS (B426),D Whyte,C H Yip,6,,1-1/4L,5 2 2,0.46.91,Passed,Always in touch; moved better than before.,ST,800,HK_2017_B426
2018101604,2018-10-16,4,3,CHARIZARD (B463),U Rispoli,D E Ferraris,5,,1-1/2L,4 3 3,0.46.93,,Ran on for 3rd when asked; laying-in slightly late.,ST,800,HK_2017_B463
2018101604,2018-10-16,4,4,CHEEKY BEE (B471),G van Niekerk,D E Ferraris,9,,2L,8 9 4,0.47.00,,Ran on well when being hard ridden.,ST,800,HK_2017_B471
2018101604,2018-10-16,4,5,AMAZING CHOCOLATE (C059),C Schofield,R Gibson,2,,2-3/4L,6 6 5,0.47.14,,Midfield under a hold; just to pass trial.,ST,800,HK_2018_C059
2018101604,2018-10-16,4,6,MEDIC DRAGON (B443),K Teetan,P O'Sullivan,3,,4-1/4L,9 7 6,0.47.36,Passed,Tardy start; ran on when asked.,ST,800,HK_2017_B443
2018101604,2018-10-16,4,7,POWER RACER (B459),A Sanna,M J Freedman,8,,4-3/4L,2 4 7,0.47.46,Passed,On pace early; gave ground halfway.,ST,800,HK_2017_B459
2018101604,2018-10-16,4,8,HAPPY WINNER (B450),T H So,L Ho,10,,6L,3 5 8,0.47.67,,Gave ground and dropped back; unimpressive.,ST,800,HK_2017_B450
2018101604,2018-10-16,4,9,GREAT HARVEST (B390),M L Yeung,K L Man,7,B,10L,7 8 9,0.48.28,Passed,Gave ground when asked; never in contention.,ST,800,HK_2017_B390
2018101604,2018-10-16,4,10,HEALTHY TREASURE (B482),C Y Ho,K L Man,4,,12L,10 10 10,0.48.62,Failed,Slow to begin; not willing to stretch.,ST,800,HK_2017_B482
2018101605,2018-10-16,5,1,FABULOUS EIGHT (B473),U Rispoli,P F Yiu,7,,,4 2 1,0.47.03,Passed,Hit the front late to score; plenty in hand.,ST,800,HK_2017_B473
2018101605,2018-10-16,5,2,GLENEALY GENERALS (B475),Z Purton,C H Yip,2,,1-1/4L,1 1 2,0.47.23,Passed,Led early; ran on comfortably for 2nd.,ST,800,HK_2017_B475
2018101605,2018-10-16,5,3,DIONYSUS COLLIN (B436),C Y Ho,K W Lui,5,H,1-1/4L,10 8 3,0.47.25,Passed,Dashed on centre track; impressive.,ST,800,HK_2017_B436
2018101605,2018-10-16,5,4,AIOLOS (C040),D Whyte,W Y So,4,,1-1/2L,8 3 4,0.47.28,Passed,Unbalanced momentarily after start; under a hold and not tested.,ST,800,HK_2018_C040
2018101605,2018-10-16,5,5,SUNDANCER (B465),K Teetan,P F Yiu,11,,1-1/2L,2 7 5,0.47.28,,Responded fairly well when under whip at 200m.,ST,800,HK_2017_B465
2018101605,2018-10-16,5,6,THIS IS CLASS (B420),M L Yeung,K W Lui,8,H,2-1/2L,5 5 6,0.47.43,Passed,Under a hold midfield; ran on fairly well.,ST,800,HK_2017_B420
2018101605,2018-10-16,5,7,GLORIOUS DRAGON (C120),G van Niekerk,A T Millard,1,,2-3/4L,6 4 7,0.47.48,Passed,Limited response when being hard ridden.,ST,800,HK_2018_C120
2018101605,2018-10-16,5,8,KING OF THE NORTH (B039),A Sanna,C H Yip,9,B,2-3/4L,11 11 8,0.47.48,Passed,Made minor inroads when under whip at 400m.,ST,800,HK_2017_B039
2018101605,2018-10-16,5,9,A SHIN MOBIUS (B441),K C Leung,W Y So,10,H,5-1/2L,3 6 9,0.47.91,Passed,Difficult to load; jumped OK; failed to respond.,ST,800,HK_2017_B441
2018101605,2018-10-16,5,10,SUN FOXHUNTER (B389),H N Wong,K W Lui,3,,5-1/2L,7 9 10,0.47.91,Passed,Gave ground and dropped back; raced greenly.,ST,800,HK_2017_B389
2018101605,2018-10-16,5,11,YOUNG POWER (B442),W M Lai,C H Yip,6,,8-1/2L,9 10 11,0.48.38,Passed,Never in contention; finished last.,ST,800,HK_2017_B442
2018101606,2018-10-16,6,1,WHAT A LEGEND (C004),M L Yeung,K H Ting,13,,,7 4 1,0.46.84,Passed,Made progress steadily to score; impressive.,ST,800,HK_2018_C004
2018101606,2018-10-16,6,2,JIMSON THE DRAGON (C017),U Rispoli,C H Yip,10,,SH,2 2 2,0.46.86,Passed,Always in touch; just caught.,ST,800,HK_2018_C017
2018101606,2018-10-16,6,3,KING'S HEROISM (C014),W M Lai,L Ho,11,H,1/2L,4 5 3,0.46.91,Passed,Laying-in at 400m; hard ridden for 3rd.,ST,800,HK_2018_C014
2018101606,2018-10-16,6,4,CRAIG'S STAR (C041),C Schofield,M J Freedman,7,,1L,3 3 4,0.47.00,Passed,Ran on OK but laying-in late.,ST,800,HK_2018_C041
