race_id,Date,trial_number,horse_number,Horse,Jockey,Trainer,Draw,Gear,LBW,Running Position,Time,Result,Comment,Track,Dist.,horse_id
2018032704,2018-03-27,4,10,TELECOM SUN (A070),M L Yeung,A Lee,5,B,15L,7 7 10,1.13.61,Failed,Found nothing when being hard ridden.,ST_AWT,1200,HK_2016_A070
2018032704,2018-03-27,4,11,OWNERS' DELIGHT (A335),H T Mo,C S Shum,8,B/H,,UR,,,,ST_AWT,1200,HK_2016_A335
2018032704,2018-03-27,4,12,MY BEAR CAT (A425),N Callan,D E Ferraris,10,,,UR,,,,ST_AWT,1200,HK_2016_A425
2018032705,2018-03-27,5,1,MR STUNNING (V153),N Rawiller,J Size,5,,,3 5 1,1.00.89,,Dashed on well to score centre track; impressive.,ST_AWT,1050,HK_2015_V153
2018032705,2018-03-27,5,2,BEAT THE CLOCK (V397),J Moreira,J Size,8,,1/2L,5 4 2,1.00.98,,Hanging out momentarily at 300m; dashed on well for 2nd.,ST_AWT,1050,HK_2015_V397
2018032705,2018-03-27,5,3,PENIAPHOBIA (S143),M Chadwick,A S Cruz,1,CP,3/4L,1 1 3,1.01.03,,Led early; ran on for 3rd.,ST_AWT,1050,HK_2013_S143
2018032705,2018-03-27,5,4,BRAVO WATCHMAN (A102),H N Wong,W Y So,4,V,1-1/2L,2 2 4,1.01.13,,On pace three wide; not fully tested.,ST_AWT,1050,HK_2016_A102
2018032705,2018-03-27,5,5,RAGING BLITZKRIEG (B147),C Y Ho,J Size,2,H,2-3/4L,4 3 5,1.01.32,,Up with the pace; impressive.,ST_AWT,1050,HK_2017_B147
2018032705,2018-03-27,5,6,SUMMER PASSAGE (B273),C Schofield,P O'Sullivan,7,B,3-1/2L,6 7 6,1.01.47,Passed,Shifted racing ground at 300m; not tested.,ST_AWT,1050,HK_2017_B273
2018032705,2018-03-27,5,7,COOL TEAM (B264),K C Leung,P O'Sullivan,3,,6-1/2L,7 6 7,1.01.94,,Slightly slow to begin; ran on ordinary.,ST_AWT,1050,HK_2017_B264
2018032705,2018-03-27,5,8,MY LITTLE FRIEND (S010),M L Yeung,T P Yung,6,,10-1/2L,8 8 8,1.02.56,,Wide throughout; raced under his own steam.,ST_AWT,1050,HK_2013_S010
2018040301,2018-04-03,1,1,PATRIOT HERO (B159),K Teetan,D E Ferraris,3,,,8 7 1,0.58.23,Passed,Raced greenly but still dashed on well to score.,ST,1000,HK_2017_B159
2018040301,2018-04-03,1,2,TELECOM BROTHERS (B243),M L Yeung,Y S Tsui,8,,Neck,2 2 2,0.58.29,,Always in touch; kept on well late.,ST,1000,HK_2017_B243
2018040301,2018-04-03,1,3,MONICA (B271),S Clipperton,M J Freedman,9,,1/2L,1 1 3,0.58.31,,On pace for 3rd; ran on nicely.,ST,1000,HK_2017_B271
2018040301,2018-04-03,1,4,AMAZING KIDS (T179),B Prebble,J Size,1,,2-3/4L,4 4 4,0.58.65,,Held ground throughout; ran on comfortably.,ST,1000,HK_2014_T179
2018040301,2018-04-03,1,5,CONSORT (V172),K C Ng,A S Cruz,4,PC,4-1/4L,9 8 5,0.58.92,,Niggled along throughout; dashed on fairly well.,ST,1000,HK_2015_V172
2018040301,2018-04-03,1,6,I AM POWER (B240),T Berry,M J Freedman,7,,4-1/2L,3 3 6,0.58.95,,Up with the pace; weakened late.,ST,1000,HK_2017_B240
2018040301,2018-04-03,1,7,DIAMOND RHYME (B183),N Rawiller,K W Lui,5,,5-1/2L,7 6 7,0.59.09,,Settled midfield; ran on comfortably.,ST,1000,HK_2017_B183
2018040301,2018-04-03,1,8,XIANG BAI QI (B336),A Sanna,D E Ferraris,6,,5-3/4L,5 5 8,0.59.14,,Flattened halfway; ran on ordinary when asked.,ST,1000,HK_2017_B336
2018040301,2018-04-03,1,9,EXULTANT (B101),Z Purton,A S Cruz,2,XB,8-1/4L,10 10 9,0.59.53,,Eased back to settle at rear; just to stretch out.,ST,1000,HK_2017_B101
2018040301,2018-04-03,1,10,MAJESTIC ENDEAVOUR (A399),C Y Ho,C Fownes,10,,9L,6 9 10,0.59.67,,Gave ground throughout; never in contention.,ST,1000,HK_2016_A399
2018040302,2018-04-03,2,1,FIFTY FIFTY (A287),K Teetan,L Ho,1,,,9 7 1,0.57.77,,Made progress steadily; won well.,ST,1000,HK_2016_A287
2018040302,2018-04-03,2,2,HAPPY FUN (B316),M F Poon,C S Shum,5,H,3/4L,4 4 2,0.57.90,,On pace early; quickened late under urge for 2nd.,ST,1000,HK_2017_B316
2018040302,2018-04-03,2,3,MR LUMIERES (B179),A Sanna,D J Hall,10,,1-1/4L,1 2 3,0.57.96,,On pace early; ran 3rd comfortably.,ST,1000,HK_2017_B179
2018040302,2018-04-03,2,4,SPEED VISION (B211),M L Yeung,F C Lor,12,,1-1/4L,5 5 4,0.57.98,,Hard ridden to be nearest at finish.,ST,1000,HK_2017_B211
2018040302,2018-04-03,2,5,LUCKY HERO (B057),Z Purton,C S Shum,3,B,1-3/4L,3 3 5,0.58.04,Passed,Up with the pace; under a hold late.,ST,1000,HK_2017_B057
2018040302,2018-04-03,2,6,FLYING FORCE (V014),T Berry,C H Yip,6,XB,2-1/4L,6 6 6,0.58.13,,Held ground and raced behind runners.,ST,1000,HK_2015_V014
2018040302,2018-04-03,2,7,SUCH A HAPPINESS (A152),N Callan,T P Yung,11,B,2-3/4L,8 8 7,0.58.19,,Ran on impressively when persuaded late.,ST,1000,HK_2016_A152
2018040302,2018-04-03,2,8,KA YING LEGEND (B234),K C Ng,T P Yung,8,,3-1/2L,2 1 8,0.58.34,,Led early; weakened late.,ST,1000,HK_2017_B234
2018040302,2018-04-03,2,9,RED ROSE WARRIOR (A161),H N Wong,D Cruz,4,PC,5L,11 9 9,0.58.56,,Blocked after start; raced awkwardly.,ST,1000,HK_2016_A161
2018040302,2018-04-03,2,10,VILLA FIONN (B339),N Rawiller,C S Shum,7,,5-3/4L,10 11 10,0.58.70,Passed,Settled at rear; failed to respond.,ST,1000,HK_2017_B339
2018040302,2018-04-03,2,11,PING HAI STAR (A375),O Doleuze,J Size,2,B,11L,12 12 11,0.59.52,,Taken back early; ran on strongly after the post.,ST,1000,HK_2016_A375
2018040302,2018-04-03,2,12,CIVILISED (B282),C Y Ho,D Cruz,9,CP,14-1/2L,7 10 12,1.00.09,Failed,Gave ground although being niggled along throughout.,ST,1000,HK_2017_B282
2018040303,2018-04-03,3,1,ELITE DREAM (B248),B Prebble,F C Lor,9,XB,,2 1 1,0.57.74,,Always in touch; moved better than before.,ST,1000,HK_2017_B248
2018040303,2018-04-03,3,2,VICTORY POWER (B294),M Chadwick,R Gibson,7,B,1-1/4L,6 6 2,0.57.93,Passed,Tardy start; came form behind for 2nd when under whip at 200m.,ST,1000,HK_2017_B294
2018040303,2018-04-03,3,3,SUPER WISE (A100),Z Purton,C H Yip,2,H,1-3/4L,4 3 3,0.58.00,,Under restraint for 3rd with plenty in hand.,ST,1000,HK_2016_A100
2018040303,2018-04-03,3,4,DOUBLE DOWN (V384),M L Yeung,W Y So,10,H/P,4-1/4L,3 4 4,0.58.41,,Kept on one-paced when asked late.,ST,1000,HK_2015_V384
2018040303,2018-04-03,3,5,RUN MOOCHI (B277),C Y Ho,K L Man,12,,4-1/2L,5 5 5,0.58.47,,Not quickened when being niggled along throughout.,ST,1000,HK_2017_B277
2018040303,2018-04-03,3,6,LIGHTNING TREASURE (B259),N Callan,P F Yiu,8,,5-1/4L,9 8 6,0.58.57,,Began moderately; weakened when being hard ridden late.,ST,1000,HK_2017_B259
2018040303,2018-04-03,3,7,WISH COME TRUE (A370),T Berry,C H Yip,11,,7-1/4L,7 7 7,0.58.89,,Under a hold midfield; not tested.,ST,1000,HK_2016_A370
2018040303,2018-04-03,3,8,HONG KONG'S FOLKS (B063),O Doleuze,C W Chang,6,B/H,9L,10 9 8,0.59.18,,Shifted racing ground at 400m; ran on ordinary.,ST,1000,HK_2017_B063
2018040303,2018-04-03,3,9,FAME AND FORTUNE (B082),M F Poon,D J Hall,1,,10-1/2L,1 2 9,0.59.40,Passed,Led early; failed to respond and weakened late.,ST,1000,HK_2017_B082
2018040303,2018-04-03,3,10,PICKEN (B311),S Clipperton,J Size,5,,11-3/4L,11 10 10,0.59.61,Failed,Slightly slow to begin; raced greenly.,ST,1000,HK_2017_B311
2018040303,2018-04-03,3,11,CHIMBORAA (V411),A Sanna,L Ho,3,B/H,18-1/2L,8 11 11,1.00.69,Failed,Weakened and gave ground when under whip at 400m.,ST,1000,HK_2015_V411
2018040303,2018-04-03,3,12,BEAUTY DAY (B076),N Rawiller,A S Cruz,4,B/H,19-3/4L,12 12 12,1.00.88,Failed,Stumbled after start; raced under his own steam.,ST,1000,HK_2017_B076
2018040303,2018-04-03,3,13,SLEEP EDUCATION (A362),,D E Ferraris,13,,,Withdrawn,,,,ST,1000,HK_2016_A362
2018040304,2018-04-03,4,1,LUNAR ZEPHYR (V385),B Prebble,W Y So,10,,,1 1 1,0.58.61,,Led all the way; kept on well to score.,ST,1000,HK_2015_V385
2018040304,2018-04-03,4,2,LIGHTNING STEED (B274),T Berry,M J Freedman,12,,3/4L,3 2 2,0.58.72,,On pace for 2nd; moved better than before.,ST,1000,HK_2017_B274
2018040304,2018-04-03,4,3,TRAVEL AMBASSADOR (T113),M L Yeung,A Lee,5,B,2-1/2L,11 7 3,0.58.99,,Quickened for 3rd when shifted centre track 400m.,ST,1000,HK_2014_T113
2018040304,2018-04-03,4,4,ROCKAGE (B242),H N Wong,F C Lor,13,XB,2-1/2L,4 3 4,0.59.02,,Persuaded late to be nearest at finish.,ST,1000,HK_2017_B242
2018040304,2018-04-03,4,5,GLORIAM (A223),N Callan,P F Yiu,7,B,3L,8 4 5,0.59.10,,Limited response when asked late.,ST,1000,HK_2016_A223
2018040304,2018-04-03,4,6,RACING FIGHTER (B285),Z Purton,M J Freedman,6,CP,3-1/4L,2 6 6,0.59.13,,Up with the pace; under restraint late.,ST,1000,HK_2017_B285
2018040304,2018-04-03,4,7,SHINING BRIGHT (B297),O Doleuze,C W Chang,2,SR,3-1/2L,10 9 7,0.59.19,Passed,Made minor progress late; ran on OK.,ST,1000,HK_2017_B297
2018040304,2018-04-03,4,8,FORTUNATE RUNNER (A292),C Y Ho,K W Lui,3,CP,4-1/4L,6 8 8,0.59.28,,Ridden along halfway; never in contention.,ST,1000,HK_2016_A292
2018040304,2018-04-03,4,9,HONEST HORSE (S428),U Rispoli,T P Yung,8,,5-1/2L,12 10 9,0.59.48,,Made minor inroads when shifted in late.,ST,1000,HK_2013_S428
2018040304,2018-04-03,4,10,REGENCY HONEY (A059),K C Ng,A S Cruz,11,V,6-1/2L,5 5 10,0.59.66,,Failed to respond halfway; ran on ordinary.,ST,1000,HK_2016_A059
2018040304,2018-04-03,4,11,DOCTOR FORTUNE (B194),N Rawiller,F C Lor,9,B,10-3/4L,9 12 11,1.00.32,,Failed to respond; no progress.,ST,1000,HK_2017_B194
2018040304,2018-04-03,4,12,YOUNG GLORY (B292),S Clipperton,M J Freedman,4,CP,13-3/4L,7 11 12,1.00.80,Failed,Weakened and gave ground at 300m.,ST,1000,HK_2017_B292
2018040304,2018-04-03,4,13,WONDERFUL JOURNEY (T402),,P F Yiu,1,,,Withdrawn,,,,ST,1000,HK_2014_T402
2018040305,2018-04-03,5,1,TRIUMPHANT LIGHT (T224),K Teetan,D E Ferraris,13,,,3 4 1,0.58.16,,Came from behind to score narrowly when asked late.,ST,1000,HK_2014_T224
2018040305,2018-04-03,5,2,BLITZING (B290),Z Purton,W Y So,9,,1/2L,1 1 2,0.58.26,,Led early for 2nd; not fully tested.,ST,1000,HK_2017_B290
2018040305,2018-04-03,5,3,PERFECT CHOICE (A216),B Prebble,W Y So,4,,2L,9 5 3,0.58.48,,Caught in traffic at 400m; quickened for 3rd.,ST,1000,HK_2016_A216
2018040305,2018-04-03,5,4,LUCKY KINGDOM (V420),M L Yeung,A Lee,8,B,4-1/4L,2 2 4,0.58.82,,On pace early; weakened late.,ST,1000,HK_2015_V420
2018040305,2018-04-03,5,5,INDIGENOUS STAR (A081),C Y Ho,P F Yiu,3,CP,5-1/4L,7 8 5,0.59.02,,Made progress steadily; ran on fairly well.,ST,1000,HK_2016_A081
2018040305,2018-04-03,5,6,GOLDEN DEER (P121),K C Ng,T P Yung,12,B,5-1/2L,13 11 6,0.59.02,,Ran on strongly from behind; moved better than before.,ST,1000,HK_2012_P121
2018040305,2018-04-03,5,7,HURRICANE HUNTER (A123),U Rispoli,T P Yung,10,,8L,4 6 7,0.59.43,,Limited response when hard ridden late.,ST,1000,HK_2016_A123
2018040305,2018-04-03,5,8,SMART ROCKET (B322),T Berry,J Moore,5,H,8-1/4L,11 10 8,0.59.46,Passed,Limited progress when under whip and hard ridden.,ST,1000,HK_2017_B322
2018040305,2018-04-03,5,9,SKY FORTUNE (B321),A Sanna,Y S Tsui,6,,8-3/4L,5 3 9,0.59.55,Passed,Up with the pace; weakened badly late.,ST,1000,HK_2017_B321
2018040305,2018-04-03,5,10,SPEEDY DRAGON (B185),N Rawiller,D J Hall,11,,9-1/4L,12 13 10,0.59.66,,Settled at rear; ran on ordinary.,ST,1000,HK_2017_B185
2018040305,2018-04-03,5,11,FAIR COMMENT (A014),M Chadwick,A S Cruz,2,B,9-3/4L,10 12 11,0.59.73,,Under whip late; no progress.,ST,1000,HK_2016_A014
2018040305,2018-04-03,5,12,STYLING CITY (B280),S Clipperton,J Moore,7,B,9-3/4L,8 9 12,0.59.74,Passed,Ran on ordinary; never in contention.,ST,1000,HK_2017_B280
2018040305,2018-04-03,5,13,BINGO VIN STAR (B281),N Callan,C H Yip,1,B,17-1/4L,6 7 13,1.00.90,Failed,Weakened badly when under whip at 400m.,ST,1000,HK_2017_B281
2018040306,2018-04-03,6,1,HOUSE OF FUN (V092),S Clipperton,J Size,1,,,4 3 1,0.46.26,Passed,Made progress steadily; won comfortably.,ST,800,HK_2015_V092
2018040306,2018-04-03,6,2,EPTIMUM (B305),C Y Ho,C Fownes,2,,1/2L,3 1 2,0.46.35,Passed,Hit the front at one stage; not fully tested.,ST,800,HK_2017_B305
2018040306,2018-04-03,6,3,EXPRESS STAR (B342),Z Purton,C S Shum,5,,4L,2 2 3,0.46.92,Passed,Showed good early pace; ran 3rd comfortably.,ST,800,HK_2017_B342
2018040306,2018-04-03,6,4,SEBFIRE (B304),N Rawiller,C Fownes,4,,6L,6 6 4,0.47.23,Passed,Under a hold for 4th; impressive.,ST,800,HK_2017_B304
2018040306,2018-04-03,6,5,KING OPIE (B034),K Teetan,F C Lor,7,,7-3/4L,5 5 5,0.47.51,,Held ground throughout; not tested.,ST,800,HK_2017_B034
2018040306,2018-04-03,6,6,ADVENTURER (V066),H N Wong,Y S Tsui,8,H,9-1/4L,1 4 6,0.47.74,,First to jump; raced under his own steam.,ST,800,HK_2015_V066
2018040306,2018-04-03,6,7,SIGHT LEADER (A211),B Prebble,W Y So,3,H/SR,15-1/2L,8 8 7,0.48.76,,Shifted out on jumping; hung out and difficult to be ridden out.,ST,800,HK_2016_A211
2018040306,2018-04-03,6,8,ROCKIN' IBIS (B077),A Sanna,P O'Sullivan,6,,16-1/2L,7 7 8,0.48.92,,Failed to respond; weakened and gave ground.,ST,800,HK_2017_B077
2018040307,2018-04-03,7,1,QUADRUPLE DOUBLE (B250),Z Purton,D J Hall,12,,,1 1 1,0.45.83,,Led all the way; kept on nicely to score.,ST,800,HK_2017_B250
2018040307,2018-04-03,7,2,PEOPLE'S CHAMPION (A385),A Sanna,D J Hall,2,H,2-3/4L,4 2 2,0.46.25,,Ran on strongly for 2nd when being hard ridden.,ST,800,HK_2016_A385
2018040307,2018-04-03,7,3,NASHASHUK (V143),B Prebble,J Size,11,,4-1/2L,3 3 3,0.46.53,,On pace for 3rd; ran on nicely.,ST,800,HK_2015_V143
2018040307,2018-04-03,7,4,EVERYONE'S ELITE (B074),C Y Ho,K L Man,13,,5-3/4L,2 4 4,0.46.74,,Up with the pace; limited response when asked.,ST,800,HK_2017_B074
2018040307,2018-04-03,7,5,NAMJONG NAMJONG (B323),M L Yeung,Y S Tsui,4,,7-1/2L,5 5 5,0.47.01,Passed,Held ground throughout; ran on fairly well.,ST,800,HK_2017_B323
2018040307,2018-04-03,7,6,CHACHAUP (B037),H N Wong,P O'Sullivan,3,,8L,6 7 6,0.47.11,Passed,Settled midfield; strode out well.,ST,800,HK_2017_B037
2018040307,2018-04-03,7,7,ABSOLUCOOL (A328),N Rawiller,C Fownes,10,,8L,11 11 7,0.47.12,Passed,Made progress along the outside rail; ran on OK.,ST,800,HK_2016_A328
2018040307,2018-04-03,7,8,PACIFIC MASTER (B215),T Berry,J Moore,6,B,9-1/2L,9 6 8,0.47.35,Passed,Limited response when asked; never in contention.,ST,800,HK_2017_B215
2018040307,2018-04-03,7,9,SAVVY SEVEN (B314),S Clipperton,J Moore,8,B,9-3/4L,12 10 9,0.47.38,Passed,Rearward early; minor progress.,ST,800,HK_2017_B314
2018040307,2018-04-03,7,10,BLACK TECH (B296),W M Lai,C W Chang,5,H,9-3/4L,7 8 10,0.47.40,Passed,Found nothing when asked late.,ST,800,HK_2017_B296
2018040307,2018-04-03,7,11,KING KANALOA (B202),N Callan,J Moore,1,B,12-1/2L,10 9 11,0.47.83,Failed,Slightly slow to begin; raced greenly when under whip and hard ridden.,ST,800,HK_2017_B202
2018040307,2018-04-03,7,12,STAR OF HONG KONG (A019),M F Poon,L Ho,9,,15-1/4L,8 12 12,0.48.25,Failed,Failed to respond; unimpressive.,ST,800,HK_2016_A019
2018040307,2018-04-03,7,13,STRAPPING BAUHINIA (B325),K Teetan,Y S Tsui,7,H,17-3/4L,13 13 13,0.48.67,Failed,Slow to begin; raced greenly.,ST,800,HK_2017_B325
2018040308,2018-04-03,8,1,GOKO (A270),U Rispoli,C H Yip,2,,,7 5 5 1,1.36.44,,Hit the line strongly to score when shifted out in the Straight.,ST,1600,HK_2016_A270
2018040308,2018-04-03,8,2,LAST KINGDOM (B203),C Wong,A T Millard,7,H,3/4L,2 2 2 2,1.36.58,,Under restraint early; weakened late.,ST,1600,HK_2017_B203
2018040308,2018-04-03,8,3,LUCKY GIRL (T355),M F Poon,C S Shum,4,,5-3/4L,3 3 3 3,1.37.36,,Up with the pace; ran on one-paced for 3rd.,ST,1600,HK_2014_T355
2018040308,2018-04-03,8,4,ISLAND FLYER (S423),K Teetan,P F Yiu,1,B/XB,8L,4 4 4 4,1.37.71,,Held ground throughout; limited response when asked.,ST,1600,HK_2013_S423
2018040308,2018-04-03,8,5,SUPREME STORM (A205),M L Yeung,A Lee,5,,8-1/2L,1 1 1 5,1.37.79,Passed,Led early; weakened in straight.,ST,1600,HK_2016_A205
2018040308,2018-04-03,8,6,SMART BABY (A160),N Rawiller,C Fownes,3,V,11-1/4L,6 7 6 6,1.38.23,,Ran on ordinary when clear in the Straight.,ST,1600,HK_2016_A160
2018040308,2018-04-03,8,7,AMAZING WONDER (B206),A Sanna,L Ho,6,H,22-3/4L,5 6 7 7,1.40.09,Failed,Asked at turn; weakened and finished last.,ST,1600,HK_2017_B206
2018040309,2018-04-03,9,1,G-ONE LOVER (T427),H N Wong,C S Shum,1,B,,1 1 1,1.11.00,,Led along the rail; ran on strongly to score.,ST_AWT,1200,HK_2014_T427
2018040309,2018-04-03,9,2,PEOPLE'S KNIGHT (T305),S Clipperton,J Moore,6,,1-1/4L,2 2 2,1.11.19,,Always in touch; ran on for 2nd.,ST_AWT,1200,HK_2014_T305
2018040309,2018-04-03,9,3,WESTERN EXPRESS (A090),N Rawiller,J Size,3,,1-1/2L,9 7 3,1.11.25,,Under restraint early; hit the line strongly late.,ST_AWT,1200,HK_2016_A090
2018040309,2018-04-03,9,4,RIGHT HONOURABLE (A164),M L Yeung,R Gibson,2,H/P,2-1/4L,4 3 4,1.11.37,,Raced under his own steam when caught in traffic at 200m.,ST_AWT,1200,HK_2016_A164
2018040309,2018-04-03,9,5,WINNING FAITH (A253),M F Poon,C S Shum,8,CP/H,3-1/4L,7 8 5,1.11.50,,Dashed on fairly well when shifted out in the Straight.,ST_AWT,1200,HK_2016_A253
2018040309,2018-04-03,9,6,RUTHVEN (B160),T Berry,J Moore,4,B,3-1/2L,5 4 6,1.11.55,,Limited response when persuaded at 200m.,ST_AWT,1200,HK_2017_B160
2018040309,2018-04-03,9,7,WIN BEAUTY WIN (A290),K Teetan,P O'Sullivan,5,B,5-1/4L,8 9 7,1.11.84,,Under a hold when shifted to the inside in the Straight.,ST_AWT,1200,HK_2016_A290
2018040309,2018-04-03,9,8,POSITIVELY HIGH (B245),C Y Ho,C Fownes,7,B,9-1/4L,3 5 8,1.12.47,Passed,Up with the pace; weakened badly late.,ST_AWT,1200,HK_2017_B245
2018040309,2018-04-03,9,9,SAVVY SIX (B153),A Sanna,A S Cruz,9,PC/H,12L,6 6 9,1.12.92,Passed,Four wide at turn; weakened in the Straight.,ST_AWT,1200,HK_2017_B153
2018040310,2018-04-03,10,1,GALLANT RETURN (A308),M F Poon,D J Hall,8,,,1 1 1,1.11.29,,Led along the rail; kept on well to score.,ST_AWT,1200,HK_2016_A308
2018040310,2018-04-03,10,2,DARING HEART (V260),K Teetan,D E Ferraris,7,,3/4L,8 8 2,1.11.41,Passed,Wide throughout; ran on impressively from behind for 2nd.,ST_AWT,1200,HK_2015_V260
2018040310,2018-04-03,10,3,CIRCUIT GLORY (A402),T Berry,J Moore,6,H/XB,3/4L,6 7 3,1.11.44,,Eased back early; quickened in the Straight for 3rd.,ST_AWT,1200,HK_2016_A402
2018040310,2018-04-03,10,4,NOBLE STEED (A326),B Prebble,K W Lui,5,,1-1/4L,9 6 4,1.11.51,,Taken back early; dashed on well in the Straight.,ST_AWT,1200,HK_2016_A326
2018040310,2018-04-03,10,5,SO FAST (S419),H N Wong,W Y So,1,B/E,2-1/2L,3 3 5,1.11.67,,Up with the pace; limited response when asked late.,ST_AWT,1200,HK_2013_S419
2018040310,2018-04-03,10,6,THE INVINCIBLE (A191),C Y Ho,W Y So,4,B,3-3/4L,4 4 6,1.11.88,,Wide throughout; under a hold in the Straight.,ST_AWT,1200,HK_2016_A191
2018040310,2018-04-03,10,7,KEEP GOING (B231),M L Yeung,Y S Tsui,2,,3-3/4L,7 5 7,1.11.89,,Saved ground throughout; failed to respond when asked.,ST_AWT,1200,HK_2017_B231
2018040310,2018-04-03,10,8,MONGOLIAN LEGEND (B317),A Sanna,Y S Tsui,9,,6-1/4L,2 2 8,1.12.28,,Asked at turn; weakened and gave ground.,ST_AWT,1200,HK_2017_B317
2018040310,2018-04-03,10,9,A SHIN HOOF (A181),N Callan,D E Ferraris,3,H,16-1/2L,5 9 9,1.13.93,,Gave ground in the Straight; never in contention.,ST_AWT,1200,HK_2016_A181
2018040310,2018-04-03,10,10,ALCAZAR (A131),,M J Freedman,10,,,Withdrawn,,,,ST_AWT,1200,HK_2016_A131
2018040311,2018-04-03,11,1,DRAGON WARRIOR (V202),M L Yeung,W Y So,5,,,1 1 1,1.12.31,,Led from middle gate; kept on well to score.,ST_AWT,1200,HK_2015_V202
2018040311,2018-04-03,11,2,STARLIT KNIGHT (A137),C L Chau,Y S Tsui,9,P,SH,2 2 2,1.12.34,,Shared lead early; kept on late for 2nd.,ST_AWT,1200,HK_2016_A137
2018040311,2018-04-03,11,3,M REBORN (A046),T Berry,C H Yip,3,,1-3/4L,9 7 3,1.12.59,,Made progress steadily for 3rd when clear in the Straight.,ST_AWT,1200,HK_2016_A046
2018040311,2018-04-03,11,4,WONDERFUL TIGER (A235),N Callan,W Y So,10,H/B,2L,3 3 4,1.12.61,,Hard ridden after shifted to the inside in the Straight.,ST_AWT,1200,HK_2016_A235
2018040311,2018-04-03,11,5,CELEBRATION (A085),K Teetan,D E Ferraris,2,,2L,5 4 5,1.12.63,,Settled midfield; moved better than before.,ST_AWT,1200,HK_2016_A085
2018040311,2018-04-03,11,6,ROCKET GO (A322),W M Lai,C W Chang,8,B/H,2L,7 6 6,1.12.63,Passed,Three wide at turn; responded OK when asked.,ST_AWT,1200,HK_2016_A322
2018040311,2018-04-03,11,7,PENZANCE (A272),A Sanna,D J Hall,4,H/P,3-1/4L,8 8 7,1.12.83,,Slightly slow to begin; niggled along throughout.,ST_AWT,1200,HK_2016_A272
2018040311,2018-04-03,11,8,LONDON HALL (B026),M F Poon,D J Hall,6,H,4L,10 10 8,1.12.95,,Failed to respond when asked at turn.,ST_AWT,1200,HK_2017_B026
2018040311,2018-04-03,11,9,HAPPY SOUND (V107),N Rawiller,C Fownes,1,CP,5-1/2L,4 5 9,1.13.21,,Under restraint early; raced under his own steam in the Straight.,ST_AWT,1200,HK_2015_V107
2018040311,2018-04-03,11,10,AVELLINO (T388),O Doleuze,P O'Sullivan,7,CP,6L,6 9 10,1.13.29,,Ran on ordinary when shifted out in the Straight.,ST_AWT,1200,HK_2014_T388
2018040312,2018-04-03,12,1,LUCKY DOLLAR (A021),S Clipperton,T P Yung,3,,,3 4 1,1.02.04,,Always in touch; hit the front late to score.,ST_AWT,1050,HK_2016_A021
2018040312,2018-04-03,12,2,TEAM FORTUNE (T306),H N Wong,W Y So,4,,SH,5 3 2,1.02.06,,Four wide at turn; came from behind to run 2nd impressively.,ST_AWT,1050,HK_2014_T306
2018040312,2018-04-03,12,3,BEAUTY TIME (A374),M L Yeung,W Y So,10,,1-1/2L,6 5 3,1.02.27,,Quickened at turn; came form behind for 3rd.,ST_AWT,1050,HK_2016_A374
2018040312,2018-04-03,12,4,DREAM COME TRUE (B269),K C Ng,T P Yung,5,,4L,1 1 4,1.02.68,Passed,Urged to lead along the rail; weakened in the Straight.,ST_AWT,1050,HK_2017_B269
2018040312,2018-04-03,12,5,HOT KING PRAWN (A299),N Rawiller,J Size,1,,4-1/2L,2 2 5,1.02.73,,Under a hold in the Straight; not tested.,ST_AWT,1050,HK_2016_A299
2018040312,2018-04-03,12,6,ZERO HEDGE (A221),O Doleuze,J Size,7,SR,6-1/4L,9 8 6,1.03.05,,Made progress under a hold when shifted out in the Straight.,ST_AWT,1050,HK_2016_A221
2018040312,2018-04-03,12,7,NOBLE DELIGHT (B199),K Teetan,J Size,2,,6-1/2L,4 6 7,1.03.06,,Midfield along the rail; failed to respond.,ST_AWT,1050,HK_2017_B199
2018040312,2018-04-03,12,8,THE CREATETH (A336),T Berry,M J Freedman,8,,6-3/4L,7 7 8,1.03.10,,Ran on fairly to be nearest to the line.,ST_AWT,1050,HK_2016_A336
2018040312,2018-04-03,12,9,WINNER DON'T MISS (A184),M F Poon,D J Hall,9,,8-1/2L,10 10 9,1.03.40,,Raced at rear; unimpressive.,ST_AWT,1050,HK_2016_A184
2018040312,2018-04-03,12,10,HO HO KHAN (B318),C Y Ho,D J Hall,6,XB,10-3/4L,8 9 10,1.03.75,Passed,Ran on ordinary; finished last.,ST_AWT,1050,HK_2017_B318
2018040312,2018-04-03,12,11,ENDEARING (V338),,M J Freedman,11,,,Withdrawn,,,,ST_AWT,1050,HK_2015_V338
2018040313,2018-04-03,13,1,BIG BULLY (B028),M F Poon,D J Hall,3,B,,4 2 1,1.04.23,,Slightly slow to begin; then moved forward; fought on gamely to score.,ST_AWT,1050,HK_2017_B028
2018040313,2018-04-03,13,2,COURT RULER (B255),T Berry,M J Freedman,8,,1L,1 1 2,1.04.41,,Urged to lead along the rail; kept on ok for 2nd.,ST_AWT,1050,HK_2017_B255
2018040313,2018-04-03,13,3,STAR SUPERIOR (V255),O Doleuze,C W Chang,4,,3-1/2L,6 6 3,1.04.78,,Ran on comfortably for 3rd when shifted out in the Straight.,ST_AWT,1050,HK_2015_V255
2018040313,2018-04-03,13,4,HAPPY OUT THERE (A255),C Y Ho,C H Yip,2,,4L,5 5 4,1.04.87,,Niggled along throughout; ran on OK.,ST_AWT,1050,HK_2016_A255
2018040313,2018-04-03,13,5,MR PICASSO (T330),A Sanna,D J Hall,5,B/H,4-1/4L,2 4 5,1.04.90,Passed,Under restraint throughout; not tested.,ST_AWT,1050,HK_2014_T330
2018040313,2018-04-03,13,6,GOLDEN GENERAL (A346),M L Yeung,T P Yung,6,,6-1/2L,3 3 6,1.05.28,Passed,On pace early; weakened in the Straight.,ST_AWT,1050,HK_2016_A346
2018040313,2018-04-03,13,7,ACTUARIAT (V215),K Teetan,P O'Sullivan,1,V,8-3/4L,7 7 7,1.05.61,,Taken back early; not tested.,ST_AWT,1050,HK_2015_V215
2018040313,2018-04-03,13,8,SILLY BUDDIES (S054),W M Lai,C W Chang,7,P,12-1/4L,8 8 8,1.06.19,Failed,Raced at rear; unimpressive.,ST_AWT,1050,HK_2013_S054
2018040313,2018-04-03,13,9,BELLAGIO (B289),,M J Freedman,9,,,Withdrawn,,,,ST_AWT,1050,HK_2017_B289
2018040313,2018-04-03,13,10,LITTLE GIANT (V342),,D J Hall,10,,,Withdrawn,,,,ST_AWT,1050,HK_2015_V342
2018040601,2018-04-06,1,1,HEZTHEWONFORUS (B287),K Teetan,J Size,3,SR,,4 4 1,1.10.09,,Up with the pace; quickened well late to score.,ST_AWT,1200,HK_2017_B287
2018040601,2018-04-06,1,2,FANTASTIC EIGHT (A079),U Rispoli,P F Yiu,2,B,1L,3 2 2,1.10.24,Passed,Unable to lead early; kept on well late.,ST_AWT,1200,HK_2016_A079
2018040601,2018-04-06,1,3,PICK NUMBER ONE (B021),M L Yeung,C S Shum,5,,1L,2 3 3,1.10.25,,Under a hold for 3rd; something in hand.,ST_AWT,1200,HK_2017_B021
2018040601,2018-04-06,1,4,MR GENUINE (S253),M F Poon,D J Hall,8,B,1-1/2L,1 1 4,1.10.32,Passed,Led early; just caught.,ST_AWT,1200,HK_2013_S253
2018040601,2018-04-06,1,5,MARQULA (V423),O Doleuze,C W Chang,4,B,3-3/4L,5 5 5,1.10.68,Passed,Held ground throughout; ran on OK.,ST_AWT,1200,HK_2015_V423
2018040601,2018-04-06,1,6,SERGEANT TITANIUM (S332),B Prebble,J Size,1,,6-3/4L,8 8 6,1.11.17,,Rearward early; never tested.,ST_AWT,1200,HK_2013_S332
2018040601,2018-04-06,1,7,MARZOUQ (B094),H N Wong,J Size,6,,9-1/2L,6 7 7,1.11.61,,Ran on ordinary; unimpressive.,ST_AWT,1200,HK_2017_B094
2018040601,2018-04-06,1,8,HELENE CHARISMA (A129),N Callan,J Moore,7,,13-3/4L,7 6 8,1.12.28,Failed,Under urge at turn; no progress.,ST_AWT,1200,HK_2016_A129
2018040602,2018-04-06,2,1,COMFORT LIFE (B169),K Teetan,F C Lor,7,XB,,2 2 1,1.10.88,,On-pace without cover; ran on to score under whip late.,ST_AWT,1200,HK_2017_B169
2018040602,2018-04-06,2,2,CLEAR CHOICE (A426),M L Yeung,C S Shum,5,B,2-3/4L,1 1 2,1.11.30,,Pushed to lead early; not fully tested.,ST_AWT,1200,HK_2016_A426
2018040602,2018-04-06,2,3,NOBLE DE LOVE (V324),H N Wong,F C Lor,2,B,5-1/4L,6 5 3,1.11.71,,Under urge throughout; ran on for 3rd.,ST_AWT,1200,HK_2015_V324
2018040602,2018-04-06,2,4,FAST MOST FURIOUS (A165),M F Poon,D J Hall,6,,6L,5 6 4,1.11.85,,Ran under his own steam; ran on comfortably.,ST_AWT,1200,HK_2016_A165
2018040602,2018-04-06,2,5,EAGLE (B106),U Rispoli,P F Yiu,8,,7L,7 7 5,1.11.99,,Wide throughout; ran on OK.,ST_AWT,1200,HK_2017_B106
2018040602,2018-04-06,2,6,FIVE STARS AGENT (V001),O Doleuze,J Size,1,H/SR,7-1/2L,3 3 6,1.12.09,,Up with the pace; not fully tested.,ST_AWT,1200,HK_2015_V001
2018040602,2018-04-06,2,7,PHOTON WILLIE (S199),B Prebble,P O'Sullivan,4,H,8L,8 8 7,1.12.16,,Made progress saving ground; performed OK.,ST_AWT,1200,HK_2013_S199
2018040602,2018-04-06,2,8,SPARKLING TALENT (T346),N Rawiller,C S Shum,3,B,9-1/2L,4 4 8,1.12.39,,Under restraint throughout; never tested.,ST_AWT,1200,HK_2014_T346
2018040603,2018-04-06,3,1,SAVANNAH WIND (A307),M L Yeung,C S Shum,7,,,3 3 1,1.11.51,,Quickened at 200m; responded well to score.,ST_AWT,1200,HK_2016_A307
