race_id,Date,trial_number,horse_number,Horse,Jockey,Trainer,Draw,Gear,LBW,Running Position,Time,Result,Comment,Track,Dist.,horse_id
2023032104,2023-03-21,4,3,BRILLIANT LIFE (E396),C Y Ho,C H Yip,5,B,2-1/2L,4 3 3,1.01.70,,Under restraint behind runners in the Straight; impressive.,ST_AWT,1050,HK_2020_E396
2023032104,2023-03-21,4,4,CROWN OF STAR (H179),K C Leung,J Richards,8,P,6L,9 6 4,1.02.25,,Came from behind for 4th; moved better than before.,ST_AWT,1050,HK_2022_H179
2023032104,2023-03-21,4,5,AESTHETICISM (H289),H Bowman,P C Ng,4,,8-1/4L,8 5 5,1.02.61,,Raced under his own steam; not properly tested.,ST_AWT,1050,HK_2022_H289
2023032104,2023-03-21,4,6,HAPPIHOOD (H261),M Chadwick,P C Ng,2,,8-1/4L,7 4 6,1.02.62,,Not changing legs in the Straight; stayed on evenly.,ST_AWT,1050,HK_2022_H261
2023032104,2023-03-21,4,7,DORADO FIG (G332),K Teetan,A T Millard,10,,9L,10 8 7,1.02.74,Failed,Taken back early; raced under his own steam in the Straight.,ST_AWT,1050,HK_2021_G332
2023032104,2023-03-21,4,8,SUPER BONUS (H259),C L Chau,P C Ng,9,B,15-1/4L,6 10 8,1.03.72,Failed,Never in contention; needs time.,ST_AWT,1050,HK_2022_H259
2023032104,2023-03-21,4,9,MR GOOD VIBES (H180),L Ferraris,D J Hall,7,B,15-3/4L,5 9 9,1.03.82,Failed,Racing wide and greenly throughout.,ST_AWT,1050,HK_2022_H180
2023032104,2023-03-21,4,10,GREAT DAYS (H119),H N Wong,P C Ng,6,B/H,16L,2 7 10,1.03.85,,Gave ground; never in contention.,ST_AWT,1050,HK_2022_H119
2023032801,2023-03-28,1,1,MASTER EIGHT (E330),K C Leung,F C Lor,4,CP,,1 1 1,1.11.87,,Led along the rail; stayed on well to score.,ST_AWT,1200,HK_2020_E330
2023032801,2023-03-28,1,2,CORDYCEPS SIX (E363),M Chadwick,R Gibson,6,B,3-1/4L,4 4 2,1.12.39,,Dashed along centre track; ran on comfortably.,ST_AWT,1200,HK_2020_E363
2023032801,2023-03-28,1,3,BEAUTY JOY (E058),H Bowman,A S Cruz,8,H,3-1/4L,5 5 3,1.12.39,Passed,Under a hold for 3rd; racing in a more tractable manner.,ST_AWT,1200,HK_2020_E058
2023032801,2023-03-28,1,4,GRATEFUL HEART (D278),L Ferraris,W Y So,5,CP,3-3/4L,3 2 4,1.12.48,,On pace early; stayed on in the Straight.,ST_AWT,1200,HK_2019_D278
2023032801,2023-03-28,1,5,IRON WILL (G386),K Teetan,C S Shum,7,H,5L,2 3 5,1.12.65,Passed,Up with the pace; kept on evenly in the Straight.,ST_AWT,1200,HK_2021_G386
2023032801,2023-03-28,1,6,JUMBO FORTUNE (G195),C Y Ho,P C Ng,3,XB,5-1/4L,6 7 6,1.12.72,,Ran on well when shifted out in the Straight.,ST_AWT,1200,HK_2021_G195
2023032801,2023-03-28,1,7,HAPPY DAY (G119),A Badel,W Y So,1,,9L,7 6 7,1.13.30,,Raced under his own steam; just to stretch out.,ST_AWT,1200,HK_2021_G119
2023032801,2023-03-28,1,8,DELIGHTFUL LAOS (D321),L Hewitson,J Richards,2,,9L,8 8 8,1.13.31,,Last to begin; under a hold thereafter.,ST_AWT,1200,HK_2019_D321
2023032802,2023-03-28,2,1,TURBO POWER (E270),S H Sit,K W Lui,1,,,2 2 1,1.11.53,,Hard ridden to be on pace; shifted out at 300m; ridden along to the line.,ST_AWT,1200,HK_2020_E270
2023032802,2023-03-28,2,2,GREAT FOR YOU (G186),K Teetan,Y S Tsui,3,B,3-1/2L,1 1 2,1.12.10,,Led early; kept on in the Straight.,ST_AWT,1200,HK_2021_G186
2023032802,2023-03-28,2,3,E UNIVERSE (H151),H Bowman,K L Man,6,CP,6L,3 3 3,1.12.47,,Raced under his own steam; ran on for 3rd comfortably.,ST_AWT,1200,HK_2022_H151
2023032802,2023-03-28,2,4,MIDORI BEAUTY (G334),M Chadwick,W Y So,7,,9-1/2L,6 4 4,1.13.04,,Not fully tested when clear in the Straight.,ST_AWT,1200,HK_2021_G334
2023032802,2023-03-28,2,5,RED HARE KING (H188),C Y Ho,A S Cruz,9,,10-1/2L,5 6 5,1.13.22,Passed,Not much progress when asked at turn.,ST_AWT,1200,HK_2022_H188
2023032802,2023-03-28,2,6,BAYVIEW STAR (G411),L Hewitson,K W Lui,5,H,12-1/4L,4 5 6,1.13.47,,Gave ground in the Straight; unimpressive.,ST_AWT,1200,HK_2021_G411
2023032802,2023-03-28,2,7,LUCKY MISSILE (C501),H T Mo,D J Hall,8,B,12-1/4L,8 7 7,1.13.50,,Not much progress when persuaded at 200m.,ST_AWT,1200,HK_2018_C501
2023032802,2023-03-28,2,8,RUN RUN GOOD (D310),K H Chan,K L Man,2,B,14-3/4L,7 8 8,1.13.89,,Not willing to stretch when asked and under whip at 400m.,ST_AWT,1200,HK_2019_D310
2023032802,2023-03-28,2,9,STARSHIP EIGHTY (H022),A Badel,P C Ng,4,B/H,21-1/2L,9 9 9,1.14.98,,Out-paced early; tailed off.,ST_AWT,1200,HK_2022_H022
2023032803,2023-03-28,3,1,HOSS (H055),Z Purton,J Richards,3,,,5 5 1,1.03.76,,Ran on to score when let go at 200m.,ST_AWT,1050,HK_2022_H055
2023032803,2023-03-28,3,2,COURIER MAGIC (H290),K Teetan,J Richards,1,H,1-1/2L,6 6 2,1.04.02,,Steadied when racing tight at 600m; quickened for 2nd when shifted racing ground at 200m.,ST_AWT,1050,HK_2022_H290
2023032803,2023-03-28,3,3,MERCHANT PRINCE (H268),K C Leung,J Richards,5,B/XB,2L,2 2 3,1.04.09,Passed,Shared lead early; kept on for 3rd when persuaded in the Straight.,ST_AWT,1050,HK_2022_H268
2023032803,2023-03-28,3,4,DASHING SUCCESS (H152),H T Mo,Y S Tsui,4,,2-1/2L,1 1 4,1.04.18,,Hard ridden to take the lead; ridden along and under whip at 200m.,ST_AWT,1050,HK_2022_H152
2023032803,2023-03-28,3,5,PALAMOS (G355),L Hewitson,J Richards,7,XB,4-1/2L,4 4 5,1.04.49,Compulsorily Retired,Racing wide throughout; raced under his own steam in the Straight.,ST_AWT,1050,HK_2021_G355
2023032803,2023-03-28,3,6,PRESTIGE MOOCHI (H314),C Y Ho,J Richards,6,,7-1/2L,3 3 6,1.04.96,Passed,Three wide and shared lead; limited response in the Straight.,ST_AWT,1050,HK_2022_H314
2023032803,2023-03-28,3,7,ALWAYS BEAUTIFUL (G361),M Chadwick,W Y So,2,,8L,7 7 7,1.05.04,,Average to begin; under a hold thereafter.,ST_AWT,1050,HK_2021_G361
2023033101,2023-03-31,1,1,KA YING VICTORY (H287),L Ferraris,D J Hall,5,H,,4 3 1,0.59.46,Passed,Made progress steadily; won comfortably.,ST,1000,HK_2022_H287
2023033101,2023-03-31,1,2,SUPER BONUS (H259),C L Chau,P C Ng,1,B,SH,1 1 2,0.59.46,Passed,Shifted to the grandstand rail and led; under whip late; just caught.,ST,1000,HK_2022_H259
2023033101,2023-03-31,1,3,GALLANT VALOUR (H323),K Teetan,A T Millard,7,,6-1/2L,5 4 3,1.00.51,Passed,Kept on for 3rd when hard ridden.,ST,1000,HK_2022_H323
2023033101,2023-03-31,1,4,CHANCHENG GLORY (H212),L Hewitson,K W Lui,4,XB,7L,7 7 4,1.00.56,Failed,Last to begin; under a hold thereafter.,ST,1000,HK_2022_H212
2023033101,2023-03-31,1,5,HOLY LAKE (H260),H Bentley,K W Lui,6,,8L,6 6 5,1.00.73,Passed,Stumbled after start; limited response when hard ridden late.,ST,1000,HK_2022_H260
2023033101,2023-03-31,1,6,HAPPIHOOD (H261),M Chadwick,P C Ng,3,,10-1/2L,8 8 6,1.01.14,,Not racing in a tractable manner early; made minor inroads when asked late.,ST,1000,HK_2022_H261
2023033101,2023-03-31,1,7,UBERSTREICHEN (H221),C Y Ho,J Richards,8,B,12-1/2L,3 2 7,1.01.46,,Weakened halfway; gave ground.,ST,1000,HK_2022_H221
2023033101,2023-03-31,1,8,GREAT DAYS (H119),A Badel,P C Ng,2,B/H,13-1/4L,2 5 8,1.01.59,,Gave ground; found nothing when asked.,ST,1000,HK_2022_H119
2023033102,2023-03-31,2,1,RED LION (H115),V Borges,J Size,6,,,2 1 1,1.11.41,,Jumped well; always in touch.,ST_AWT,1200,HK_2022_H115
2023033102,2023-03-31,2,2,REWARD SMILE (H256),L Currie,J Size,1,,SH,4 4 2,1.11.42,,Dashed on well on centre track; impressive.,ST_AWT,1200,HK_2022_H256
2023033102,2023-03-31,2,3,HAPPY SHARING (G169),L Ferraris,P C Ng,2,,Head,1 2 3,1.11.44,,Shared lead along the rail; stayed on when asked late.,ST_AWT,1200,HK_2021_G169
2023033102,2023-03-31,2,4,TIANCHI MONSTER (B350),L Hewitson,W Y So,4,,2-1/2L,5 3 4,1.11.81,,Under a hold for 4th; veteran in good condition.,ST_AWT,1200,HK_2017_B350
2023033102,2023-03-31,2,5,FANTASTIC TREASURE (E269),K Teetan,D A Hayes,5,,3L,6 7 5,1.11.87,,Racing wide throughout; under a hold in the Straight.,ST_AWT,1200,HK_2020_E269
2023033102,2023-03-31,2,6,LAUGH TALE (G406),H Bentley,R Gibson,7,XB,3-1/2L,7 6 6,1.11.96,Passed,Racing wide throughout; ran on fairly well.,ST_AWT,1200,HK_2021_G406
2023033102,2023-03-31,2,7,GOLD GOLD BABY (E220),C Y Ho,K W Lui,3,,4-1/2L,3 5 7,1.12.14,,Up with the pace; under a hold in the Straight.,ST_AWT,1200,HK_2020_E220
2023033103,2023-03-31,3,1,OUTGATE (H113),Y L Chung,A S Cruz,3,H,,3 3 1,1.10.85,,Ran on to score when quickened at 200m.,ST_AWT,1200,HK_2022_H113
2023033103,2023-03-31,3,2,SUPER MAGIC (H001),C L Chau,P C Ng,1,B,1/2L,1 1 2,1.10.94,,Led early; hard ridden at 200m to the line.,ST_AWT,1200,HK_2021_H001
2023033103,2023-03-31,3,3,TRAVEL GOLF (H063),S De Sousa,C H Yip,2,,2-3/4L,6 5 3,1.11.27,,Taken back early; made progress under his own steam late.,ST_AWT,1200,HK_2022_H063
2023033103,2023-03-31,3,4,MIDAS TOUCH (H284),L Currie,J Size,5,,3-1/4L,2 2 4,1.11.35,,Over-racing early; limited response in the Straight.,ST_AWT,1200,HK_2022_H284
2023033103,2023-03-31,3,5,TURIN MASCOT (H165),L Hewitson,D J Whyte,4,B,4-1/2L,4 4 5,1.11.58,,Laying in at 300m; limited response when asked.,ST_AWT,1200,HK_2022_H165
2023033103,2023-03-31,3,6,DELAGO PATROL (H236),A Hamelin,R Gibson,6,B/H,8-3/4L,5 6 6,1.12.25,Passed,Failed to respond when asked at turn.,ST_AWT,1200,HK_2022_H236
2023033104,2023-03-31,4,1,MIRACLES (G083),M Chadwick,K L Man,8,B,,6 5 1,1.10.80,Passed,Taken back early; ran on to score under a hold in the Straight.,ST_AWT,1200,HK_2021_G083
2023033104,2023-03-31,4,2,STAR OF YUEN LONG (C303),S De Sousa,K L Man,3,B,Neck,2 2 2,1.10.84,,Shared lead early; stayed on well.,ST_AWT,1200,HK_2018_C303
2023033104,2023-03-31,4,3,KYRUS UNICORN (D267),K H Chan,D J Hall,4,B,2-3/4L,3 3 3,1.11.25,,Head in the air at 300m; hard ridden for 3rd.,ST_AWT,1200,HK_2019_D267
2023033104,2023-03-31,4,4,TSUEN WAN GLORY (E403),L Ferraris,K L Man,1,H,6L,1 1 4,1.11.76,,Urged to lead along the rail; under a hold in the Straight.,ST_AWT,1200,HK_2020_E403
2023033104,2023-03-31,4,5,MASTER OF FORTUNE (G474),C Y Ho,P C Ng,5,,6-1/4L,7 7 5,1.11.80,,Shifted out at 300m; made progress when hard ridden.,ST_AWT,1200,HK_2021_G474
2023033104,2023-03-31,4,6,BRAVE AND BOLD (H275),K Teetan,J Size,6,,9L,4 4 6,1.12.25,,Under a hold in the Straight; but ran on ordinary.,ST_AWT,1200,HK_2022_H275
2023033104,2023-03-31,4,7,RAINBOW LIGHT (E051),L Hewitson,D J Whyte,2,B/XB,9-1/4L,5 6 7,1.12.30,,Ran on ordinary although saved ground throughout.,ST_AWT,1200,HK_2020_E051
2023033105,2023-03-31,5,1,KA YING WARRIOR (H028),S De Sousa,C H Yip,1,XB,,2 2 1,1.01.26,,Shared lead along the rail; raced under his own steam in the Straight.,ST_AWT,1050,HK_2022_H028
2023033105,2023-03-31,5,2,JUNEAU FLASH (H084),K Teetan,J Size,4,PC,Neck,4 4 2,1.01.33,Passed,Made progress in between runners when persuaded at 200m.,ST_AWT,1050,HK_2022_H084
2023033105,2023-03-31,5,3,JOY IN JOY (H054),A Badel,C H Yip,3,B,2-1/2L,1 1 3,1.01.66,Passed,Led from middle gate; kept on evenly in the Straight.,ST_AWT,1050,HK_2022_H054
2023033105,2023-03-31,5,4,HAR HAR AT HEART (H035),L Currie,J Size,2,E,4L,3 3 4,1.01.92,,Raced under his own steam when clear in the Straight.,ST_AWT,1050,HK_2022_H035
2023033105,2023-03-31,5,5,HORSE OF GOOD LUCK (H160),L Hewitson,C H Yip,5,B,10L,5 5 5,1.02.85,Failed,Tailed off; unimpressive.,ST_AWT,1050,HK_2022_H160
2023040401,2023-04-04,1,1,O'LINER (H264),Z Purton,T P Yung,1,,,1 1 1,1.11.83,,Led all the way to score; stayed on nicely.,ST_AWT,1200,HK_2022_H264
2023040401,2023-04-04,1,2,KEEP YOU WARM (D272),A Hamelin,K W Lui,4,B/XB,1-3/4L,2 2 2,1.12.12,,On pace for 2nd; moved better than before.,ST_AWT,1200,HK_2019_D272
2023040401,2023-04-04,1,3,RISE BRETHREN (G075),L Hewitson,J Richards,5,,6-1/4L,4 4 3,1.12.83,,Racing wide throughout; stayed on well.,ST_AWT,1200,HK_2021_G075
2023040401,2023-04-04,1,4,HOWDEEPISYOURLOVE (H093),K Teetan,J Size,6,P,6-3/4L,5 5 4,1.12.91,,Racing wide throughout; ran on comfortably.,ST_AWT,1200,HK_2022_H093
2023040401,2023-04-04,1,5,EXCELLENT PEERS (G033),M Chadwick,F C Lor,3,H/XB,9-1/4L,3 3 5,1.13.29,,Average to begin; under a hold in the Straight.,ST_AWT,1200,HK_2021_G033
2023040401,2023-04-04,1,6,GOLDEN EMPIRE (E490),S H Sit,K W Lui,2,,9-3/4L,6 6 6,1.13.38,,Raced at rear; just to stretch out.,ST_AWT,1200,HK_2020_E490
2023040401,2023-04-04,1,7,SUGAR SUGAR (G016),,C Fownes,7,,,Withdrawn,,,,ST_AWT,1200,HK_2021_G016
2023040401,2023-04-04,1,8,GOLDEN SIXTY (C238),,K W Lui,8,,,Withdrawn,,,,ST_AWT,1200,HK_2018_C238
2023040402,2023-04-04,2,1,SPLENDID LIVING (E192),H Bentley,P F Yiu,3,,,2 2 1,1.12.57,,Shared lead early; hit the front at 200m with plenty in hand.,ST_AWT,1200,HK_2020_E192
2023040402,2023-04-04,2,2,GOLDEN EXPRESS (H086),Z Purton,J Size,7,P,1/2L,4 3 2,1.12.65,,Made progress wide under his own steam.,ST_AWT,1200,HK_2022_H086
2023040402,2023-04-04,2,3,PULSAR STRIDER (G407),L Hewitson,T P Yung,2,B,5-1/4L,1 1 3,1.13.43,,Led along the rail; under a hold for 3rd in the Straight.,ST_AWT,1200,HK_2021_G407
2023040402,2023-04-04,2,4,NUNCHUKS (C357),C Wong,C Fownes,1,,7-1/4L,5 5 4,1.13.74,,Made progress saving ground when persuaded at 200m.,ST_AWT,1200,HK_2018_C357
2023040402,2023-04-04,2,5,DIAMOND WINNER (H285),K Teetan,J Size,5,P,13-1/4L,3 4 5,1.14.68,Failed,Ridden along at turn; limited response in the Straight.,ST_AWT,1200,HK_2022_H285
2023040402,2023-04-04,2,6,MASTER TORNADO (G410),M Chadwick,W Y So,8,,18-1/4L,7 6 6,1.15.48,Passed,Found nothing when asked in the Straight.,ST_AWT,1200,HK_2021_G410
2023040402,2023-04-04,2,7,ROUND THE EARTH (G358),C Y Ho,D J Hall,4,B,20-1/4L,6 7 7,1.15.81,,Not quickened when hard ridden at 300m.,ST_AWT,1200,HK_2021_G358
2023040402,2023-04-04,2,8,POWERFUL WINGS (G225),A Badel,P F Yiu,6,B,21L,8 8 8,1.15.95,,Slightly slow to begin; never in contention.,ST_AWT,1200,HK_2021_G225
2023040402,2023-04-04,2,9,UNITED ENDEAVORS (G030),,L Ho,9,,,Withdrawn,,,,ST_AWT,1200,HK_2021_G030
2023040402,2023-04-04,2,10,ROYAL PRIDE (E351),,C Fownes,10,,,Withdrawn,,,,ST_AWT,1200,HK_2020_E351
2023040403,2023-04-04,3,1,SURE WINNER (D488),H T Mo,Y S Tsui,1,,,1 1 1,1.11.40,,On pace early; drew away to score after a breather at 200m.,ST_AWT,1200,HK_2019_D488
2023040403,2023-04-04,3,2,NABOO LEGEND (G357),Z Purton,D A Hayes,6,B,1-1/4L,2 2 2,1.11.62,Passed,Challenged the leader momentarily at 200m; fought on for 2nd.,ST_AWT,1200,HK_2021_G357
2023040403,2023-04-04,3,3,CIRCUIT SPLENDOR (E482),M F Poon,T P Yung,2,XB,7L,3 3 3,1.12.53,,On pace for 3rd; stayed on comfortably.,ST_AWT,1200,HK_2020_E482
2023040403,2023-04-04,3,4,GOLDEN SAMURAI (H024),C Y Ho,K W Lui,5,B,17-3/4L,7 4 4,1.14.22,,Under a hold in the Straight; moved better than before.,ST_AWT,1200,HK_2022_H024
2023040403,2023-04-04,3,5,LIFELINE VISION (E318),K Teetan,D A Hayes,3,,21L,5 5 5,1.14.74,,Under a hold in the Straight; not tested.,ST_AWT,1200,HK_2020_E318
2023040403,2023-04-04,3,6,TOTAL POWER (D138),K H Chan,D J Hall,4,B,25L,8 8 6,1.15.38,,Made minor progress when persuaded in the Straight.,ST_AWT,1200,HK_2019_D138
2023040403,2023-04-04,3,7,CHARMANDER (G437),M Chadwick,J Richards,7,,ML,6 7 7,1.16.28,,Just to stretch out; not tested.,ST_AWT,1200,HK_2021_G437
2023040403,2023-04-04,3,8,SPICY SO GOOD (E118),C L Chau,T P Yung,8,,ML,4 6 8,1.18.06,Failed,Gave ground; unimpressive.,ST_AWT,1200,HK_2020_E118
2023040403,2023-04-04,3,9,BRILLIANT EIGHT (G280),,Y S Tsui,9,,,Withdrawn,,,,ST_AWT,1200,HK_2021_G280
2023040403,2023-04-04,3,10,CHEONG FAT (H058),,L Ho,10,,,Withdrawn,,,,ST_AWT,1200,HK_2022_H058
2023040404,2023-04-04,4,1,M M NEBULA (G279),M Chadwick,K L Man,1,B,,1 1 1,1.01.81,,Led all the way to score; impressive.,ST_AWT,1050,HK_2021_G279
2023040404,2023-04-04,4,2,NERVOUS WITNESS (E421),L Hewitson,D A Hayes,7,H/XB,3L,3 2 2,1.02.27,Passed,Raced under his own steam in the Straight; stretching out nicely.,ST_AWT,1050,HK_2020_E421
2023040404,2023-04-04,4,3,SUNSHINE LEGENDARY (G214),K C Leung,F C Lor,3,CP,5-3/4L,4 4 3,1.02.73,,Came well from behind when shifted out in the Straight.,ST_AWT,1050,HK_2021_G214
2023040404,2023-04-04,4,4,EURO ROCKS (H153),C Y Ho,K W Lui,4,,7L,2 3 4,1.02.93,,On pace early; raced under his own steam in the Straight.,ST_AWT,1050,HK_2022_H153
2023040404,2023-04-04,4,5,SMART LEADER (B456),K Teetan,W Y So,2,B/XB,7-1/2L,6 5 5,1.03.02,Passed,Held ground when hard ridden in the Straight.,ST_AWT,1050,HK_2017_B456
2023040404,2023-04-04,4,6,BEAUTY FIT (E279),V Borges,J Size,6,P/E,8L,5 7 6,1.03.11,,Racing wide throughout; ran on fairly well in the Straight.,ST_AWT,1050,HK_2020_E279
2023040404,2023-04-04,4,7,CARROLL STREET (D489),A Hamelin,D J Whyte,5,,8-3/4L,7 6 7,1.03.21,,Not tested; just to stretch out.,ST_AWT,1050,HK_2019_D489
2023041101,2023-04-11,1,1,MIDORI BEAUTY (G334),M Chadwick,W Y So,3,,,5 4 1,0.57.87,,Quickened at 200m to score.,ST,1000,HK_2021_G334
2023041101,2023-04-11,1,2,ALLGREEKTOME (H007),K H Tsang,D A Hayes,7,H,1-3/4L,1 1 2,0.58.14,,Led from middle gate; kept on late.,ST,1000,HK_2021_H007
2023041101,2023-04-11,1,3,MAGIC PHOENIX (E440),S H Sit,K H Ting,9,,3-1/2L,2 2 3,0.58.41,,On pace for 3rd; impressive.,ST,1000,HK_2020_E440
2023041101,2023-04-11,1,4,REVE PARISIEN (E335),M F Poon,L Ho,5,,3-1/2L,3 3 4,0.58.43,,Under restraint throughout; stayed on fairly well.,ST,1000,HK_2020_E335
2023041101,2023-04-11,1,5,SWORD POINT (G448),H Bowman,F C Lor,6,CP,4-1/4L,8 6 5,0.58.53,,Ran on in between runners when hard ridden at 300m.,ST,1000,HK_2021_G448
2023041101,2023-04-11,1,6,FLYING ACE (G045),Z Purton,D J Hall,2,B,4-1/4L,6 5 6,0.58.54,Passed,Taken back early; ridden quietly.,ST,1000,HK_2021_G045
2023041101,2023-04-11,1,7,KIMBERLEY (H329),L Hewitson,A T Millard,8,,5-1/4L,4 7 7,0.58.71,,Niggled along throughout; lack of concentration.,ST,1000,HK_2022_H329
2023041101,2023-04-11,1,8,MERCHANT PRINCE (H268),C Y Ho,J Richards,4,B/XB,6-1/2L,7 8 8,0.58.90,,Limited response when hard ridden at 200m.,ST,1000,HK_2022_H268
2023041101,2023-04-11,1,9,BEAUTYVERSE (H075),A Badel,A S Cruz,1,H,12L,9 9 9,0.59.79,,Raced at rear; unimpressive.,ST,1000,HK_2022_H075
2023041102,2023-04-11,2,1,SUGAR SUGAR (G016),K H Chan,C Fownes,4,B,,4 2 1,0.58.08,,Made steady progress to score; impressive.,ST,1000,HK_2021_G016
2023041102,2023-04-11,2,2,HARMONY FIRE (E175),K H Tse,D J Whyte,9,SR/XB,1-1/2L,1 1 2,0.58.31,,Jumped well and led; stayed on for 2nd.,ST,1000,HK_2020_E175
2023041102,2023-04-11,2,3,THESIS (H111),H Bowman,R Gibson,2,CP,2-1/2L,5 4 3,0.58.50,,Shifted out after start; made steady progress when recovered.,ST,1000,HK_2022_H111
2023041102,2023-04-11,2,4,STAR ASCENSION (G206),L Ferraris,D J Hall,3,H,5L,8 6 4,0.58.90,Passed,Ran on fairly well when persuaded late.,ST,1000,HK_2021_G206
2023041102,2023-04-11,2,5,SONIC PEGASUS (H279),C Y Ho,K W Lui,1,,5-3/4L,9 5 5,0.58.99,Passed,Blocked after start; ran on OK when under whip at 400m.,ST,1000,HK_2022_H279
2023041102,2023-04-11,2,6,PRESTIGE MOOCHI (H314),L Hewitson,J Richards,7,,6L,6 7 6,0.59.03,,Held ground when asked late.,ST,1000,HK_2022_H314
2023041102,2023-04-11,2,7,KA YING POWER (H169),M Chadwick,A S Cruz,5,H,6-1/4L,2 3 7,0.59.07,,Led early; limited response late.,ST,1000,HK_2022_H169
2023041102,2023-04-11,2,8,DELAGO PATROL (H236),H Bentley,R Gibson,8,B/H,11-3/4L,7 9 8,0.59.96,,Failed to respond when hard ridden.,ST,1000,HK_2022_H236
2023041102,2023-04-11,2,9,RAGNARR (H297),Z Purton,T P Yung,6,,16-3/4L,3 8 9,1.00.75,Failed,Over-racing early; under restraint and not tested.,ST,1000,HK_2022_H297
2023041102,2023-04-11,2,10,EXCELLENT DADDY (E321),,T P Yung,10,,,Withdrawn,,,,ST,1000,HK_2020_E321
2023041102,2023-04-11,2,11,DIVINE SHINING (G373),,K H Ting,11,B,,Withdrawn,,,,ST,1000,HK_2021_G373
2023041103,2023-04-11,3,1,DAN ATTACK (H317),Z Purton,J Richards,8,,,5 3 1,0.58.19,,Eased back early; ran on to score when let go at 200m.,ST,1000,HK_2022_H317
2023041103,2023-04-11,3,2,YOUNG LIFE FOREVER (G308),S H Sit,C Fownes,10,,1-3/4L,1 1 2,0.58.48,,Led early; just caught.,ST,1000,HK_2021_G308
2023041103,2023-04-11,3,3,STAR CLUB (H239),A Badel,R Gibson,6,,2L,6 5 3,0.58.53,,Raced behind runners throughout; quickened for 3rd when shifted racing ground late.,ST,1000,HK_2022_H239
2023041103,2023-04-11,3,4,UNIVERSAL PURSUIT (H286),C Y Ho,K W Lui,4,,3-1/4L,3 2 4,0.58.73,Passed,Shared lead early; limited response late.,ST,1000,HK_2022_H286
2023041103,2023-04-11,3,5,BIG RED (H299),M Chadwick,C W Chang,2,,5-1/2L,9 7 5,0.59.06,Passed,Looking for cover early; shifted in gradually at 300m; made progress when hard ridden.,ST,1000,HK_2022_H299
2023041103,2023-04-11,3,6,AFFIRM (H306),S De Sousa,P F Yiu,3,,6L,4 4 6,0.59.14,Passed,Under restraint throughout; just to pass trial.,ST,1000,HK_2022_H306
2023041103,2023-04-11,3,7,SOLAR PARTNER (E364),H Bowman,P F Yiu,5,,6L,2 6 7,0.59.16,,On pace early; not fully tested.,ST,1000,HK_2020_E364
2023041103,2023-04-11,3,8,DIAMOND DIAMOND (H189),C L Chau,T P Yung,7,B,9L,8 8 8,0.59.63,Passed,Laying in at 300m; held ground.,ST,1000,HK_2022_H189
2023041103,2023-04-11,3,9,CHEONG FAT (H058),K C Leung,L Ho,9,H/PC,9L,10 9 9,0.59.64,,Last to begin; ran on ordinary.,ST,1000,HK_2022_H058
2023041103,2023-04-11,3,10,HORSE OF GOOD LUCK (H160),L Hewitson,C H Yip,1,H,13-1/2L,7 10 10,1.00.35,Passed,Found nothing when under whip and asked at 400m.,ST,1000,HK_2022_H160
2023041104,2023-04-11,4,1,EXUBERANT (E282),M K Cheung,C S Shum,9,B,,3 1 1,0.58.46,,Hit the front halfway; hard ridden to the line.,ST,1000,HK_2020_E282
2023041104,2023-04-11,4,2,DEEP PURSUIT (H288),H Bowman,C Fownes,4,,3/4L,7 4 2,0.58.58,,Slightly slow to begin; hard ridden for 2nd when shifted out at 400m.,ST,1000,HK_2022_H288
2023041104,2023-04-11,4,3,SHINKANSEN (H277),L Hewitson,D J Whyte,6,H,3/4L,5 2 3,0.58.59,,Made progress comfortably when shifted racing ground at 400m.,ST,1000,HK_2022_H277
2023041104,2023-04-11,4,4,KA YING WARRIOR (H028),S De Sousa,C H Yip,1,XB,3-3/4L,4 5 4,0.59.05,Passed,Under restraint throughout; just to pass trial.,ST,1000,HK_2022_H028
2023041104,2023-04-11,4,5,UNITED ENDEAVORS (G030),H T Mo,L Ho,7,H,5-1/4L,2 6 5,0.59.29,,Raced behind runners; just to stretch out.,ST,1000,HK_2021_G030
2023041104,2023-04-11,4,6,MAGIC TRAVELLER (H102),C Y Ho,W Y So,5,,5-1/4L,1 3 6,0.59.32,,Gave ground; lack of concentration.,ST,1000,HK_2022_H102
2023041104,2023-04-11,4,7,STREET CONQUEROR (H341),M Chadwick,A S Cruz,2,H,5-3/4L,6 7 7,0.59.40,Passed,Not quickened when persuaded late.,ST,1000,HK_2022_H341
2023041104,2023-04-11,4,8,GOAL ORIENTED (G254),L Ferraris,K H Ting,3,B,6L,8 8 8,0.59.40,Passed,Not much progress when hard ridden at 300m.,ST,1000,HK_2021_G254
2023041104,2023-04-11,4,9,JOYFUL CHAMPION (G072),K C Leung,C W Chang,8,B,11-1/4L,9 9 9,1.00.27,,Never in contention; tailed off.,ST,1000,HK_2021_G072
2023041104,2023-04-11,4,10,BEAUTY DESTINY (H281),,F C Lor,10,,,Withdrawn,,,,ST,1000,HK_2022_H281
2023041105,2023-04-11,5,1,PACKING BOLE (H246),Z Purton,C S Shum,2,,,1 1 1,0.57.72,,Led all the way to score; ran on nicely.,ST,1000,HK_2022_H246
2023041105,2023-04-11,5,2,SOARING TOWER (D500),S De Sousa,C S Shum,5,B,2L,2 2 2,0.58.04,,Ran on comfortably; stayed on for 2nd.,ST,1000,HK_2019_D500
2023041105,2023-04-11,5,3,BIRDSVILLE (E464),L Hewitson,D A Hayes,6,B,4L,4 4 3,0.58.37,,Under a hold for 3rd; impressive.,ST,1000,HK_2020_E464
2023041105,2023-04-11,5,4,MULTIMORE (D443),K H Tsang,T P Yung,8,,10-3/4L,3 3 4,0.59.44,,On pace early; weakened late.,ST,1000,HK_2019_D443
2023041105,2023-04-11,5,5,COURIER MAGIC (H290),K Teetan,J Richards,1,H,12L,7 5 5,0.59.65,,Kept on evenly when persuaded at 200m.,ST,1000,HK_2022_H290
2023041105,2023-04-11,5,6,LITTLE FAIRY (H206),A Badel,P F Yiu,3,H,13L,5 6 6,0.59.80,,Settled midfield; ran on ordinary.,ST,1000,HK_2022_H206
2023041105,2023-04-11,5,7,GREAT BRILLIANT (G287),H W Lai,Y S Tsui,4,B,13-1/2L,6 7 7,0.59.86,,Average to begin; found nothing when asked.,ST,1000,HK_2021_G287
2023041105,2023-04-11,5,8,SHINY TWO (G041),K C Leung,P F Yiu,7,H/XB,17-1/4L,8 8 8,1.00.48,,Slightly slow to begin; not willing to stretch.,ST,1000,HK_2021_G041
2023041105,2023-04-11,5,9,HOLY LAKE (H260),,K W Lui,9,,,Withdrawn,,,,ST,1000,HK_2022_H260
2023041106,2023-04-11,6,1,SAKEWIN (G275),Y L Chung,F C Lor,7,,,1 1 1,0.46.25,,Jumped well; led all the way to score.,ST,800,HK_2021_G275
2023041106,2023-04-11,6,2,INVINCIBLE SAGE (H301),H Bowman,D J Hall,4,,3-1/4L,4 2 2,0.46.77,Passed,Raced under his own steam; ran on nicely.,ST,800,HK_2022_H301
2023041106,2023-04-11,6,3,HELIOS EXPRESS (H302),Z Purton,J Size,2,,3-1/2L,2 3 3,0.46.79,Passed,Ridden quietly; stayed on comfortably for 3rd.,ST,800,HK_2022_H302
2023041106,2023-04-11,6,4,TATTENHAM (H121),A Badel,P C Ng,6,,4L,6 7 4,0.46.90,,Ran on to be nearest at finish when hard ridden.,ST,800,HK_2022_H121
2023041106,2023-04-11,6,5,SUPERB KID (H298),C Y Ho,K W Lui,5,,4-1/4L,7 6 5,0.46.91,Passed,Average to begin; made minor progress when hard ridden at 200m.,ST,800,HK_2022_H298
2023041106,2023-04-11,6,6,JOY FOR YOU (H270),K Teetan,Y S Tsui,1,H,4-3/4L,3 4 6,0.47.01,Passed,Raced greenly when under whip at 300m.,ST,800,HK_2022_H270
2023041106,2023-04-11,6,7,NISHIKADO (H172),H W Lai,Y S Tsui,3,,5-1/2L,5 5 7,0.47.11,Passed,Knuckled after start; not stretching out properly.,ST,800,HK_2022_H172
2023041107,2023-04-11,7,1,DREAM WINNER (H308),C Y Ho,F C Lor,7,,,2 1 1,0.46.38,Passed,Kept on changing legs at 200m; but still ran on to score.,ST,800,HK_2022_H308
2023041107,2023-04-11,7,2,FAST SERVE (H240),L Ferraris,D J Hall,3,XB,1L,1 2 2,0.46.55,Passed,Led early; ran on for 2nd in an intractable manner.,ST,800,HK_2022_H240
2023041107,2023-04-11,7,3,STERLING WONGCHOY (H273),L Hewitson,D J Whyte,2,XB,4-1/2L,3 3 3,0.47.11,Passed,Ran on comfortably; under a hold for 3rd.,ST,800,HK_2022_H273
2023041107,2023-04-11,7,4,CYBER PATCH (H158),A Badel,P C Ng,8,B,6-1/2L,4 4 4,0.47.43,,Racing wide throughout; held ground.,ST,800,HK_2022_H158
2023041107,2023-04-11,7,5,AESTHETICISM (H289),C L Chau,P C Ng,5,,6-3/4L,8 6 5,0.47.48,,Made minor inroads when hard ridden.,ST,800,HK_2022_H289
2023041107,2023-04-11,7,6,THE FINAL WORD (H184),H Bowman,R Gibson,6,XB,7L,5 5 6,0.47.51,Passed,Going all over the place at 400m; under a hold thereafter.,ST,800,HK_2022_H184
2023041107,2023-04-11,7,7,CLUB SODA (H312),K Teetan,J Size,4,,9-1/2L,7 7 7,0.47.88,Passed,Crowded after start; raced greenly.,ST,800,HK_2022_H312
2023041107,2023-04-11,7,8,COPARTNER PUDONG (H313),Z Purton,J Size,1,,13L,6 8 8,0.48.46,Passed,Ran on ordinary; unimpressive.,ST,800,HK_2022_H313
