race_id,Date,trial_number,horse_number,Horse,Jockey,Trainer,Draw,Gear,LBW,Running Position,Time,Result,Comment,Track,Dist.,horse_id
2023100602,2023-10-06,2,1,BEAUTY ETERNAL (H008),Z Purton,J Size,9,,,5 4 1,1.11.19,,Racing wide throughout; made steady progress to score.,ST_AWT,1200,HK_2021_H008
2023100602,2023-10-06,2,2,NOIR RIDER (E138),K De Melo,C W Chang,7,XB,1L,1 3 2,1.11.36,Passed,Led early; stayed on for 2nd; moved better than before.,ST_AWT,1200,HK_2020_E138
2023100602,2023-10-06,2,3,NICETOBEMET (H094),M Chadwick,F C Lor,2,XB,2-1/4L,4 5 3,1.11.56,,Ran on for 3rd when persuaded; stayed on fairly well.,ST_AWT,1200,HK_2022_H094
2023100602,2023-10-06,2,4,MODEST GENTLEMAN (G352),M L Yeung,K W Lui,3,,5L,2 2 4,1.11.98,,Under restraint throughout; impressive.,ST_AWT,1200,HK_2021_G352
2023100602,2023-10-06,2,5,DIVINE SHINING (G373),L Ferraris,K H Ting,5,BO/H,5-1/2L,3 1 5,1.12.05,,Hit the front momentarily; limited response late.,ST_AWT,1200,HK_2021_G373
2023100602,2023-10-06,2,6,CHILLI BABA (G339),C Y Ho,P F Yiu,4,V,7L,8 7 6,1.12.32,,Niggled along early; made progress when under whip at 200m.,ST_AWT,1200,HK_2021_G339
2023100602,2023-10-06,2,7,STARRY NIGHT (G253),L Hewitson,D A Hayes,1,B,10-1/2L,6 6 7,1.12.89,,Settled midfield; not tested.,ST_AWT,1200,HK_2021_G253
2023100602,2023-10-06,2,8,V LOVE YOU (J048),K Teetan,C S Shum,8,,15-3/4L,7 8 8,1.13.72,Failed,Raced awkwardly; neber in contention.,ST_AWT,1200,HK_2023_J048
2023100602,2023-10-06,2,9,SURUGA BAY (J022),H Bowman,P C Ng,6,,17L,9 9 9,1.13.89,,Ridden along throughout; unimpressive.,ST_AWT,1200,HK_2023_J022
2023100602,2023-10-06,2,10,FOOLISH HEART (J054),,C W Chang,10,,,Withdrawn,,,,ST_AWT,1200,HK_2023_J054
2023100603,2023-10-06,3,1,PING HAI GALAXY (C377),K Teetan,J Size,7,,,1 1 1,1.01.30,,Jumped well; led all the way to score.,ST_AWT,1050,HK_2018_C377
2023100603,2023-10-06,3,2,GORGEOUS VITALITY (G051),Z Purton,F C Lor,2,CP,2-1/2L,2 2 2,1.01.69,,On pace for 2nd; stayed on well.,ST_AWT,1050,HK_2021_G051
2023100603,2023-10-06,3,3,ACA POWER (E144),M F Poon,D J Hall,5,,4-3/4L,7 7 3,1.02.06,,Came well from behind when quickened at 200m.,ST_AWT,1050,HK_2020_E144
2023100603,2023-10-06,3,4,COTTON FINGERS (H398),M Chadwick,W Y So,6,,6-3/4L,6 5 4,1.02.39,,Raced under his own steam and wide throughout.,ST_AWT,1050,HK_2022_H398
2023100603,2023-10-06,3,5,GLORIOUS TALENT (J023),K C Leung,F C Lor,4,,8-1/2L,5 6 5,1.02.64,Passed,Failed to respond when asked in the Straight.,ST_AWT,1050,HK_2023_J023
2023100603,2023-10-06,3,6,PANDA LEGEND (H002),M L Yeung,W Y So,3,,12L,3 3 6,1.03.22,,Not quickened when hard ridden at 200m.,ST_AWT,1050,HK_2021_H002
2023100603,2023-10-06,3,7,PINGWU SPARKLE (J030),C L Chau,T P Yung,1,,15-1/2L,4 4 7,1.03.79,Passed,Raced awkwardly at turn; weakened in the Straight.,ST_AWT,1050,HK_2023_J030
2023101001,2023-10-10,1,1,SWORD POINT (G448),Z Purton,F C Lor,3,CP,,2 2 1,1.10.91,,Always in touch; hit the front at 200m to score.,ST_AWT,1200,HK_2021_G448
2023101001,2023-10-10,1,2,SELF IMPROVEMENT (H337),M F Poon,K L Man,9,B,2L,1 1 2,1.11.23,,Led from middle gate; raced under his own steam in the Straight.,ST_AWT,1200,HK_2022_H337
2023101001,2023-10-10,1,3,CHIU CHOW SPIRIT (H175),A Badel,K L Man,7,B,3L,5 4 3,1.11.40,,Racing wide throughout; made progress outside.,ST_AWT,1200,HK_2022_H175
2023101001,2023-10-10,1,4,ENSUED (H452),L Currie,J Size,8,P,7-1/2L,4 5 4,1.12.10,,Up with the pace; stayed on fairly well.,ST_AWT,1200,HK_2022_H452
2023101001,2023-10-10,1,5,MASSIVE ACTION (E445),L Hewitson,F C Lor,1,SR/V,9-1/2L,3 3 5,1.12.42,,Under a hold along the rail; raced under his own steam in the Straight.,ST_AWT,1200,HK_2020_E445
2023101001,2023-10-10,1,6,SWEET ENCOUNTER (G426),B Avdulla,J Size,6,PC,11-1/2L,7 6 6,1.12.74,,Under a hold when clear in the Straight; not tested.,ST_AWT,1200,HK_2021_G426
2023101001,2023-10-10,1,7,LEADING FORTUNE (C441),H Bowman,J Size,10,PC,14L,8 8 7,1.13.15,Failed,Swung wide at turn; limited response when hard ridden in the Straight.,ST_AWT,1200,HK_2018_C441
2023101001,2023-10-10,1,8,LOOKING GREAT (E053),M Chadwick,F C Lor,5,CP,17L,6 7 8,1.13.65,,Gave ground; unimpressive.,ST_AWT,1200,HK_2020_E053
2023101001,2023-10-10,1,9,MARADO (E245),A Atzeni,W Y So,4,B,17-1/4L,9 9 9,1.13.69,,Asked at turn; laying in at 300m; under a hold thereafter.,ST_AWT,1200,HK_2020_E245
2023101001,2023-10-10,1,10,OWNERS' PRAISE (H047),M L Yeung,W Y So,2,CP,17-1/2L,10 10 10,1.13.72,,Ridden along early; ran on ordinary.,ST_AWT,1200,HK_2022_H047
2023101002,2023-10-10,2,1,BEAUTY DESTINY (H281),Z Purton,F C Lor,4,,,1 1 1,1.10.22,,Urged to lead along the rail; drew away to score.,ST_AWT,1200,HK_2022_H281
2023101002,2023-10-10,2,2,CHIU CHOW BROTHER (E188),M F Poon,K L Man,7,B,9L,2 2 2,1.11.64,,Shared lead early; stayed on for 2nd.,ST_AWT,1200,HK_2020_E188
2023101002,2023-10-10,2,3,DEVAS TWELVE (H435),M Chadwick,W Y So,6,,10-3/4L,3 3 3,1.11.95,,On pace for 3rd; but raced greenly.,ST_AWT,1200,HK_2022_H435
2023101002,2023-10-10,2,4,GENERAL WINNER (E376),L Currie,W Y So,2,B/XB,11-1/4L,8 7 4,1.12.02,,Dashed on along the inside; moved better than before.,ST_AWT,1200,HK_2020_E376
2023101002,2023-10-10,2,5,GREAT BRILLIANT (G287),B Avdulla,M Newnham,3,PC,15L,5 6 5,1.12.60,,Failed to respond when hard ridden.,ST_AWT,1200,HK_2021_G287
2023101002,2023-10-10,2,6,ENTRUSTED (D381),A Badel,W Y So,8,B,17L,7 5 6,1.12.92,,Racing wide throughout; under a hold in the Straight.,ST_AWT,1200,HK_2019_D381
2023101002,2023-10-10,2,7,CASA SACRED (H107),A Atzeni,M Newnham,5,,19L,4 4 7,1.13.26,,Laying in at 300m; found nothing when asked.,ST_AWT,1200,HK_2022_H107
2023101002,2023-10-10,2,8,HERCULES (C476),L Hewitson,C H Yip,10,B,21L,10 8 8,1.13.58,Failed,Laying in at 300m; not fully tested.,ST_AWT,1200,HK_2018_C476
2023101002,2023-10-10,2,9,NORDIC COMBINED (G015),M L Yeung,W Y So,1,B,21-1/2L,6 9 9,1.13.65,,Weakened and gave ground when hard ridden in the Straight.,ST_AWT,1200,HK_2021_G015
2023101002,2023-10-10,2,10,DIAMOND WINNER (H285),H Bowman,J Size,9,P,21-3/4L,9 10 10,1.13.70,,Swung wide at turn; just to stretch out.,ST_AWT,1200,HK_2022_H285
2023101002,2023-10-10,2,11,NOBLE BOYZ (E156),,K L Man,11,,,Withdrawn,,,,ST_AWT,1200,HK_2020_E156
2023101003,2023-10-10,3,1,FAST BUCK (H126),B Avdulla,J Size,1,P,,1 1 1,1.01.72,,Led along the rail; kept on to score.,ST_AWT,1050,HK_2022_H126
2023101003,2023-10-10,3,2,COOL BLUE (H011),Z Purton,F C Lor,2,,Nose,2 2 2,1.01.72,,On pace and one-off; responded fairly well when asked at 200m.,ST_AWT,1050,HK_2021_H011
2023101003,2023-10-10,3,3,ENDEARED (H161),A Badel,J Size,3,P/XB,1/2L,4 3 3,1.01.81,,Shifted out at 300m; made progress when hard ridden.,ST_AWT,1050,HK_2022_H161
2023101003,2023-10-10,3,4,BEER PALACE (H361),A Atzeni,M Newnham,4,,5-1/4L,3 4 4,1.02.55,,Raced greenly and awkwardly at turn.,ST_AWT,1050,HK_2022_H361
2023101003,2023-10-10,3,5,SHINING FORTUNE (G252),L Currie,J Size,5,PC/XB,7-3/4L,5 5 5,1.02.97,,Racing wide throughout; not tested.,ST_AWT,1050,HK_2021_G252
2023101201,2023-10-12,1,1,DUKE WAI (C188),H Bentley,P C Ng,9,PC,,1 2 1,1.10.95,,Always in touch; ran on to score when having a breather at 200m.,ST_AWT,1200,HK_2018_C188
2023101201,2023-10-12,1,2,SAUVESTRE (E315),L Ferraris,F C Lor,2,,Neck,2 1 2,1.11.01,,Always in touch; stayed on well.,ST_AWT,1200,HK_2020_E315
2023101201,2023-10-12,1,3,MAJESTIC STAR (E203),K Teetan,C S Shum,7,,1/2L,3 4 3,1.11.05,,Made progress under his own steam when shifted out at 200m.,ST_AWT,1200,HK_2020_E203
2023101201,2023-10-12,1,4,NIMBLE NIMBUS (E249),A Atzeni,P F Yiu,5,V,3/4L,4 5 4,1.11.09,,Ran on to be nearest at finish when persuaded at 200m.,ST_AWT,1200,HK_2020_E249
2023101201,2023-10-12,1,5,SMOKEY BEAR (E126),L Hewitson,C W Chang,1,B/XB,1-1/4L,6 3 5,1.11.17,,Saved ground throughout; ran on comfortably.,ST_AWT,1200,HK_2020_E126
2023101201,2023-10-12,1,6,RISE BRETHREN (G075),K De Melo,J Richards,6,P,3-3/4L,8 9 6,1.11.55,,Under a hold in the Straight; made progress centre track.,ST_AWT,1200,HK_2021_G075
2023101201,2023-10-12,1,7,TUCHEL (G345),Z Purton,J Size,10,,4-3/4L,10 8 7,1.11.70,,Raced wide throughout; just to stretch out.,ST_AWT,1200,HK_2021_G345
2023101201,2023-10-12,1,8,HANDSOME TWELVE (E462),C L Chau,T P Yung,3,,5-1/4L,9 10 8,1.11.81,,Under a hold in the Straight; not tested.,ST_AWT,1200,HK_2020_E462
2023101201,2023-10-12,1,9,RED ACLAIM (J017),B Avdulla,J Size,8,,6-3/4L,7 7 9,1.12.03,,Not quickened when hard ridden.,ST_AWT,1200,HK_2023_J017
2023101201,2023-10-12,1,10,TRUE LEGEND (D047),Y L Chung,W K Mo,4,B,7-3/4L,5 6 10,1.12.21,,Weakened halfway; gave ground abruptly.,ST_AWT,1200,HK_2019_D047
2023101202,2023-10-12,2,1,FIERY DIAMOND (G022),C L Chau,T P Yung,2,,,1 1 1,1.10.39,,Led early; drew away to score.,ST_AWT,1200,HK_2021_G022
2023101202,2023-10-12,2,2,COLOURFUL PRINCE (E418),K De Melo,D J Whyte,1,SR/XB,2-3/4L,2 2 2,1.10.81,,Stayed on well when shifted out at 200m.,ST_AWT,1200,HK_2020_E418
2023101202,2023-10-12,2,3,HELENE FEELING (H215),K Teetan,C S Shum,9,,3-1/2L,7 9 3,1.10.94,,Hard ridden to make progress when clear in the Straight.,ST_AWT,1200,HK_2022_H215
2023101202,2023-10-12,2,4,CAPTAIN WIN (E466),K C Leung,P C Ng,6,PC,4L,3 3 4,1.11.02,,On pace early; under a hold in the Straight.,ST_AWT,1200,HK_2020_E466
2023101202,2023-10-12,2,5,ALACRITY (H210),Z Purton,J Richards,8,B/XB,4-1/4L,5 5 5,1.11.05,,Held ground; stayed on comfortably.,ST_AWT,1200,HK_2022_H210
2023101202,2023-10-12,2,6,BOOM ALLIANCE (G220),L Hewitson,D J Whyte,5,SR/XB,5-1/2L,6 6 6,1.11.28,,Raced under his won steam; hung in at 200m.,ST_AWT,1200,HK_2021_G220
2023101202,2023-10-12,2,7,MR ASCENDENCY (G227),H Bentley,P F Yiu,10,B,5-3/4L,9 8 7,1.11.32,,Limited response when asked at turn.,ST_AWT,1200,HK_2021_G227
2023101202,2023-10-12,2,8,SUPER LEGENDS (H364),L Ferraris,C S Shum,3,,6-1/4L,4 4 8,1.11.39,,Raced awkwardly at 200m; under a hold thereafter.,ST_AWT,1200,HK_2022_H364
2023101202,2023-10-12,2,9,BEAUTY MISSILE (H123),M Chadwick,F C Lor,4,V,8-1/4L,8 7 9,1.11.70,,Steadied at 200m; not tested.,ST_AWT,1200,HK_2022_H123
2023101202,2023-10-12,2,10,SO WE JOY (D082),M K Cheung,C W Chang,7,H,8-1/4L,10 10 10,1.11.72,,Raced at rear; just to stretch out.,ST_AWT,1200,HK_2019_D082
2023101203,2023-10-12,3,1,GOLDEN SAMURAI (H024),Z Purton,K W Lui,8,,,7 6 1,1.10.48,,Shifted out at turn; came from behind to score.,ST_AWT,1200,HK_2022_H024
2023101203,2023-10-12,3,2,PACKING BOLE (H246),A Atzeni,C S Shum,6,,Neck,5 3 2,1.10.55,,Four wide at turn; made steady progress thereafter.,ST_AWT,1200,HK_2022_H246
2023101203,2023-10-12,3,3,FUN TOGETHER (H041),C L Chau,T P Yung,3,CP,3/4L,4 5 3,1.10.63,,Caught in traffic at 200m; hard ridden for 3rd late.,ST_AWT,1200,HK_2022_H041
2023101203,2023-10-12,3,4,LOST CHILD (G461),L Hewitson,C W Chang,5,,1-3/4L,6 7 4,1.10.76,,Caught in traffic at 200m; ran on when recovered.,ST_AWT,1200,HK_2021_G461
2023101203,2023-10-12,3,5,CELTIC TIMES (G230),K Teetan,W K Mo,1,B,2-1/4L,3 4 5,1.10.82,,Limited response when hard ridden.,ST_AWT,1200,HK_2021_G230
2023101203,2023-10-12,3,6,JOYFUL FRIENDSHIP (H295),S H Sit,P F Yiu,7,B,3L,8 8 6,1.10.97,Passed,Shifted out gradually at 300m; made minor progress when hard ridden.,ST_AWT,1200,HK_2022_H295
2023101203,2023-10-12,3,7,MULAN (H145),K De Melo,J Richards,4,,3-1/2L,2 2 7,1.11.03,,Shared lead early; weakened in the Straight.,ST_AWT,1200,HK_2022_H145
2023101203,2023-10-12,3,8,PHILOS (H371),Y L Chung,A S Cruz,2,H,5L,1 1 8,1.11.26,,Led early; weakened in the Straight.,ST_AWT,1200,HK_2022_H371
2023101203,2023-10-12,3,9,ROMANTIC FANTASY (H168),M Chadwick,C S Shum,9,B,ML,9 9 9,1.16.00,Failed,Found nothing when asked; tailed out.,ST_AWT,1200,HK_2022_H168
2023101203,2023-10-12,3,10,BILLIONAIRE SECRET (G303),,P C Ng,10,,,Withdrawn,,,,ST_AWT,1200,HK_2021_G303
2023101204,2023-10-12,4,1,YEE CHEONG SPIRIT (H379),K C Leung,C S Shum,4,B,,1 1 1,1.10.60,Passed,Urged to lead along the rail; kept on to score.,ST_AWT,1200,HK_2022_H379
2023101204,2023-10-12,4,2,HIGH RISE POWER (H353),L Hewitson,K W Lui,5,,1/2L,5 5 2,1.10.67,,Hard ridden for 2nd when shifted racing ground at 300m.,ST_AWT,1200,HK_2022_H353
2023101204,2023-10-12,4,3,MORE RICE (H271),K Teetan,T P Yung,1,,3/4L,3 3 3,1.10.72,,Raced under his own steam in the Straight; impressive.,ST_AWT,1200,HK_2022_H271
2023101204,2023-10-12,4,4,MISSION BRAVO (E383),L Ferraris,M Newnham,3,B,3/4L,2 2 4,1.10.72,,Under a hold in the Straight; impressive.,ST_AWT,1200,HK_2020_E383
2023101204,2023-10-12,4,5,SCOTCH TYCOON (G088),B Avdulla,M Newnham,7,,1-1/2L,7 6 5,1.10.84,,Head turned sideways at 300m; made minor inroads when hard ridden.,ST_AWT,1200,HK_2021_G088
2023101204,2023-10-12,4,6,RIGHTEOUS DOCTRINE (C197),M L Yeung,C W Chang,9,XB,3L,8 7 6,1.11.07,,Raced wide throughout; made progress wide.,ST_AWT,1200,HK_2018_C197
2023101204,2023-10-12,4,7,CHAMPION METHOD (H366),Z Purton,C S Shum,8,,4-1/2L,4 4 7,1.11.31,,Up with the pace; under a hold in the Straight.,ST_AWT,1200,HK_2022_H366
2023101204,2023-10-12,4,8,AMAZING BOY (D513),K De Melo,C W Chang,2,,6L,9 9 8,1.11.55,,Under a hold throughout; just to stretch out.,ST_AWT,1200,HK_2019_D513
2023101204,2023-10-12,4,9,TRADER (E287),C L Chau,P C Ng,6,CP,10L,6 8 9,1.12.20,,Unable to lead; raced at rear.,ST_AWT,1200,HK_2020_E287
2023101204,2023-10-12,4,10,TEO VISION (H355),A Atzeni,M Newnham,10,B/XB,13-1/2L,10 10 10,1.12.77,Failed,Began fairly; unable to stretch when under whip at turn.,ST_AWT,1200,HK_2022_H355
2023101205,2023-10-12,5,1,SAMARKAND (H070),C L Chau,D A Hayes,7,CP,,3 2 1,1.11.23,,Made progress steadily; hit the front at 200m to score.,ST_AWT,1200,HK_2022_H070
2023101205,2023-10-12,5,2,CASA LEGEND (G126),A Atzeni,C S Shum,3,B,Head,7 6 2,1.11.26,,Showed good turn of foot when let go at 200m.,ST_AWT,1200,HK_2021_G126
2023101205,2023-10-12,5,3,FORTUNE MASTER (D371),K De Melo,J Richards,2,B/XB,3/4L,6 4 3,1.11.37,,Made progress when persuaded late.,ST_AWT,1200,HK_2019_D371
2023101205,2023-10-12,5,4,CRAIG'S MASTER (G440),H Bentley,K H Ting,1,B,3/4L,2 3 4,1.11.37,Passed,Responded fairly well when hard ridden.,ST_AWT,1200,HK_2021_G440
2023101205,2023-10-12,5,5,ISLAND BRIGHT (H363),K C Leung,P F Yiu,8,CP,1-1/4L,1 1 5,1.11.42,,Good early speed; weakened late.,ST_AWT,1200,HK_2022_H363
2023101205,2023-10-12,5,6,CLUB SODA (H312),B Avdulla,J Size,9,,3-1/4L,9 7 6,1.11.76,,Shifted to the inside in the Straight; made progress when hard ridden.,ST_AWT,1200,HK_2022_H312
2023101205,2023-10-12,5,7,GALLANT HERO (E480),Z Purton,D J Hall,6,,3-1/2L,5 8 7,1.11.77,,Raced awkwardly at turn; ran on when asked.,ST_AWT,1200,HK_2020_E480
2023101205,2023-10-12,5,8,GLUCK RACER (E157),K Teetan,W K Mo,4,H,4L,8 9 8,1.11.86,,Raced awkwardly when hard ridden at 200m.,ST_AWT,1200,HK_2020_E157
2023101205,2023-10-12,5,9,ARTHUR'S KINGDOM (E194),L Hewitson,Y S Tsui,5,H/XB,5-3/4L,4 5 9,1.12.13,,Gave ground in the Straight; unimpressive.,ST_AWT,1200,HK_2020_E194
2023101205,2023-10-12,5,10,CHARITY FOR ALL (H417),,C S Shum,10,,,Withdrawn,,,,ST_AWT,1200,HK_2022_H417
2023101206,2023-10-12,6,1,DAN ATTACK (H317),M Chadwick,J Richards,9,H/P,,5 4 1,1.10.63,,Four wide at turn; came from behind to score when persuaded at 200m.,ST_AWT,1200,HK_2022_H317
2023101206,2023-10-12,6,2,COMPULSORY (E328),K De Melo,C W Chang,2,XB,3/4L,4 6 2,1.10.76,,Dashed on centre track when hard ridden at 200m.,ST_AWT,1200,HK_2020_E328
2023101206,2023-10-12,6,3,BEAT HOLLOW (G414),K Teetan,Y S Tsui,5,,1-1/2L,6 5 3,1.10.87,,Made progress saving ground; impressive.,ST_AWT,1200,HK_2021_G414
2023101206,2023-10-12,6,4,SPICY SO SMART (G203),K C Leung,P C Ng,7,B/XB,3L,1 1 4,1.11.11,,Cut across early; under a hold in the Straight.,ST_AWT,1200,HK_2021_G203
2023101206,2023-10-12,6,5,ALL IS READY (G042),L Ferraris,M Newnham,3,B,3-3/4L,8 8 5,1.11.22,,Shifted out gradually at turn; made steady progress thereafter.,ST_AWT,1200,HK_2021_G042
2023101206,2023-10-12,6,6,PEAK TO PEAK (D472),L Currie,D A Hayes,4,H,5-1/2L,9 9 6,1.11.51,,Last to begin; made minor progress when hard ridden at 300m.,ST_AWT,1200,HK_2019_D472
2023101206,2023-10-12,6,7,BEAUTY INFINITY (H377),Z Purton,J Size,8,,5-3/4L,2 2 7,1.11.56,,On pace early; weakened and gave ground in the Straight.,ST_AWT,1200,HK_2022_H377
2023101206,2023-10-12,6,8,GREEN LASER (E409),H T Mo,W Y So,1,B,6L,3 3 8,1.11.59,,On pace early; weakened in the Straight.,ST_AWT,1200,HK_2020_E409
2023101206,2023-10-12,6,9,COLOURFUL BARON (G301),L Hewitson,J Richards,6,PC,6-3/4L,10 10 9,1.11.70,,Ran on ordinary; unimpressive.,ST_AWT,1200,HK_2021_G301
2023101206,2023-10-12,6,10,PING HAI COMET (H344),B Avdulla,J Size,10,,12L,7 7 10,1.12.55,Failed,Weakened when under whip at 300m; finished last.,ST_AWT,1200,HK_2022_H344
2023101207,2023-10-12,7,1,PARENTS' LOVE (H405),Y L Chung,A S Cruz,1,,,1 1 1,1.01.35,,Ran on comfortably under a hold.,ST_AWT,1050,HK_2022_H405
2023101207,2023-10-12,7,2,INVINCIBLE SAGE (H301),L Ferraris,D J Hall,3,,3/4L,2 2 2,1.01.49,,Ran on for 2nd; stayed on well.,ST_AWT,1050,HK_2022_H301
2023101207,2023-10-12,7,3,MEEPMEEP (H234),L Currie,J Size,2,,3-1/4L,4 4 3,1.01.87,,Overraced early; made progress saving ground.,ST_AWT,1050,HK_2022_H234
2023101207,2023-10-12,7,4,HAPPY TANGO (D075),H T Mo,Y S Tsui,5,B,4-1/2L,5 5 4,1.02.06,Passed,Niggled along throughout; ran on OK.,ST_AWT,1050,HK_2019_D075
2023101207,2023-10-12,7,5,GOLDEN RISE (H242),Z Purton,J Size,4,,5L,3 3 5,1.02.16,,Raced in an intractable manner in the Straight; ran on greenly.,ST_AWT,1050,HK_2022_H242
2023101701,2023-10-17,1,1,SIXTH GENERATION (G120),Z Purton,J Richards,7,CP/H,,1 1 1,0.59.44,,Led all the way to score; in good condition.,ST,1000,HK_2021_G120
2023101701,2023-10-17,1,2,AMAZING FUN (H442),K Teetan,C H Yip,10,,3/4L,9 9 2,0.59.58,,Looking for cover early; ran on well when clear late.,ST,1000,HK_2022_H442
2023101701,2023-10-17,1,3,STAR MAC (J053),L Hewitson,D A Hayes,5,,1-1/4L,3 3 3,0.59.65,Passed,Under restraint throughout; stretching out nicely.,ST,1000,HK_2023_J053
2023101701,2023-10-17,1,4,VOYAGE BUBBLE (E436),A Badel,P F Yiu,2,CP,1-1/4L,2 2 4,0.59.66,,Under a hold throughout; stretching out nicely.,ST,1000,HK_2020_E436
2023101701,2023-10-17,1,5,PAKISTAN FRIEND (B370),C L Chau,W Y So,9,,2-1/4L,10 10 5,0.59.81,,Made progress when shifted out gradually to centre track at 400m.,ST,1000,HK_2017_B370
2023101701,2023-10-17,1,6,GOLDEN SIXTY (C238),C Y Ho,K W Lui,1,,2-1/2L,6 4 6,0.59.84,,Under a hold midfield; stayed on strongly.,ST,1000,HK_2018_C238
2023101701,2023-10-17,1,7,BONUS PAL (H360),A Atzeni,P C Ng,8,SR,3-1/2L,4 6 7,1.00.02,,Laying in when hard ridden at 200m.,ST,1000,HK_2022_H360
2023101701,2023-10-17,1,8,ASTROLOGER (G102),H Bowman,K L Man,3,SR,5L,7 5 8,1.00.24,,Under a hold throughout and raced at rear.,ST,1000,HK_2021_G102
2023101701,2023-10-17,1,9,SILVER UP (J078),M Chadwick,W K Mo,4,H,6L,8 7 9,1.00.40,Passed,Limited response when persuaded late.,ST,1000,HK_2023_J078
2023101701,2023-10-17,1,10,ONLY U (J037),K C Leung,T P Yung,6,,7-1/2L,5 8 10,1.00.66,Passed,Gave ground; ran on ordinary.,ST,1000,HK_2023_J037
2023101702,2023-10-17,2,1,LOYAL BO BO (J011),Z Purton,F C Lor,11,,,3 7 1,0.59.22,,Dashed on to score when let go late.,ST,1000,HK_2023_J011
2023101702,2023-10-17,2,2,GOLDEN DARCI (H470),Y L Chung,A S Cruz,6,,Neck,1 1 2,0.59.28,,Led early; just caught.,ST,1000,HK_2022_H470
2023101702,2023-10-17,2,3,PANDA (H466),K Teetan,C H Yip,4,,1-1/2L,9 6 3,0.59.46,Passed,Quickened for 3rd when persuaded at 200m.,ST,1000,HK_2022_H466
2023101702,2023-10-17,2,4,SO TREASURE (H351),H Bowman,M Newnham,9,,1-3/4L,2 2 4,0.59.51,,Head sideways throughout; but still ran on fairly well.,ST,1000,HK_2022_H351
2023101702,2023-10-17,2,5,THE ABSOLUTE (H438),L Ferraris,K H Ting,10,,2L,7 9 5,0.59.53,,Made progress in between runners late; impressive.,ST,1000,HK_2022_H438
2023101702,2023-10-17,2,6,MIDORI BURLY (J083),A Atzeni,P F Yiu,2,,3-1/2L,10 8 6,0.59.76,,Raced greenly when hard ridden at 200m.,ST,1000,HK_2023_J083
2023101702,2023-10-17,2,7,CIRCUIT VICTORY (H487),K C Leung,K L Man,8,,4-3/4L,11 11 7,0.59.96,,Crowded after start; ran on well when recovered.,ST,1000,HK_2022_H487
2023101702,2023-10-17,2,8,THE GREAT MASTER (H457),L Hewitson,Y S Tsui,3,,5-1/2L,8 3 8,1.00.10,Passed,Average to begin; dashed on momentarily halfway; failed to respond thereafter.,ST,1000,HK_2022_H457
2023101702,2023-10-17,2,9,THE EQUALIZER (G445),M L Yeung,C W Chang,7,B,12-3/4L,4 4 9,1.01.24,Passed,Failed to respond when hard ridden late.,ST,1000,HK_2021_G445
2023101702,2023-10-17,2,10,TOURBILLON FLOW (J061),A Badel,C S Shum,5,,21L,6 10 10,1.02.56,Failed,Weakened halfway; gave ground.,ST,1000,HK_2023_J061
2023101702,2023-10-17,2,11,GREAT ACHIEVER (J049),C L Chau,T P Yung,1,,22L,5 5 11,1.02.74,Passed,Raced awkwardly; gave ground abruptly.,ST,1000,HK_2023_J049
2023101703,2023-10-17,3,1,PROSPEROUS SMILE (J014),K Teetan,P C Ng,7,CP,,1 1 1,0.58.88,,Urged to lead along the rail; kept on to score.,ST,1000,HK_2023_J014
2023101703,2023-10-17,3,2,PERFECTO MOMENTS (J003),M L Yeung,K H Ting,10,,1-1/4L,6 7 2,0.59.09,,Laying in at 400m; ran on when recovered.,ST,1000,HK_2023_J003
2023101703,2023-10-17,3,3,MISSION VOICE (H444),Z Purton,M Newnham,8,,1-3/4L,2 8 3,0.59.17,,Ridden conservatively early; made progress in between runners when hard ridden at 200m.,ST,1000,HK_2022_H444
2023101703,2023-10-17,3,4,SUPER GLORY (J025),A Atzeni,P C Ng,11,,2-3/4L,3 4 4,0.59.33,,Responded fairly well when hard ridden at 200m.,ST,1000,HK_2023_J025
2023101703,2023-10-17,3,5,JOYFUL LIFE (H426),K C Leung,P F Yiu,9,,3-1/4L,9 9 5,0.59.41,,Raced keenly and was restrained early; under a hold and not tested.,ST,1000,HK_2022_H426
2023101703,2023-10-17,3,6,SUPER TEN (D362),L Hewitson,C W Chang,6,,3-1/2L,5 3 6,0.59.44,,Playing with his tongue late; lack concentration.,ST,1000,HK_2019_D362
2023101703,2023-10-17,3,7,JAMES TAK (J007),H Bowman,T P Yung,5,,3-3/4L,4 2 7,0.59.46,Passed,Up with the pace; weakened late.,ST,1000,HK_2023_J007
2023101703,2023-10-17,3,8,CHATER GOLD (J004),L Currie,D A Hayes,3,,4-1/2L,8 5 8,0.59.58,Passed,Not quickened when asked late.,ST,1000,HK_2023_J004
2023101703,2023-10-17,3,9,NEW POWER (H325),H T Mo,C W Chang,1,B/H,4-3/4L,11 11 9,0.59.63,Failed,Shifted out on jumping; failed to respond when hard ridden.,ST,1000,HK_2022_H325
2023101703,2023-10-17,3,10,GOLDEN LONG (H462),M Chadwick,F C Lor,4,,4-3/4L,7 6 10,0.59.64,Passed,Over-racing early; raced greenly.,ST,1000,HK_2022_H462
2023101703,2023-10-17,3,11,V LOVE YOU (J048),C L Chau,C S Shum,2,,7L,10 10 11,1.00.01,Passed,Niggled along early; not willing to stretch.,ST,1000,HK_2023_J048
2023101704,2023-10-17,4,1,LUCKY PLANET (H235),H Bentley,D J Whyte,6,B,,7 1 1,0.59.32,Passed,Head in the air after start; hit the front halfway; kept on to score.,ST,1000,HK_2022_H235
2023101704,2023-10-17,4,2,PATCH OF TIME (H483),Z Purton,K H Ting,8,,1/2L,5 2 2,0.59.39,,Under a hold for 2nd; ran on nicely.,ST,1000,HK_2022_H483
2023101704,2023-10-17,4,3,ROMANTIC HERO (H482),K Teetan,C S Shum,7,,1/2L,6 3 3,0.59.41,,Looking for cover early; hard ridden for 3rd.,ST,1000,HK_2022_H482
2023101704,2023-10-17,4,4,SUPER GOLDI (H477),H Bowman,F C Lor,4,,3-1/4L,4 4 4,0.59.82,Passed,Under restraint early; limited response when asked late.,ST,1000,HK_2022_H477
2023101704,2023-10-17,4,5,TUNG HAYE HAYE (G105),M Chadwick,W K Mo,11,H,5L,8 5 5,1.00.11,,Made progress steadily; stayed on comfortably.,ST,1000,HK_2021_G105
2023101704,2023-10-17,4,6,PRECISION GOAL (H016),K H Tse,T P Yung,10,P,7L,3 6 6,1.00.44,,Ran on evenly when persuaded late.,ST,1000,HK_2021_H016
2023101704,2023-10-17,4,7,WINNING HEART (H065),Y L Chung,A S Cruz,3,B,14-3/4L,9 9 7,1.01.67,Failed,Ran on unimpressively when asked and under whip.,ST,1000,HK_2022_H065
2023101704,2023-10-17,4,8,FOREMOST TEDDY (J058),A Atzeni,C S Shum,5,,16-1/4L,10 10 8,1.01.91,Failed,Ridden along after start; made minor progress late.,ST,1000,HK_2023_J058
2023101704,2023-10-17,4,9,MILES OF STAR (H468),L Hewitson,Y S Tsui,9,,16-3/4L,1 7 9,1.01.98,,Gave ground late; unimpressive.,ST,1000,HK_2022_H468
2023101704,2023-10-17,4,10,HERO WARRIOR (J006),C L Chau,T P Yung,2,B,22-1/4L,2 8 10,1.02.89,Failed,Gave ground; needs time.,ST,1000,HK_2023_J006
2023101704,2023-10-17,4,11,AMAZINGTEAMWORK (H488),K C Leung,W K Mo,1,H/B,ML,11 11 11,1.04.31,Failed,Jumped awkwardly; tailed off.,ST,1000,HK_2022_H488
2023101705,2023-10-17,5,1,PING HAI GALAXY (C377),K Teetan,J Size,10,,,1 1 1,0.46.77,,Jumped well; led all the way to score.,ST,800,HK_2018_C377
2023101705,2023-10-17,5,2,SUPERB WITNESS (H467),H Bowman,D A Hayes,7,,3L,2 2 2,0.47.27,Passed,On pace for 2nd; stayed on comfortably.,ST,800,HK_2022_H467
2023101705,2023-10-17,5,3,MANYTHANKS FOREVER (J065),B Avdulla,J Richards,6,,4L,6 3 3,0.47.42,Passed,Hit the line strongly when persuaded at 300m.,ST,800,HK_2023_J065
2023101705,2023-10-17,5,4,RED MAVERICK (J067),M L Yeung,Y S Tsui,4,,4-3/4L,4 4 4,0.47.53,Passed,Responded fairly well when under whip late.,ST,800,HK_2023_J067
2023101705,2023-10-17,5,5,GRAND CONQUEROR (H469),C Y Ho,M Newnham,2,,4-3/4L,7 7 5,0.47.53,Passed,Ridden along early; made minor progress late.,ST,800,HK_2022_H469
2023101705,2023-10-17,5,6,WINNING GOLD (H461),L Currie,W Y So,5,H,5-3/4L,3 6 6,0.47.70,Passed,Raced awkwardly when hard ridden.,ST,800,HK_2022_H461
2023101705,2023-10-17,5,7,SAVVY ELEGANCE (J068),L Hewitson,D J Whyte,3,XB,6-1/4L,5 5 7,0.47.78,Passed,Going all over the place at 400m; raced keenly and was restrained.,ST,800,HK_2023_J068
2023101705,2023-10-17,5,8,FAST AS ROCKET (H375),C L Chau,W Y So,1,XB,7-1/2L,10 10 8,0.47.97,Passed,Average to begin; raced at rear.,ST,800,HK_2022_H375
2023101705,2023-10-17,5,9,SHINE BRIGHT (H385),H Bentley,C H Yip,9,,8-1/4L,9 8 9,0.48.08,Passed,Not much progress when asked late.,ST,800,HK_2022_H385
2023101705,2023-10-17,5,10,LE MAILLOT JAUNE (J034),K C Leung,W K Mo,8,,12-3/4L,8 9 10,0.48.81,Failed,Slightly slow to begin; found nothing when asked.,ST,800,HK_2023_J034
2023101706,2023-10-17,6,1,GOLDEN WARSTEED (G350),M Chadwick,W Y So,1,XB,,4 3 1,0.46.77,Passed,Made progress steadily; impressive.,ST,800,HK_2021_G350
