race_id,Date,trial_number,horse_number,Horse,Jockey,Trainer,Draw,Gear,LBW,Running Position,Time,Result,Comment,Track,Dist.,horse_id
2018062904,2018-06-29,4,8,PAKISTAN FRIEND (B370),T Berry,A S Cruz,3,,7L,12 12 8,1.02.34,,Niggled along throughout; ran on strongly after the post.,ST_AWT,1050,HK_2017_B370
2018062904,2018-06-29,4,9,EQUITY DOCTRINE (T329),W M Lai,C W Chang,2,B,7-1/4L,7 7 9,1.02.40,,Settled midfield; ran on OK.,ST_AWT,1050,HK_2014_T329
2018062904,2018-06-29,4,10,SUPER CHIC (A134),C Y Ho,A S Cruz,12,B,8-1/4L,11 11 10,1.02.57,,Responded OK when under whip at 200m.,ST_AWT,1050,HK_2016_A134
2018062904,2018-06-29,4,11,GALLANT SPIRIT (B379),C Schofield,C W Chang,7,,9-1/2L,8 9 11,1.02.74,,Raced awkwardly when asked in the Straight.,ST_AWT,1050,HK_2017_B379
2018062904,2018-06-29,4,12,ANYTHING GOES (B415),K C Ng,A S Cruz,6,,10-3/4L,9 10 12,1.02.95,,Gave ground when being hard ridden.,ST_AWT,1050,HK_2017_B415
2018070301,2018-07-03,1,1,RISE HIGH (A238),Z Purton,C Fownes,7,XB,,8 6 1,1.09.85,,Made progress steadily; hit the front centre track to score.,ST_AWT,1200,HK_2016_A238
2018070301,2018-07-03,1,2,HEZTHEWONFORUS (B287),J Moreira,J Size,5,SR,SH,5 3 2,1.09.88,,Made progress steadily; fought on to be beaten narrowly.,ST_AWT,1200,HK_2017_B287
2018070301,2018-07-03,1,3,ALCARI (A354),K Teetan,P F Yiu,1,B,4L,4 5 3,1.10.50,,Under restraint early; made progress saving ground.,ST_AWT,1200,HK_2016_A354
2018070301,2018-07-03,1,4,GAMECHANGERS (A162),H N Wong,J Size,4,,4L,2 1 4,1.10.50,,Led early; kept on one-paced.,ST_AWT,1200,HK_2016_A162
2018070301,2018-07-03,1,5,DIAMOND DRAGON (V002),C Y Ho,K W Lui,8,,4-1/2L,1 2 5,1.10.59,,Led early but wide; weakened late.,ST_AWT,1200,HK_2015_V002
2018070301,2018-07-03,1,6,LAND GRANT (V131),C Wong,A T Millard,2,V/XB,5L,3 4 6,1.10.64,Passed,Up with the pace; failed to respond late.,ST_AWT,1200,HK_2015_V131
2018070301,2018-07-03,1,7,MR GENUINE (S253),M F Poon,D J Hall,6,,7-1/4L,7 7 7,1.10.99,,Held ground and wide throughout.,ST_AWT,1200,HK_2013_S253
2018070301,2018-07-03,1,8,AEROSONG (B400),C Schofield,P O'Sullivan,3,B,7-1/2L,6 8 8,1.11.05,Passed,Raced at rear; ran on ordinary.,ST_AWT,1200,HK_2017_B400
2018070301,2018-07-03,1,9,NOBLE STEED (A326),,K W Lui,9,,,Withdrawn,,,no show,ST_AWT,1200,HK_2016_A326
2018070301,2018-07-03,1,10,BOMBAY BLITZ (A338),,C Fownes,10,,,Withdrawn,,,no show,ST_AWT,1200,HK_2016_A338
2018070302,2018-07-03,2,1,SUPERICH (B257),J Moreira,F C Lor,5,SR,,2 2 1,1.09.64,,On pace early; ran on strongly to score with plenty in hand.,ST_AWT,1200,HK_2017_B257
2018070302,2018-07-03,2,2,YEE CHEONG PEGASUS (B064),S Clipperton,D J Hall,6,B,2-1/4L,1 1 2,1.10.00,Passed,Led along the rail; kept on for 2nd.,ST_AWT,1200,HK_2017_B064
2018070302,2018-07-03,2,3,BETTER CHOICE (A383),K C Leung,W Y So,8,,4L,3 3 3,1.10.28,,Niggled along throughout; struggled for 3rd.,ST_AWT,1200,HK_2016_A383
2018070302,2018-07-03,2,4,LE PANACHE (V369),D Whyte,T P Yung,2,B,5L,4 4 4,1.10.42,,Ran on comfortably for 4th.,ST_AWT,1200,HK_2015_V369
2018070302,2018-07-03,2,5,HIGH FIVE (T200),K Teetan,A T Millard,9,,7L,10 10 5,1.10.76,,Made progress saving ground; ran on OK.,ST_AWT,1200,HK_2014_T200
2018070302,2018-07-03,2,6,WONDERFUL CHASER (V258),B Prebble,K W Lui,3,,7-1/2L,8 8 6,1.10.82,,Made minor inroads when under whip at 300m.,ST_AWT,1200,HK_2015_V258
2018070302,2018-07-03,2,7,AMAZING LUCK (B401),Z Purton,P O'Sullivan,10,SR,7-1/2L,7 6 7,1.10.84,,Under a hold midfield; ran on OK.,ST_AWT,1200,HK_2017_B401
2018070302,2018-07-03,2,8,THE INVINCIBLE (A191),C Schofield,W Y So,4,B,8L,5 7 8,1.10.93,,Limited response when hard ridden in the Straight.,ST_AWT,1200,HK_2016_A191
2018070302,2018-07-03,2,9,INVESTOR BOOM (A424),M Chadwick,P F Yiu,7,B,8-3/4L,9 9 9,1.11.02,,Slow to begin; never in contention.,ST_AWT,1200,HK_2016_A424
2018070302,2018-07-03,2,10,THE CHAMP (V271),M L Yeung,F C Lor,1,SR,9-3/4L,6 5 10,1.11.21,,Flattened halfway; gave ground in the Straight.,ST_AWT,1200,HK_2015_V271
2018070303,2018-07-03,3,1,SOLOMON'S BAY (B330),J Moreira,F C Lor,4,,,5 2 1,1.01.65,,Hit the front at 200m; won with plenty in hand.,ST_AWT,1050,HK_2017_B330
2018070303,2018-07-03,3,2,FORTUNE ANTHEM (B276),Z Purton,D J Hall,2,,2-3/4L,1 1 2,1.02.11,,Led early; kept on for 2nd.,ST_AWT,1050,HK_2017_B276
2018070303,2018-07-03,3,3,BEST SMILE (B359),H N Wong,W Y So,3,,5-1/4L,6 5 3,1.02.50,Passed,Slightly slow to begin; wide throughout; came from behind for 3rd.,ST_AWT,1050,HK_2017_B359
2018070303,2018-07-03,3,4,DEMONS ROCK (B263),M L Yeung,A Lee,6,V,5-3/4L,3 3 4,1.02.55,Passed,Over-racing early; under whip late.,ST_AWT,1050,HK_2017_B263
2018070303,2018-07-03,3,5,CALIFORNIA LEGEND (B363),K C Ng,A S Cruz,1,CP,6L,4 6 5,1.02.62,,Raced awkwardly when asked late.,ST_AWT,1050,HK_2017_B363
2018070303,2018-07-03,3,6,FLYING STAR (B361),C Y Ho,A S Cruz,5,B,12-1/4L,2 4 6,1.03.60,Failed,Gave ground; finished last.,ST_AWT,1050,HK_2017_B361
2018070303,2018-07-03,3,7,YEE CHEONG LUCKY (B357),,D J Hall,7,,,Withdrawn,,,no show,ST_AWT,1050,HK_2017_B357
2018070601,2018-07-06,1,1,CONTE (A429),J Moreira,J Size,3,,,6 5 1,1.11.01,,Began moderately; made progress steadily.,ST_AWT,1200,HK_2016_A429
2018070601,2018-07-06,1,2,JOLLY BANNER (V077),M F Poon,P F Yiu,5,B,Nose,3 4 2,1.11.01,,Under restraint for 2nd; impressive.,ST_AWT,1200,HK_2015_V077
2018070601,2018-07-06,1,3,PRAWN BABA (A002),H N Wong,J Size,6,P,3/4L,4 2 3,1.11.15,,On pace for 3rd; ran on fairly well.,ST_AWT,1200,HK_2016_A002
2018070601,2018-07-06,1,4,DINOZZO (V246),S Clipperton,J Size,9,B,1-1/2L,11 8 4,1.11.24,,Quickened at turn; ran on OK.,ST_AWT,1200,HK_2015_V246
2018070601,2018-07-06,1,5,DRAGON LIPS (B212),N Callan,A S Cruz,10,H/P,2L,1 1 5,1.11.34,,Urged to lead along the rail; kept on late.,ST_AWT,1200,HK_2017_B212
2018070601,2018-07-06,1,6,LAST KINGDOM (B203),C Wong,A T Millard,11,H,2-1/2L,2 3 6,1.11.42,,Under restraint early; limited response when asked late.,ST_AWT,1200,HK_2017_B203
2018070601,2018-07-06,1,7,CHEERFUL GIGGLES (B165),C Schofield,A T Millard,8,,3-1/2L,12 11 7,1.11.56,,Dashed on well when persuaded at 300m.,ST_AWT,1200,HK_2017_B165
2018070601,2018-07-06,1,8,SPEEDY WALLY (T002),K Teetan,C Fownes,1,,3-3/4L,8 6 8,1.11.59,,Responded OK when asked in the Straight.,ST_AWT,1200,HK_2014_T002
2018070601,2018-07-06,1,9,FRIENDS OF NANJING (V140),Z Purton,C H Yip,7,,4-1/2L,7 7 9,1.11.74,,Under a hold midfield; not tested.,ST_AWT,1200,HK_2015_V140
2018070601,2018-07-06,1,10,LUCKY GUY (T349),W M Lai,C H Yip,4,,5-1/2L,10 10 10,1.11.89,Passed,Slightly slow to begin; raced under his own steam after being blocked at 700m.,ST_AWT,1200,HK_2014_T349
2018070601,2018-07-06,1,11,LIVERBIRD STAR (A405),K C Leung,P O'Sullivan,2,,6L,9 9 11,1.11.95,,Steadied at 700m; under a hold in the Straight.,ST_AWT,1200,HK_2016_A405
2018070601,2018-07-06,1,12,SAVVY SIX (B153),C Y Ho,A S Cruz,12,H/PC,12L,5 12 12,1.12.91,,Wide throughout; ran on ordinary.,ST_AWT,1200,HK_2017_B153
2018070602,2018-07-06,2,1,MARZOUQ (B094),J Moreira,J Size,9,,,3 3 1,1.10.37,,Hit the front at 200m to score; moved better after last win.,ST_AWT,1200,HK_2017_B094
2018070602,2018-07-06,2,2,SPORTS MASTER (A311),K Teetan,P F Yiu,4,B/E,Neck,11 8 2,1.10.43,,Wide at turn; hit the line strongly for 2nd.,ST_AWT,1200,HK_2016_A311
2018070602,2018-07-06,2,3,RED HORSE (V334),Z Purton,C H Yip,5,B,1-3/4L,4 4 3,1.10.64,,Under a hold for 3rd; impressive.,ST_AWT,1200,HK_2015_V334
2018070602,2018-07-06,2,4,PO CHING TREASURE (S388),C Y Ho,C Fownes,1,,3-1/4L,6 5 4,1.10.87,,Niggled along throughout; ran on strongly.,ST_AWT,1200,HK_2013_S388
2018070602,2018-07-06,2,5,EPTIMUM (B305),H N Wong,C Fownes,10,H,4-1/4L,5 6 5,1.11.05,,Four wide at turn; kept on one-paced.,ST_AWT,1200,HK_2017_B305
2018070602,2018-07-06,2,6,HO HO KHAN (B318),C Schofield,D J Hall,11,,6L,10 9 6,1.11.32,,Dashed on strongly when clear in the Straight.,ST_AWT,1200,HK_2017_B318
2018070602,2018-07-06,2,7,LONDON HALL (B026),M F Poon,D J Hall,2,,6-1/4L,9 7 7,1.11.35,,Urged early; limited response when asked in the Straight.,ST_AWT,1200,HK_2017_B026
2018070602,2018-07-06,2,8,MULTIMAX (T129),K C Ng,A S Cruz,3,CP,6-1/4L,2 1 8,1.11.37,,Led along the rail; failed to respond late.,ST_AWT,1200,HK_2014_T129
2018070602,2018-07-06,2,9,SIMBA (A265),W M Lai,C W Chang,7,,7-1/2L,1 2 9,1.11.56,Passed,Shared lead early; weakened badly in the Straight.,ST_AWT,1200,HK_2016_A265
2018070602,2018-07-06,2,10,MAHLER MOJO (B301),C Wong,A T Millard,6,,15-1/2L,8 10 10,1.12.84,Failed,Raced greenly; never in contention.,ST_AWT,1200,HK_2017_B301
2018070602,2018-07-06,2,11,GOLDEN BOX (B152),N Callan,L Ho,8,H,19-3/4L,7 11 11,1.13.51,Failed,Found nothing when being hard ridden.,ST_AWT,1200,HK_2017_B152
2018070603,2018-07-06,3,1,INTREPIC (A139),S Clipperton,D J Hall,8,B,,5 3 1,1.01.10,Passed,"""Always in touch but wide, ran on to score.""",ST_AWT,1050,HK_2016_A139
2018070603,2018-07-06,3,2,ATTENTION (B306),C Schofield,A T Millard,7,,Neck,2 1 2,1.01.14,,Shared lead early; kept on OK for 2nd.,ST_AWT,1050,HK_2017_B306
2018070603,2018-07-06,3,3,SMART PATCH (B398),Z Purton,P O'Sullivan,6,B,3/4L,8 7 3,1.01.23,,Dashed on centre track for 3rd; impressive.,ST_AWT,1050,HK_2017_B398
2018070603,2018-07-06,3,4,OTOUTO (V074),K Teetan,A T Millard,1,B,1L,3 4 4,1.01.28,,Up with the pace; ran on OK when asked.,ST_AWT,1050,HK_2015_V074
2018070603,2018-07-06,3,5,MY WINNER (B197),T Berry,P F Yiu,3,B,1-1/4L,7 6 5,1.01.32,,Dashed on well when clear in the Straight.,ST_AWT,1050,HK_2017_B197
2018070603,2018-07-06,3,6,STAR OF YAN OI (T389),K C Leung,T P Yung,4,B,2-1/4L,1 2 6,1.01.47,,On pace along the rail; under a hold late.,ST_AWT,1050,HK_2014_T389
2018070603,2018-07-06,3,7,BOLD STITCH (S323),C Wong,A T Millard,5,V/XB,2-1/2L,6 8 7,1.01.51,,Wide throughout; not tested.,ST_AWT,1050,HK_2013_S323
2018070603,2018-07-06,3,8,WINGOLD (T202),M L Yeung,A Lee,2,CP,3-1/4L,4 5 8,1.01.61,Passed,Limited response when asked late.,ST_AWT,1050,HK_2014_T202
2018071001,2018-07-10,1,1,RED WARRIOR (B355),H N Wong,J Size,1,,,2 1 1,1.10.68,,Led along the rail; kept on well to score.,ST_AWT,1200,HK_2017_B355
2018071001,2018-07-10,1,2,MR SO AND SO (B412),J Moreira,J Size,5,,SH,3 3 2,1.10.71,,Three wide throughout; ran on OK.,ST_AWT,1200,HK_2017_B412
2018071001,2018-07-10,1,3,CASHIN MINISTER (B158),S Clipperton,J Size,3,V,2L,1 2 3,1.10.99,Passed,Struggled for 3rd when under whip at 300m.,ST_AWT,1200,HK_2017_B158
2018071001,2018-07-10,1,4,REAL GIANT (B382),Z Purton,D J Hall,2,B,4-3/4L,4 4 4,1.11.44,Passed,Last to jump; ran on ordinary.,ST_AWT,1200,HK_2017_B382
2018071001,2018-07-10,1,5,MASTER JEWELLERY (B148),C Y Ho,J Size,4,V,12-1/4L,5 5 5,1.12.64,,Niggled along early; not willing to stretch.,ST_AWT,1200,HK_2017_B148
2018071002,2018-07-10,2,1,COUNTRY STAR (B396),J Moreira,J Size,1,,,1 1 1,1.00.73,,First to jump; led all the way to score.,ST_AWT,1050,HK_2017_B396
2018071002,2018-07-10,2,2,I AM POWER (B240),K Teetan,C Fownes,3,,3/4L,4 3 2,1.00.87,,Saved ground throughout; made progress steadily.,ST_AWT,1050,HK_2017_B240
2018071002,2018-07-10,2,3,DALRADIAN (A213),M F Poon,D J Hall,6,H,3-3/4L,2 2 3,1.01.34,Passed,On pace for 3rd; ran on OK.,ST_AWT,1050,HK_2016_A213
2018071002,2018-07-10,2,4,BOND ELEGANCE (A007),H N Wong,J Size,4,P,5-1/2L,3 4 4,1.01.62,,Limited response when asked late.,ST_AWT,1050,HK_2016_A007
2018071002,2018-07-10,2,5,WAR ROOM (B414),D Whyte,C Fownes,7,,6L,5 5 5,1.01.69,Passed,Not quickened when hard ridden in the Straight.,ST_AWT,1050,HK_2017_B414
2018071002,2018-07-10,2,6,VOLPINO (B161),U Rispoli,T P Yung,8,,7-1/4L,6 6 6,1.01.88,Passed,Wide throughout; raced under his own steam.,ST_AWT,1050,HK_2017_B161
2018071002,2018-07-10,2,7,PERFECT GLORY (B411),C Schofield,C Fownes,5,,7-3/4L,7 7 7,1.01.95,Passed,Failed to respond when asked at turn.,ST_AWT,1050,HK_2017_B411
2018071002,2018-07-10,2,8,YEE CHEONG LUCKY (B357),Z Purton,D J Hall,2,H/B,9-1/2L,8 8 8,1.02.26,,Slightly slow to begin; raced greenly.,ST_AWT,1050,HK_2017_B357
2018071301,2018-07-13,1,1,HARBOUR CENTURY (A407),C Schofield,A T Millard,8,,,1 1 1,1.02.27,,Jumped well; led all the way to score.,ST_AWT,1050,HK_2016_A407
2018071301,2018-07-13,1,2,PEARL CHAMPION (B201),N Callan,A T Millard,5,,1-3/4L,3 3 2,1.02.55,,Always in touch; moved better than before.,ST_AWT,1050,HK_2017_B201
2018071301,2018-07-13,1,3,FATE FIRE (B020),A Sanna,T P Yung,3,,3L,5 2 3,1.02.75,,Struggled for 3rd when hard ridden late.,ST_AWT,1050,HK_2017_B020
2018071301,2018-07-13,1,4,PING HAI TREASURE (B407),J Moreira,J Size,10,,4-1/4L,6 5 4,1.02.94,Passed,Responded OK when niggled along throughout.,ST_AWT,1050,HK_2017_B407
2018071301,2018-07-13,1,5,JUMBO BUS (A369),U Rispoli,T P Yung,6,,4-3/4L,4 4 5,1.03.04,,Up with the pace; ran on ordinary.,ST_AWT,1050,HK_2016_A369
2018071301,2018-07-13,1,6,MONKEY JEWELLERY (B378),S Clipperton,J Size,1,,7-1/2L,10 7 6,1.03.46,Passed,Slightly slow to begin; ran on ordinary.,ST_AWT,1050,HK_2017_B378
2018071301,2018-07-13,1,7,CINQUANTE CINQ (B404),M Chadwick,T P Yung,9,,7-3/4L,2 6 7,1.03.50,Passed,Gave ground; never in contention.,ST_AWT,1050,HK_2017_B404
2018071301,2018-07-13,1,8,VARA PEARL (S138),K C Ng,A T Millard,11,,8-1/4L,8 9 8,1.03.57,,Wide throughout; made minor inroads late.,ST_AWT,1050,HK_2013_S138
2018071301,2018-07-13,1,9,TRUE GRIT (B232),C Y Ho,J Size,4,V,16L,7 8 9,1.04.81,,Raced at rear; found nothing when asked.,ST_AWT,1050,HK_2017_B232
2018071301,2018-07-13,1,10,OSCAR MAGIC (B278),H N Wong,J Size,7,V,18-1/4L,9 10 10,1.05.18,,Weakened halfway; tailed off.,ST_AWT,1050,HK_2017_B278
2018071301,2018-07-13,1,11,HARBOUR ALERT (T254),K Teetan,A T Millard,2,,,UR,,Required to pass barrier trial,,ST_AWT,1050,HK_2014_T254
2018081401,2018-08-14,1,1,SUNNY ORIENT (V302),G van Niekerk,A T Millard,1,,,1 1 1,1.14.22,,Led along the rail; kept on well to score.,ST_AWT,1200,HK_2015_V302
2018081401,2018-08-14,1,2,CHEERFUL GIGGLES (B165),C Schofield,A T Millard,4,,1/2L,4 4 2,1.14.29,,Dashed on well when shifted out in the Straight.,ST_AWT,1200,HK_2017_B165
2018081401,2018-08-14,1,3,ROUNDABOUT (T352),C Wong,A T Millard,3,SR,3/4L,3 2 3,1.14.33,,Raced keenly early; hit the line strongly for 3rd.,ST_AWT,1200,HK_2014_T352
2018081401,2018-08-14,1,4,GOLD VELVET (V400),C Murray,A T Millard,2,,1-3/4L,2 3 4,1.14.50,,Responded fairly well when persuaded in the Straight.,ST_AWT,1200,HK_2015_V400
2018081402,2018-08-14,2,1,SHIMMER AND SHINE (B080),C Schofield,A T Millard,4,,,3 3 1,1.04.93,,Under restraint throughout; dashed on well to score when let go late.,ST_AWT,1050,HK_2017_B080
2018081402,2018-08-14,2,2,LAND GRANT (V131),C Wong,A T Millard,5,XB,SH,4 4 2,1.04.94,,Under a hold and ran on comfortably for 2nd.,ST_AWT,1050,HK_2015_V131
2018081402,2018-08-14,2,3,YOUNG DREAMER (T378),H T Mo,A T Millard,2,,Head,2 2 3,1.04.96,,On pace for 3rd; ran on OK.,ST_AWT,1050,HK_2014_T378
2018081402,2018-08-14,2,4,STRATHSPEY (A271),G van Niekerk,A T Millard,3,,1L,5 5 4,1.05.09,,Ran on impressively when clear in the Straight.,ST_AWT,1050,HK_2016_A271
2018081402,2018-08-14,2,5,OTOUTO (V074),C Murray,A T Millard,1,,3L,1 1 5,1.05.43,,Led along the rail; weakened late.,ST_AWT,1050,HK_2015_V074
2018081402,2018-08-14,2,6,KIROV (S277),,D J Hall,6,,,Withdrawn,,,,ST_AWT,1050,HK_2013_S277
2018081501,2018-08-15,1,1,HARBOUR CENTURY (A407),C Schofield,A T Millard,1,,,1 1 1,1.14.62,,Always in touch; kept on well to score.,ST_AWT,1200,HK_2016_A407
2018081501,2018-08-15,1,2,MI BLANCO (A186),C Murray,A T Millard,4,,1/2L,2 2 2,1.14.72,,Always in touch; ran on nicely.,ST_AWT,1200,HK_2016_A186
2018081501,2018-08-15,1,3,SUPER FORM (T232),G van Niekerk,A T Millard,3,,1-1/4L,4 4 3,1.14.83,,Dashed on impressively when clear in the Straight.,ST_AWT,1200,HK_2014_T232
2018081501,2018-08-15,1,4,HIGH FIVE (T200),C Wong,A T Millard,2,,2-1/2L,3 3 4,1.15.01,,Ran on comfortably; raced under his own steam.,ST_AWT,1200,HK_2014_T200
2018081701,2018-08-17,1,1,VICTOR EMPEROR (S425),Z Purton,C H Yip,1,,,1 2 1,1.12.48,,Led early; hit the front late to score.,ST_AWT,1200,HK_2013_S425
2018081701,2018-08-17,1,2,LUCKY GUY (T349),W M Lai,C H Yip,3,,1-3/4L,3 1 2,1.12.76,,Shared lead at turn; ran on OK.,ST_AWT,1200,HK_2014_T349
2018081701,2018-08-17,1,3,CLOUD NINE (T416),C Wong,A T Millard,2,XB,2-3/4L,2 4 3,1.12.92,,Came from behind for 3rd when asked in the Straight.,ST_AWT,1200,HK_2014_T416
2018081701,2018-08-17,1,4,WINNING WAYS (B332),K Teetan,C H Yip,4,H,3-1/2L,4 3 4,1.13.03,Passed,Dashed on momentarily at turn; limited response in the Straight.,ST_AWT,1200,HK_2017_B332
2018081702,2018-08-17,2,1,AEROHAPPINESS (B249),Z Purton,J Size,1,,,1 1 1,1.02.77,,Led all the way; kept on well to score.,ST_AWT,1050,HK_2017_B249
2018081702,2018-08-17,2,2,RED WARRIOR (B355),K Teetan,J Size,3,,2-1/4L,4 4 2,1.03.15,,Outpaced early; made good ground in the Straight.,ST_AWT,1050,HK_2017_B355
2018081702,2018-08-17,2,3,STRATHCLYDE (V225),C Wong,A T Millard,2,,5-1/2L,3 3 3,1.03.67,,Under a hold for 3rd; not tested.,ST_AWT,1050,HK_2015_V225
2018081702,2018-08-17,2,4,DALRADIAN (A213),M F Poon,D J Hall,4,,6-3/4L,2 2 4,1.03.85,,Wide throughout; ran on ordinary.,ST_AWT,1050,HK_2016_A213
2018081702,2018-08-17,2,5,CALIFORNIA GUNGHO (B204),,M J Freedman,5,,,Withdrawn,,,,ST_AWT,1050,HK_2017_B204
2018081702,2018-08-17,2,6,SPIRIT (B235),,M J Freedman,6,,,Withdrawn,,,,ST_AWT,1050,HK_2017_B235
2018081703,2018-08-17,3,1,HARBOUR ALERT (T254),K Teetan,A T Millard,1,,,1 1 1,1.01.80,Passed,Led along the rail; kept on to score.,ST_AWT,1050,HK_2014_T254
2018081703,2018-08-17,3,2,COUNTRY STAR (B396),Z Purton,J Size,2,,7-1/2L,2 2 2,1.02.99,,Under a hold for 2nd; but raced greenly.,ST_AWT,1050,HK_2017_B396
2018081703,2018-08-17,3,3,MONKEY JEWELLERY (B378),S Clipperton,J Size,3,,13L,3 3 3,1.03.87,Failed,Slow to begin; ran on comfortably.,ST_AWT,1050,HK_2017_B378
2018081703,2018-08-17,3,4,TOP ACE (T199),C Wong,A T Millard,4,,18-1/4L,5 5 4,1.04.72,,Being niggled along early; ran on ordinary.,ST_AWT,1050,HK_2014_T199
2018081703,2018-08-17,3,5,STELLAR FEELING (B127),G van Niekerk,M J Freedman,5,B/H,23-1/2L,4 4 5,1.05.57,Failed,Raced greenly; finished last.,ST_AWT,1050,HK_2017_B127
2018081703,2018-08-17,3,6,MONEY MARSHAL (B134),,M J Freedman,6,,,Withdrawn,,,,ST_AWT,1050,HK_2017_B134
2018081703,2018-08-17,3,7,BUNDLE OF ENERGY (B279),,D J Hall,7,,,Withdrawn,,,,ST_AWT,1050,HK_2017_B279
2018082101,2018-08-21,1,1,FABULOUS ONE (T005),H N Wong,W Y So,4,XB,,1 1 1,1.09.77,,Led all the way to score comfortably.,ST_AWT,1200,HK_2014_T005
2018082101,2018-08-21,1,2,WINNER'S WAY (A025),Z Purton,A S Cruz,1,CP,1-3/4L,5 4 2,1.10.05,,No early speed; made progress steadily.,ST_AWT,1200,HK_2016_A025
2018082101,2018-08-21,1,3,IMPECCABLE FELLOW (A310),C Schofield,R Gibson,2,B,5-1/2L,3 3 3,1.10.66,,Under a hold for 3rd; not fully tested.,ST_AWT,1200,HK_2016_A310
2018082101,2018-08-21,1,4,SWEETIE BARLEY (A231),M L Yeung,C Fownes,3,,5-3/4L,4 5 4,1.10.71,,Responded fairly well when hard ridden in the Straight.,ST_AWT,1200,HK_2016_A231
2018082101,2018-08-21,1,5,CALIFORNIA FORTUNE (A415),N Callan,A S Cruz,5,B,6L,2 2 5,1.10.74,,Up with the pace; limited response when asked in the Straight.,ST_AWT,1200,HK_2016_A415
2018082101,2018-08-21,1,6,HANG'S DECISION (T262),K C Leung,W Y So,6,B/H,7-1/2L,6 6 6,1.10.97,,Niggled along and held ground throughout.,ST_AWT,1200,HK_2014_T262
2018082101,2018-08-21,1,7,SUPER TURBO (V310),M F Poon,D J Hall,7,,8L,8 8 7,1.11.06,,Slightly slow to begin; raced under his own steam.,ST_AWT,1200,HK_2015_V310
2018082101,2018-08-21,1,8,KEY WITNESS (S212),D Whyte,A S Cruz,8,B,11-3/4L,7 7 8,1.11.67,,Niggled along after start; ran on ordinary.,ST_AWT,1200,HK_2013_S212
2018082102,2018-08-21,2,1,A BEAUTIFUL (T421),D Whyte,W Y So,6,,,1 1 1,1.11.46,,Cut across to lead; ran on strongly to score.,ST_AWT,1200,HK_2014_T421
2018082102,2018-08-21,2,2,BEAUTY SPIRIT (B409),A Sanna,A S Cruz,7,,2-1/4L,2 2 2,1.11.83,,On pace but wide; moved better than before.,ST_AWT,1200,HK_2017_B409
2018082102,2018-08-21,2,3,CALIFORNIA JOY (T406),K Teetan,A S Cruz,5,B,2-1/2L,3 3 3,1.11.87,,Three wide throughout; responded OK when asked late.,ST_AWT,1200,HK_2014_T406
2018082102,2018-08-21,2,4,THE INVINCIBLE (A191),C Schofield,W Y So,2,B,5-1/2L,4 5 4,1.12.33,,Responded OK when asked at 300m.,ST_AWT,1200,HK_2016_A191
2018082102,2018-08-21,2,5,BUNDLE OF ENERGY (B279),Z Purton,D J Hall,1,,6-1/4L,5 4 5,1.12.48,,Saved ground throughout; under a hold in the Straight.,ST_AWT,1200,HK_2017_B279
2018082102,2018-08-21,2,6,LE PANACHE (V369),M L Yeung,T P Yung,4,B,12L,7 7 6,1.13.40,,Raced at rear; needs further.,ST_AWT,1200,HK_2015_V369
2018082102,2018-08-21,2,7,MONEY WINNER (A055),K C Leung,Y S Tsui,3,,12-1/2L,6 6 7,1.13.44,,Being niggled along early; ran on ordinary.,ST_AWT,1200,HK_2016_A055
2018082103,2018-08-21,3,1,TURF SPRINT (T396),Z Purton,W Y So,2,H,,1 1 1,1.01.98,,Led all the way to score; moved better than before.,ST_AWT,1050,HK_2014_T396
2018082103,2018-08-21,3,2,SUPER EIGHTEEN (A323),C Wong,A T Millard,5,B,2-1/2L,2 2 2,1.02.39,Passed,On pace for 2nd with plenty in hand.,ST_AWT,1050,HK_2016_A323
2018082103,2018-08-21,3,3,ALL BEST FRIENDS (A217),H N Wong,K L Man,3,B,3L,5 5 3,1.02.44,,Quickened for 3rd when shifted out at 200m.,ST_AWT,1050,HK_2016_A217
2018082103,2018-08-21,3,4,FLYING MONKEY (T361),K C Leung,T P Yung,1,,3-1/2L,3 3 4,1.02.52,,On pace early; raced under his own steam in the Straight.,ST_AWT,1050,HK_2014_T361
2018082103,2018-08-21,3,5,SICHUAN BOSS (V416),K Teetan,A T Millard,7,XB/B,4-1/2L,7 6 5,1.02.71,Passed,Ran on OK when clear in the Straight.,ST_AWT,1050,HK_2015_V416
2018082103,2018-08-21,3,6,SPIRIT (B235),D Whyte,M J Freedman,6,,5L,4 4 6,1.02.78,,Niggled along throughout; failed to quicken.,ST_AWT,1050,HK_2017_B235
2018082103,2018-08-21,3,7,FATE FIRE (B020),A Sanna,T P Yung,4,H,22L,6 7 7,1.05.50,,Flattened halfway and gave ground.,ST_AWT,1050,HK_2017_B020
2018082104,2018-08-21,4,1,MONEY MARSHAL (B134),D Whyte,M J Freedman,1,CP,,3 1 1,1.02.20,,Hit the front in the Straight to score; performed progressively.,ST_AWT,1050,HK_2017_B134
2018082104,2018-08-21,4,2,CALIFORNIA ELITE (A413),G van Niekerk,M J Freedman,4,B,3-1/4L,7 3 2,1.02.72,,Made progress saving ground; ran on for 2nd comfortably.,ST_AWT,1050,HK_2016_A413
2018082104,2018-08-21,4,3,MULTIMAX (T129),K C Ng,A S Cruz,2,CP,3-1/2L,1 2 3,1.02.74,,Fought on gamely for 3rd; ran on OK.,ST_AWT,1050,HK_2014_T129
2018082104,2018-08-21,4,4,EXPONENTS (A031),H N Wong,Y S Tsui,3,V,6L,6 5 4,1.03.15,,Made progress steadily; ran on comfortably.,ST_AWT,1050,HK_2016_A031
2018082104,2018-08-21,4,5,JUMBO BUS (A369),U Rispoli,T P Yung,5,,6-1/4L,2 4 5,1.03.21,,On pace early; kept on one-paced in the Straight.,ST_AWT,1050,HK_2016_A369
2018082104,2018-08-21,4,6,KIROV (S277),M F Poon,D J Hall,8,,6-1/2L,8 8 6,1.03.24,,Ran on OK when persuaded in the Straight.,ST_AWT,1050,HK_2013_S277
2018082104,2018-08-21,4,7,CALIFORNIA GUNGHO (B204),C Murray,M J Freedman,9,,7-3/4L,9 9 7,1.03.44,,Taken back early; ran on fairly well from behind.,ST_AWT,1050,HK_2017_B204
2018082104,2018-08-21,4,8,THE HAPPY BUNCH (B121),A Sanna,M J Freedman,6,B,8-1/4L,4 6 8,1.03.53,,Gave ground when asked in the Straight.,ST_AWT,1050,HK_2017_B121
2018082104,2018-08-21,4,9,FUN TIMES (B079),C Wong,A T Millard,7,,9-1/2L,5 7 9,1.03.70,Passed,Gave ground when asked; unimpressive.,ST_AWT,1050,HK_2017_B079
2018082201,2018-08-22,1,1,ROMANTIC TOUCH (S393),K Teetan,A S Cruz,4,,,4 3 1,1.09.94,,Ran on to score impressively when persuaded in the Straight.,ST_AWT,1200,HK_2013_S393
2018082201,2018-08-22,1,2,KING GENKI (V181),K C Ng,A S Cruz,1,,SH,1 1 2,1.09.95,,Led along the rail; just caught.,ST_AWT,1200,HK_2015_V181
2018082201,2018-08-22,1,3,EPTIMUM (B305),T H So,L Ho,3,H,4L,2 2 3,1.10.56,,Shared lead early; under a hold in the Straight.,ST_AWT,1200,HK_2017_B305
2018082201,2018-08-22,1,4,CIRCUIT HASSLER (A041),D Whyte,A S Cruz,2,B/H,6-3/4L,3 4 4,1.11.02,,Niggled along throughout; no progress.,ST_AWT,1200,HK_2016_A041
2018082201,2018-08-22,1,5,GENERAL SHERMAN (V125),K C Leung,A S Cruz,5,,14-3/4L,5 5 5,1.12.30,,Outpaced early; raced under his own steam.,ST_AWT,1200,HK_2015_V125
2018082202,2018-08-22,2,1,DOLLAR REWARD (A305),Z Purton,C S Shum,2,P,,3 3 1,1.10.28,,Dashed centre track; won impressively.,ST_AWT,1200,HK_2016_A305
2018082202,2018-08-22,2,2,MULTIGOGO (A204),K C Ng,A S Cruz,4,H,Neck,2 2 2,1.10.35,,Always in touch; ran 2nd comfortably.,ST_AWT,1200,HK_2016_A204
2018082202,2018-08-22,2,3,VIVA COUNCIL (A190),M F Poon,L Ho,1,H,1L,1 1 3,1.10.44,,Led along the rail; kept on ok for 3rd.,ST_AWT,1200,HK_2016_A190
2018082202,2018-08-22,2,4,PROUD SKY (V406),M L Yeung,L Ho,3,,7L,7 6 4,1.11.40,,Made ground when hard ridden in the Straight.,ST_AWT,1200,HK_2015_V406
2018082202,2018-08-22,2,5,ASSOCIATION FANS (V207),M Chadwick,L Ho,6,H/SR,7L,4 4 5,1.11.42,,Laying in slightly when asked at 300m.,ST_AWT,1200,HK_2015_V207
2018082202,2018-08-22,2,6,LET US WIN (V381),H T Mo,L Ho,8,V,7-1/4L,5 7 6,1.11.43,,Been sweating up; ran on ordinary.,ST_AWT,1200,HK_2015_V381
2018082202,2018-08-22,2,7,POSITIVELY HIGH (B245),T H So,L Ho,7,H,9-1/4L,8 8 7,1.11.78,,Slightly slow to begin; raced awkwardly.,ST_AWT,1200,HK_2017_B245
2018082202,2018-08-22,2,8,HAPPY LIFE (V134),K C Leung,L Ho,5,H,10L,6 5 8,1.11.87,,Began moderately; not tested.,ST_AWT,1200,HK_2015_V134
2018082203,2018-08-22,3,1,PRANCE DRAGON (B349),D Whyte,M J Freedman,2,,,1 1 1,1.02.35,Passed,Slightly slow to begin; then pressed forward; kept on to score.,ST_AWT,1050,HK_2017_B349
2018082203,2018-08-22,3,2,GO GO WIN (S073),C Wong,P F Yiu,3,,SH,2 2 2,1.02.37,Failed,Always in touch; ran on OK.,ST_AWT,1050,HK_2013_S073
2018082203,2018-08-22,3,3,BIZ POWER (B052),C Murray,M J Freedman,4,CP,1L,4 4 3,1.02.50,Passed,Ran on well when shifted out in the Straight.,ST_AWT,1050,HK_2017_B052
2018082203,2018-08-22,3,4,SURE SUPREME (B233),K C Leung,M J Freedman,1,,2L,3 3 4,1.02.69,,Saved ground throughout; raced greenly.,ST_AWT,1050,HK_2017_B233
2018082401,2018-08-24,1,1,SOUTHERN LEGEND (A252),Z Purton,C Fownes,8,V,,8 7 1,1.10.43,,Dashed on comfortably to score impressively.,ST_AWT,1200,HK_2016_A252
